youtube_id,description_en,acquired_from,description_ar,recording_date,location_latitude,location_longitude,location,reference_code,type_of_violationgm0sz7zdaz0,Russian airstrikes against civilians in Karm-Aljabal in Aleppo,Orient News,"¯¨¯±ôâ ¯Â¯øô_¯ø ôãôãôà¯øô ôà ¯¬ôâ¯µô ¯Âôöô_ ôã¯¤ôöôã ôÉ¯±¯© ¯_ôãôä ¯¤ôã¯¤¯_ô_¯¤¯Á ¯¤ôã¯«¯±ôâô_¯©",2016-09-18 21:21:00+00:00,,,ALEPPO : Karam al-Jabal, RU_2564,Alleged civilian casualties from Russian attacksDAxvWt4UcmI,Russian airstrikes in Homs suburbs with incendiary weapons,Orient News,¯¤ôã¯á¯¤¯_¯±¯¤¯» ¯¤ôã¯±ôö¯_ô_¯© ¯»ôâ¯µô ¯±ô_ô ¯_ôÉ¯µ ¯¬¯¤ôãôâô ¯¤¯¬ôã ¯¤ôãô ¯¤¯¬¯¤ôãôÉ ôö¯¤ôãôôö¯_ôôö¯± ¯¤ôãôÉ¯_¯±ôÉ¯© ¯øôöôãô_¯¤ôÜ,2016-09-17 06:55:00+00:00,,,HOMS : Talbisah,RU_2565,Alleged civilian casualties from Russian attacksfjI77Xeq6Dk,Russian airstrike in Idlib with cluster bombs,Orient News,¯¤¯_¯»ôà¯ø¯¤ô ¯¤ôã¯áô_¯±¯¤ô  ¯¤ôã¯±ôö¯_ô_ ôã¯¤¯øôã¯¬ ¯¬¯¤ôãôâô ¯¤¯¬ôã ¯¤ôã¯_ô ôâôö¯øô_¯©,2016-09-13 08:45:00+00:00,,,IDLIB,RU_2566,Alleged civilian casualties from Russian attacks1ukS5AhI6u8,Russian airstrikes causing 4 causalities from the same family ,Orient News,ôà¯ÂôÉ¯¤¯» ¯¤ôã¯áô_¯±¯¤ô  ¯¤ôã¯±ôö¯_ô_ ¯»ôâ¯»ôã ¯£¯±¯¬¯_¯© ¯£ô¯±¯¤¯ø ôÉô  ¯£¯_¯±¯© ôö¯¤¯_¯ø¯© ¯¬ôÄô¯±ô ¯¤ôà¯¤,2016-09-10 21:24:00+00:00,,,ALEPPO : Kafar Naha,RU_2567,Alleged civilian casualties from Russian attackshyFvy01v2EM,25 casualties as a result of Russian airstrikes that targeted a public market in Idlib,Orient News,25 ¯«ôàô_¯ø¯¤ ¯¬¯¼¯¤¯±¯¤¯» ¯±ôö¯_ô_¯© ¯_ôãôä ¯¤ôãôÉ¯øô_ô ¯©,2016-09-10 16:30:00+00:00,,,IDLIB,RU_2568,Alleged civilian casualties from Russian attackswyjZ3SVZueI,Casualties as a result of alleged Russian attacks on a bakery ,SMART News Agency,¯¦¯_¯¤ô_¯¤ ôô_ ôâ¯µô ¯Âôöô_ ¯_ôãôä ô¯±ô  ôô_ ¯_¯±ô_¯»¯¤ô  ¯«ôÉ¯¤ôã ¯_ôã¯¬ ôÉô  ôâ¯¬ôã ¯áô_¯±¯¤ô  ¯_¯±¯¬ô_ ô_¯±¯Â¯_ ¯£ô ôà ¯±ôö¯_ô_,2016-05-27 14:20:00+00:00,,,ALEPPO : Harithan,RU_2563,Alleged civilian casualties from Russian attacksbbJas2y0lRE,11 civilian casualties and injured as a result of Russian attacks in Aleppo,SMART News Agency - ôöôÄ¯¤ôã¯© ¯_ôÉ¯¤¯±¯» ôãôã¯£ô ¯¬¯¤¯Á,11 ôâ¯»ô_ôã¯¤ôÜ ôö¯Â¯±¯_ôä ôÉ¯øô ô_ôöô  ôô_ ôâ¯µô ¯Âôöô_ ¯±ôö¯_ô_ ¯_ôãôä ¯£¯_ô_¯¤¯Á ¯¬¯_ôã¯¬,2016-04-22 09:53:50+00:00,36.1942,37.140459,ALEPPO : Bustan al-Qasr,RU_2562,Alleged civilian casualties from Russian attacksR1V5I7p99hI,Aleppo_News: the first moment when the Russian aircraft targeted Al-Hobait town in the countryside of Idlib.,¯«¯¬ôÄ¯© ¯_ôã¯¬ ô ô_ôö¯_ - Halab News Network,¯_ôã¯¬_ô ô_ôö¯_ : ¯¤ôãôã¯_¯ü¯¤¯» ¯¤ôã¯£ôöôãôä ôã¯¤¯_¯»ôà¯ø¯¤ô ¯áô_¯±¯¤ô  ¯¤ôã¯_¯øôö¯¤ô  ¯¤ôã¯±ôö¯_ô_ ¯¬ôã¯ø¯© ¯¤ôãôà¯¬ô_¯á ôô_ ¯±ô_ô ¯´¯øôã¯¬ 2016/3/13,2016-03-13 14:51:12+00:00,35.4387845,36.5363219,IDLIB : Hobait,RU_1001,Alleged civilian casualties from Russian attacksnWb5Iwa38dk,Russian planes launched a raid on Kafr Nabudeh in Hama countryside ,SMART News Agency - ôöôÄ¯¤ôã¯© ¯_ôÉ¯¤¯±¯» ôãôã¯£ô ¯¬¯¤¯Á,¯¤ôã¯á¯¤¯_¯±¯¤¯» ¯¤ôã¯±ôö¯_ô_¯© ¯»¯«ô  ¯¼¯¤¯±¯© ¯_ôãôä ôÄô¯±ô ¯¬ôö¯ø¯© ¯¬¯±ô_ô ¯_ôÉ¯¤ôà,2016-03-13 14:31:41+00:00,35.433661,36.49441,HAMA : Kafr Nabudah,RU_1002,Alleged civilian casualties from Russian attackssWJWJfYc1o8,"Noureddine, the child who lost his legs as a result of cluster bombs dropped on the city of Duma in Damascus countryside",SMO Syria,ô ôö¯± ¯¤ôã¯øô_ô  ¯¤ôã¯áôôã ¯¤ôã¯¡ô_ ôôâ¯ø ¯_¯¤ôâô_ôà ¯Â¯±¯¤¯Á ¯¤ôã¯µôö¯¤¯±ô_¯¨ ¯¤ôã¯_ô ôâôö¯øô_¯© ¯_ôãôä ôÉ¯øô_ô ¯© ¯øôöôÉ¯¤ ¯¬¯±ô_ô ¯øôÉ¯«ôâ,2016-03-13 11:09:09+00:00,33.5709426,36.3968945,DAMASCUS : Duma,RU_1003,Alleged civilian casualties from Russian attacks864HZdDbX68,Destruction in al-Atarib as a result of the Russian airstrikes,Syrian Network for Human Rights,¯_ôã¯¬ ‰ÛÒ ¯¤ôã¯£¯»¯¤¯±¯¬: ¯¢¯Ç¯¤¯± ôâ¯µô ¯¤ôã¯áô_¯±¯¤ô  ¯¤ôã¯_¯±¯¬ô_ ô_¯_¯_ôÉ ¯¤ô ôà ¯±ôö¯_ô_ ¯¤ôãôÉ¯øô_ô ¯© ¯¬¯¤ôã¯µôö¯¤¯±ô_¯¨ 11 3 2016,2016-03-12 22:25:20+00:00,36.1393709,36.8234774,ALEPPO : Al atarib,RU_1004,Alleged civilian casualties from Russian attacksgB2QRDQPUc4,More than 20 air strikes and 200 shells dropped on Kafr Nabudah and its surroundings in Hama countryside,¯¤ôãôÉ¯±ôÄ¯_ ¯¤ôã¯µ¯_ôô_ ¯¤ôã¯_ôö¯±ô_-Syrian Press Centre,¯£ôÄ¯Ç¯± ôÉô  20 ¯¼¯¤¯±¯© ¯Âôöô_¯© ôö 200 ôâ¯¡ô_ô¯© ¯_ôãôä ôÉ¯øô_ô ¯© ôÄô¯±ô ¯¬ôö¯ø¯© ôöôÉ¯_ô_¯áôà¯¤ ôô_ ¯±ô_ô ¯_ôÉ¯¤¯©,2016-03-12 20:43:30+00:00,35.433661,36.49441,HAMA : Kafr Nabudah,RU_1005,Alleged civilian casualties from Russian attackspmwaP9GR1i4,Agency Qassioun || Russian aircraft flying in the skies above Kafr Nabudah in Hama countryside ,Qasioun News Agency,ôöôÄ¯¤ôã¯© ôâ¯¤¯_ô_ôöô || ¯»¯_ôãô_ôâ ¯áô_¯±¯¤ô  ¯¤ôã¯±ôö¯_ô_ ôô_ ¯_ôÉ¯¤¯Á ôÄô¯±ô ¯¬ôö¯ø¯© ¯¬¯±ô_ô ¯_ôÉ¯¤¯© 12-3-2016,2016-03-12 18:52:14+00:00,35.433661,36.49441,HAMA : Kafr Nabudah,RU_1006,Alleged civilian casualties from Russian attacksq87XgPvcLv4,# witness | The first moments military aircraft targeting the town Alhbit Hama countryside in airstrike,¯«¯¬ôÄ¯© ¯_ôã¯¬ ô ô_ôö¯_ - Halab News Network,#¯«¯¤ôà¯ø | ¯¤ôãôã¯_¯ü¯¤¯» ¯¤ôã¯£ôöôãôä ôã¯¤¯_¯»ôà¯ø¯¤ô ¯¤ôã¯áô_¯±¯¤ô  ¯¤ôã¯_¯±¯¬ô_ ôã¯¬ôã¯ø¯© ¯¤ôãôà¯¬ô_¯á ôô_ ¯±ô_ô ¯_ôÉ¯¤¯© ¯¬¯¼¯¤¯±¯© ¯Âôöô_¯© 2016/3/12,2016-03-12 15:43:30+00:00,35.4387845,36.5363219,IDLIB : Hobait,RU_1007,Alleged civilian casualties from Russian attacks6mDLwS5iKa0,Coordinating Palmyra - burning one of the transport of food as a result of shelling of civilian trucks by Russian aviation,Palmyra Coordination,¯»ô ¯_ô_ôâô_¯© ¯»¯øôÉ¯± - ¯¤¯_¯»¯±¯¤ôâ ¯¤¯_¯øôä ¯¤ôã¯«¯¤¯_ô ¯¤¯» ¯¤ôãôÉ¯øô ô_¯© ¯¤ôãôÉ¯¨¯µ¯µ¯© ôãô ôâôã ¯¤ôãôÉôö¯¤¯ø ¯¤ôã¯¼¯¡¯¤¯_ô_¯© ô ¯»ô_¯Â¯© ôâ¯µôôà¯¤ ¯¬¯¤ôã¯áô_¯±¯¤ô  ¯¤ôã¯±ôö¯_ô_,2016-03-11 19:30:15+00:00,34.55972222,38.31583333,HOMS : Palmyra,RU_1008,Alleged civilian casualties from Russian attackszXHpy4xdVmA,Coordinating Palmyra - the effects of the destruction in the homes of civilians resulting from the shelling by the aviation of Russain accupation on the city's ,Palmyra Coordination,¯»ô ¯_ô_ôâô_¯© ¯»¯øôÉ¯± - ¯¢¯Ç¯¤¯± ¯¤ôã¯øôÉ¯¤¯± ôô_ ôÉô ¯¤¯_ôã ¯¤ôãôÉ¯øô ô_ô_ô  ¯¤ôãô ¯¤¯»¯Â ¯_ô  ôâ¯µô ¯áô_¯±¯¤ô  ¯¤ôã¯¤¯_¯»ôã¯¤ôã_¯¤ôã¯±ôö¯_ô_ ¯_ôãôä ¯¤ôãôÉ¯øô_ô ¯©,2016-03-11 16:20:55+00:00,34.55972222,38.31583333,HOMS : Palmyra,RU_1009,Alleged civilian casualties from Russian attacksVHJ5GXcIIJk,Agency Qassioun | The moment Russian aviation bombed al-Maraj in Damascus countryside.,Qasioun News Agency,ôöôÄ¯¤ôã¯© ôâ¯¤¯_ô_ôöô | ôã¯_¯ü¯© ôâ¯µô ¯¤ôã¯áô_¯±¯¤ô  ¯¤ôã¯±ôö¯_ô_ ¯_ôãôä ôÉô ¯áôâ¯© ¯¤ôãôÉ¯±¯Â ¯¬¯±ô_ô ¯øôÉ¯«ôâ 11-3-2016,2016-03-11 15:40:07+00:00,33.5709426,36.3968945,DAMASCUS : Duma,RU_1010,Alleged civilian casualties from Russian attacksGuSVsqFDvIc,Coordinating Palmyra - a terrifying video showing heavy shelling on civilians by Russian aircraft.,Palmyra Coordination,¯»ô ¯_ô_ôâô_¯© ¯»¯øôÉ¯± - ôô_¯øô_ôö ôÉ¯±¯_¯¬ ô_ôö¯¦¯_ ¯¤ôãôâ¯µô ¯¤ôã¯_ô ô_ô ¯_ôãôä ¯¤ôãôÉ¯øô ô_ô_ô  ôÉô  ôâ¯¬ôã ¯¤ôã¯áô_¯±¯¤ô  ¯¤ôã¯±ôö¯_ô_ 10-3-2016,2016-03-10 17:25:32+00:00,34.55972222,38.31583333,HOMS : Palmyra,RU_1011,Alleged civilian casualties from Russian attacks37tTE-Zg6zQ,Report: Regime and Russian aircraft bombing forcing camp residents to flee for a second time in the countryside of Latakia,baladi- news,¯»ôâ¯±ô_¯±: ôâ¯µô ¯¤ôãô ¯ü¯¤ôÉ ôö¯¤ôã¯áô_¯±¯¤ô  ¯¤ôã¯±ôö¯_ô_ ô_¯Â¯¬¯± ¯_ôÄ¯¤ô  ¯¤ôãôÉ¯¨ô_ôÉ¯¤¯» ¯_ôãôä ¯¤ôãô ¯_ôö¯_ ôÉ¯±¯© ¯Ç¯¤ô ô_¯© ôô_ ¯±ô_ô ¯¤ôãôã¯¤¯¡ôâô_¯©,2016-03-09 12:28:10+00:00,35.7874449,36.0372269,LATTAKIA : Jabal Turkman,RU_1012,Alleged civilian casualties from Russian attacks4aAkadE4vTU,Coordinating Palmyra - the massive destruction caused by Russian aircraft bombing of the city this morning,Palmyra Coordination,¯»ô ¯_ô_ôâô_¯© ¯»¯øôÉ¯± - ¯¢¯Ç¯¤¯± ¯¤ôã¯øôÉ¯¤¯± ¯¤ôãôà¯¤¯_ôã ¯Â¯±¯¤¯Á ¯¤ôãôâ¯µô ôÉô  ¯¤ôã¯áô_¯±¯¤ô  ¯¤ôã¯±ôö¯_ô_ ¯_ôãôä ¯¤ôãôÉ¯øô_ô ¯© ¯µ¯¬¯¤¯_ ¯¤ôãô_ôöôÉ 9-3-2016,2016-03-09 11:43:56+00:00,34.55972222,38.31583333,HOMS : Palmyra,RU_1013,Alleged civilian casualties from Russian attacksuc6lGcbEC3s,Coordinating Palmyra - one of the Russian aircarft raids on the city's neighborhoods,Palmyra Coordination,¯»ô ¯_ô_ôâô_¯© ¯»¯øôÉ¯± - ¯´¯_¯øôä ¯¼¯¤¯±¯¤¯» ¯¤ôã¯áô_¯±¯¤ô  ¯¤ôã¯±ôö¯_ô_ ¯_ôãôä ¯£¯_ô_¯¤¯Á ¯¤ôãôÉ¯øô_ô ¯© 9 3 2016,2016-03-09 10:22:39+00:00,34.55972222,38.31583333,HOMS : Palmyra,RU_1014,Alleged civilian casualties from Russian attacksUGB5Z2JGV-8,Destruction in Idlib as a result of the Russian airstrikes,Syrian Network for Human Rights,¯´¯øôã¯¬ ‰ÛÒ ¯¤ôãô ¯¤¯Âô_¯©: ¯øôÉ¯¤¯±¯Â¯±¯¤¯Á ôâ¯µô ¯¤ôã¯áô_¯±¯¤ô  ¯¤ôã¯_¯±¯¬ô_ ô_¯_¯_ôÉ ¯¤ô ôà ¯±ôö¯_ô_ ¯¤ôã¯¬ôã¯ø¯© ¯¬¯¤ôã¯µôö¯¤¯±ô_¯¨ 8 3 2016,2016-03-09 07:29:46+00:00,35.790646,36.212012,IDLIB : Al-Najeya,RU_1015,Alleged civilian casualties from Russian attacksru1RC8-5jtE,Remnants of rocket fired during Russian bombing of the city of al-Lataminah in Hama,¯¤ôãôÉ¯±ôÄ¯_ ¯¤ôã¯µ¯_ôô_ ¯¤ôã¯_ôö¯±ô_-Syrian Press Centre,¯»ô¯Âô_¯± ¯µ¯¤¯±ôö¯¨ ôÉô  ôÉ¯¨ôãô¯¤¯» ¯¤ôãôâ¯µô ¯¤ôã¯±ôö¯_ô_ ¯_ôãôä ôÉ¯øô_ô ¯© ¯¤ôãôã¯á¯¤ôÉô ¯© ôô_ ¯±ô_ô ¯_ôÉ¯¤¯©,2016-03-06 20:22:09+00:00,35.326749,36.621766,HAMA : latamneh,RU_1016,Alleged civilian casualties from Russian attacks4VGv_YoaynI,Destruction and damage in the field hospital as a result of the Russian airstrikes,Syrian Network for Human Rights,¯´¯øôã¯¬ ‰ÛÒ ¯¤ôã¯_¯¤ôÉ¯øô_¯©: ¯øôÉ¯¤¯± ôô_ ¯¤ôãôÉ¯«ôôä ¯¤ôãôÉô_¯ø¯¤ô ô_ ¯Â¯±¯¤¯Á ôâ¯µô ¯áô_¯±¯¤ô  ¯_¯±¯¬ô_ ô_¯_¯_ôÉ ¯¤ô ôà ¯±ôö¯_ô_ ¯¬¯¤ôã¯µôö¯±¯¤ô_¯¨ ¯ÂôÛ1 15 2 2016,2016-03-06 17:57:53+00:00,"35å¡36'58.51""N","36å¡39'18.96""E",IDLIB : Al hamidia,RU_1017,Alleged civilian casualties from Russian attacks4YvR6SxE8k4,Remnants of cluster bomb dropped during Russian aggression on the city of al-Lataminah in Hama countryside,ôÉ¯_ôÉôö¯ø ¯¤ôã¯_ôÉôöô_-Mahmoud Alhamwi,¯»ô¯Âô_¯± ¯µ¯¤¯±ôö¯¨ ¯_ô ôâôö¯øô_ ôÉô  ôÉ¯¨ôãô¯¤¯» ¯¤ôã¯_¯øôö¯¤ô  ¯¤ôã¯±ôö¯_ô_ ¯_ôãôä ôÉ¯øô_ô ¯© ¯¤ôãôã¯á¯¤ôÉô ¯© ¯¬¯±ô_ô ¯_ôÉ¯¤¯© 6 3 2016,2016-03-06 11:49:52+00:00,35.326749,36.621766,HAMA : latamneh,RU_1018,Alleged civilian casualties from Russian attacksFPVwqiL_5MM,Destruction in 2 ambulances due to suspected Russian shelling 26 Feb 2016 ,Syrian Network for Human Rights,¯»¯¦¯±¯± ¯_ô_¯¤¯±¯»ô_ ¯¤¯_¯_¯¤ô ¯Â¯±¯¤¯Á ôâ¯µô ¯áô_¯±¯¤ô  ¯_¯±¯¬ô_ ô_¯_¯_ôÉ ¯£ô ôà ¯±ôö¯_ô_,2016-03-06 01:17:19+00:00,36.2833397,36.8499899,ALEPPO : Darat Izzah,RU_1019,Alleged civilian casualties from Russian attacksrIDJQHRcmlY,Desctruction and damage in a school as a result of the Russian airstrikes on Hayyan,Syrian Network for Human Rights,¯_ôã¯¬ ‰ÛÒ ¯_ô_¯¤ô : ¯øôÉ¯¤¯± ôô_ ôÉ¯ø¯±¯_¯© ¯Â¯±¯¤¯Á ôâ¯µô ¯áô_¯±¯¤ô  ¯¤ôã¯_¯±¯¬ô_ ô_¯_¯_ôÉ ¯¤ô ôà ¯±ôö¯_ô_ ¯¬¯¤ôã¯µôö¯±¯¤ô_¯¨ ¯ÂôÛ 2 2 2 2016,2016-03-06 01:17:19+00:00,36.3248097,37.0586887,ALEPPO : Hayyan,RU_1020,Alleged civilian casualties from Russian attacks7cWXjCm1ES0,Desctruction and damage in Al sheikh qassem mousque as a result of the Russian airstrikes on Hayyan,Syrian Network for Human Rights,¯_ôã¯¬ ‰ÛÒ ¯_ô_¯¤ô : ¯øôÉ¯¤¯± ôô_ ôÉ¯_¯Â¯ø ¯¤ôã¯«ô_¯¨ ôâ¯¤¯_ôÉ ¯Â¯±¯¤¯Á ôâ¯µô ¯áô_¯±¯¤ô  ¯¤ôã¯_¯±¯¬ô_ ô_¯_¯_ôÉ ¯¤ô ôà ¯±ôö¯_ô_ ¯¬¯¤ôã¯µôö¯±¯¤ô_¯¨ ¯ÂôÛ2 10 2 2016,2016-03-06 01:17:19+00:00,36.3248097,37.0586887,ALEPPO : Hayyan,RU_1021,Alleged civilian casualties from Russian attacksSCANedw247E,Destruction in Aleppo as a result of the Russian airstrikes,Syrian Network for Human Rights,¯_ôã¯¬ ‰ÛÒ ¯¤ôãôÉô_¯_¯±: ¯øôÉ¯¤¯± ôô_ ¯¤ôã¯_ô_ ¯Â¯±¯¤¯Á ôâ¯µô ¯áô_¯±¯¤ô  ¯¤ôã¯_¯±¯¬ô_ ô_¯_¯_ôÉ ¯¤ô ôà ¯±ôö¯_ô_ ¯¬¯¤ôã¯µôö¯±¯¤ô_¯¨ 20 2 2016,2016-03-06 01:17:18+00:00,36.1961392,37.1830665,,RU_1022,Alleged civilian casualties from Russian attacksVe4Sx2NtLaE,Desctruction and damage in a school as a result of the Russian airstrikes on Hayyan,Syrian Network for Human Rights,¯_ôã¯¬ ‰ÛÒ ¯_ô_¯¤ô : ¯øôÉ¯¤¯± ôô_ ôÉ¯ø¯±¯_¯© ¯Â¯±¯¤¯Á ôâ¯µô ¯áô_¯±¯¤ô  ¯¤ôã¯_¯±¯¬ô_ ô_¯_¯_ôÉ ¯¤ô ôà ¯±ôö¯_ô_ ¯¬¯¤ôã¯µôö¯±¯¤ô_¯¨ 10 2 2016,2016-03-06 01:17:18+00:00,36.3248097,37.0586887,ALEPPO : Hayyan,RU_1023,Alleged civilian casualties from Russian attacks2Fav8se5IP8,Desctruction and damage in a school as a result of the Russian airstrikes on Hayyan,Syrian Network for Human Rights,¯_ôã¯¬ ‰ÛÒ ¯_ô_¯¤ô : ¯øôÉ¯¤¯± ôô_ ôÉ¯ø¯±¯_¯© ¯Â¯±¯¤¯Á ôâ¯µô ¯áô_¯±¯¤ô  ¯¤ôã¯_¯±¯¬ô_ ô_¯_¯_ôÉ ¯¤ô ôà ¯±ôö¯_ô_ ¯¬¯¤ôã¯µôö¯±¯¤ô_¯¨ ¯ÂôÛ 1 2 2 2016,2016-03-06 01:17:18+00:00,36.3248097,37.0586887,ALEPPO : Hayyan,RU_1024,Alleged civilian casualties from Russian attackscLIKcJaLuIs,Aleppo - Tal Refaat: Destruction as a result of bombing by allegedly Russian warplanes.,Syrian Network for Human Rights,¯_ôã¯¬ ‰ÛÒ ¯»ôã ¯±ô¯_¯»: ¯øôÉ¯¤¯± ¯Â¯±¯¤¯Á ôâ¯µô ¯áô_¯±¯¤ô  ¯¤ôã¯_¯±¯¬ô_ ô_¯_¯_ôÉ ¯¤ô ôà ¯±ôö¯_ô_ ¯¤ôãôÉ¯øô_ô ¯© ¯¬¯¤ôã¯µôö¯±¯¤ô_¯¨ ¯ÂôÛ2 1 2 2016,2016-03-06 01:17:18+00:00,36å¡28'36N,37å¡5‰Û_50‰Û_E,ALEPPO : Tal Rifaat,RU_1025,Alleged civilian casualties from Russian attacksa0SNtaT369Y,Destruction in Aleppo as a result of the Russian airstrikes,Syrian Network for Human Rights,¯_ôã¯¬ ‰ÛÒ ¯¤ôã¯µ¯¤¯¨ôö¯±: ¯øôÉ¯¤¯± ¯Â¯±¯¤¯Á ôâ¯µô ¯áô_¯±¯¤ô  ¯¤ôã¯_¯±¯¬ô_ ô_¯_¯_ôÉ ¯¤ô ôà ¯±ôö¯_ô_ ¯¤ôã¯_ô_ ¯¬¯¤ôã¯µôö¯±¯¤ô_¯¨ 5 2 2106,2016-03-06 01:17:17+00:00,36.2203437,37.1804809,ALEPPO : Sakhour,RU_1026,Alleged civilian casualties from Russian attacksqpkOBwsBtkQ,A survivor of the bombing of the Russian airline's Hospital # MSF recounts the details of what has happened during hospital bombing,almarra today,‰ÛÇô ¯¤¯Âô_¯© ôÉô  ôâ¯µô ¯¤ôã¯áô_¯±¯¤ô  ¯¤ôã¯±ôö¯_ô_ ôãôÛ ‰ÛÇ#‰ÛôÉ¯«ôôä_¯£¯á¯¬¯¤¯Á‰ÛÂ _¯¬ôã¯¤_¯_¯øôö¯ø ¯»¯±ôöô_ ¯»ô¯¤¯µô_ôã ôÉ¯¤ ¯_¯ø¯Ç ôâ¯µô ¯¤ôãôÉ¯«ôôä,2016-03-05 18:02:05+00:00,35.6478097,36.6679429,IDLIB : Maret Numan,RU_1027,Alleged civilian casualties from Russian attacksyGnNmFs08JI,The suffering of residents in the countryside of the city of Homs in removing the devastation  from homes because of the bombing of the frequent flight,¯_ô_ô  ¯_ôãôä ¯¤ôãôö¯áô -Ein ala watan media office,ôÉ¯_¯¤ô ¯¤¯© ¯¤ôã¯¤ôà¯¤ôãô_ ôô_ ¯±ô_ô ôÉ¯øô_ô ¯© ¯_ôÉ¯µ ôô_ ¯¤¯_¯¤ôã¯© ¯¤ôã¯øôÉ¯¤¯± ¯_ô  ¯¤ôãôÉô ¯¤¯_ôã ¯¬¯_¯¬¯¬ ôâ¯µô ¯¤ôã¯áô_¯±¯¤ô  ¯¤ôãôÉ¯»ôÄ¯±¯±,2016-03-03 15:10:29+00:00,34.91639,36.733818,HOMS,RU_1028,Alleged civilian casualties from Russian attacksWzTJZfSR9b4,Syria - Damascus: Monitoring the devastation caused by the repeated shelling of the city is Dumaa by Russian aircraft,SMO Syria,¯_ôö¯±ô_¯¤ - ¯±ô_ô ¯øôÉ¯«ôâ : ¯±¯µ¯ø ¯¤ôã¯øôÉ¯¤¯± ¯¤ôã¯¡ô_ ¯¨ôãôôà ¯¤ôãôâ¯µô ¯¤ôãôÉ¯»ôÄ¯±¯± ôãôÉ¯øô_ô ¯© ¯øôöôÉ¯¤ ôÉô  ôâ¯¬ôã ¯¤ôã¯á¯¤¯_¯±¯¤¯» ¯¤ôã¯±ôö¯_ô_¯©,2016-03-02 14:09:39+00:00,33.5709426,36.3968945,DAMASCUS : Duma,RU_1029,Alleged civilian casualties from Russian attacksuz3Xkk2QjSc,The effects of the destruction caused by the bombing of the Russian occupation planes on the city Dumaa Damascus countryside,baladi- news,¯¢¯Ç¯¤¯± ¯¤ôã¯øôÉ¯¤¯± ¯Â¯±¯¤¯Á ôâ¯µô ¯á¯¤¯_¯±¯¤¯» ¯¤ôã¯¤¯_¯»ôã¯¤ôã ¯¤ôã¯±ôö¯_ô_ ¯_ôãôä ôÉ¯øô_ô ¯© ¯øôöôÉ¯¤ ¯¬¯±ô_ô ¯øôÉ¯«ôâ 2016/3/2,2016-03-02 10:43:29+00:00,33.5709426,36.3968945,DAMASCUS : Duma,RU_1030,Alleged civilian casualties from Russian attacksXbPoo54Pq9Y,Agency Qassioun | Hama Hirbnafsah Russian aviation penetrates the armistice with several raids on the village,Qasioun News Agency,ôöôÄ¯¤ôã¯© ôâ¯¤¯_ô_ôöô | ¯±ô_ô ¯_ôÉ¯¤¯© ¯_¯± ¯¬ô ô¯_¯© ¯áô_¯±¯¤ô  ¯¤ôã¯±ôö¯_ô_ ô_¯¨¯»¯±ôâ ¯¤ôãôà¯øô ¯© ¯¬¯_¯ø¯© ¯¼¯¤¯±¯¤¯» ¯_ôãôä ¯¤ôãôâ¯±ô_¯© 1-3-2016,2016-03-01 20:51:18+00:00,34.9376702,36.6298663,,RU_1031,Alleged civilian casualties from Russian attacksK81AE34jHZ8,Civil Defense || heading to al-Zeiniyah village after bombing with ballistic missile 1/3/2016,media.civildefense idlib,¯¤ôã¯øô¯¤¯_ ¯¤ôãôÉ¯øô ô_ || ¯¤ôã¯»ôö¯Âôà ¯´ôãôä ôâ¯±ô_¯© ¯¤ôã¯_¯_ô_ô ô_¯© ¯¬¯_¯ø ôâ¯µôôà¯¤ ¯¬¯¤ôã¯µôö¯¤¯±ô_¯¨ ¯¤ôã¯¬¯¤ôã¯_¯»ô_¯© 1-3-2016,2016-03-01 16:06:49+00:00,"35å¡48'45""N","36å¡19'16""E",IDLIB : Jisr ash-Shughur,RU_1032,Alleged civilian casualties from Russian attacks2TI2LdkF3NM,"Targeting the main roads to the villages of the western countryside of Jisr al-Shughurwith cluster bombs and the response of the Bdama team 1/3/2016",media.civildefense idlib,¯£¯_¯»ôà¯ø¯¤ô ¯¤ôã¯á¯±ôâ ¯¤ôã¯±¯_ô_¯_ô_¯© ôãôâ¯±ôä ¯±ô_ô ¯Â¯_¯± ¯¤ôã¯«¯¼ôö¯± ¯¤ôã¯¼¯±¯¬ô_ ¯¬¯¤ôã¯µôö¯¤¯±ô_¯¨ ¯¤ôã¯_ô ôâôö¯øô_¯© ôöô¯±ô_ôâ ¯¬¯ø¯¤ôÉ¯¤ ô_¯_¯»¯Âô_¯¬ 1-3-2016,2016-03-01 15:31:04+00:00,"35å¡48'45""N","36å¡19'16""E",IDLIB : Jisr ash-Shughur,RU_1033,Alleged civilian casualties from Russian attacksyTjc2tlrMBY,Rural southern Hama Hirbnafsah # raids by aviation of the Russian occupation on the town,motasem homs,¯±ô_ô ¯_ôÉ¯¤ôà ¯¤ôã¯Âô ôö¯¬ô_ ¯_¯±¯¬ô ô¯_ôà#¯¼¯¤¯±¯» ôÉô  ¯áô_¯±¯¤ô  ¯¤ôã¯¤¯_¯»ôã¯¤ôã ¯¤ôã¯±ôö¯_ô_ ¯_ôãôä ¯¤ôã¯¬ôã¯ø¯©1/3/2016,2016-03-01 15:15:05+00:00,34.9376702,36.6298663,,RU_1034,Alleged civilian casualties from Russian attacksIdyWg7OlZCg,Aircraft of the Russian occupation violate the ceasefire and bombed the village of Kubeineh in several air raids in Idlib countryside 1/3/2016,baladi- news,¯áô_¯±¯¤ô  ¯¤ôã¯¤¯_¯»ôã¯¤ôã ¯¤ôã¯±ôö¯_ô_ ô_¯¨¯±ôâ ¯¤ôãôà¯øô ¯© ôöô_ôâ¯µô ôâ¯±ô_¯© ôÄ¯¬ô_ô ¯© ¯¬¯_¯ø¯© ¯¼¯¤¯±¯¤¯» ¯Âôöô_¯© ¯¬¯±ô_ô ¯´¯øôã¯¬ 2016/3/1,2016-03-01 14:51:35+00:00,35.9266549,36.6180588,IDLIB,RU_1035,Alleged civilian casualties from Russian attacksCP7fPYwt-FY,Targeting al-Zeiniyah village with long-range ballistic missiles on the fourth day of the ceasefire 1/3/2016,media.civildefense idlib,¯£¯_¯»ôà¯ø¯¤ô ôâ¯±ô_¯© ¯¤ôã¯_¯_ô_ô ô_¯© ¯¬¯¤ôã¯µôö¯¤¯±ô_¯¨ ¯¤ôã¯¬¯¤ôã¯_¯»ô_¯© ¯¬¯_ô_¯ø¯© ¯¤ôãôÉ¯øôä ôô_ ô_ôöôÉ ¯¤ôãôà¯øô ¯© ¯¤ôã¯±¯¤¯¬¯_ 1-3-2016,2016-03-01 13:53:59+00:00,"35å¡48'45""N","36å¡19'16""E",IDLIB : Jisr ash-Shughur,RU_1036,Alleged civilian casualties from Russian attacksyqZIDKCcMjs,Bdama Civil Defence documenting the bombing of the village al-Zeiniyah with ballistic missiles 1/3/2016,media.civildefense idlib,¯¤ôã¯øô¯¤¯_ ¯¤ôãôÉ¯øô ô_ ¯¬¯ø¯¤ôÉ¯¤ ô_ôö¯Çôâ ôâ¯µô ôâ¯±ô_¯© ¯¤ôã¯_¯_ô_ô ô_¯© ¯¬¯µôö¯¤¯±ô_¯¨ ¯¤ôã¯¬¯¤ôã¯_¯»ô_¯© ôâ¯¬ôã ôâôãô_ôã 1-3-2016,2016-03-01 13:44:01+00:00,35.813577,36.217,IDLIB : Bdama,RU_1037,Alleged civilian casualties from Russian attacksELSgK_dZ0mo,Strikes and barrels and artillery shelling on Hirbnafsah in the fourth day of the armistice,SMART News Agency - ôöôÄ¯¤ôã¯© ¯_ôÉ¯¤¯±¯» ôãôã¯£ô ¯¬¯¤¯Á,¯¼¯¤¯±¯¤¯» ôö¯¬¯±¯¤ôÉô_ôã ôöôâ¯µô ôÉ¯øô¯_ô_ ¯_ôãôä ¯_¯± ¯¬ô ô¯_ôà ôô_ ¯±¯¤¯¬¯_ ¯£ô_¯¤ôÉ ¯¤ôãôà¯øô ¯©,2016-03-01 11:09:40+00:00,34.9376702,36.6298663,,RU_1038,Alleged civilian casualties from Russian attacksvCxtHlZ7Gug,A clear violation to the ceasefire: Termala village is targeted by vacuum rockets fired by Russian warplanes.,ôâô ¯¤¯© ¯¤ôã¯Â¯_¯± ¯¤ôãô¯¦¯¤¯_ô_¯©-Jisr satellite media channel,¯¨¯±ôâ ôö¯¤¯¦¯_ ôãôãôà¯øô ¯© ¯¤¯_¯»ôà¯ø¯¤ô ôâ¯±ô_¯© ¯»¯±ôÉôã¯¤ ¯¬¯¤ôã¯µôö¯¤¯±ô_¯¨ ¯¤ôãô¯±¯¤¯¼ô_¯© ôÉô  ¯¤ôã¯áô_¯±¯¤ô  ¯¤ôã¯_¯±¯¬ô_ ¯¤ôã¯±ôö¯_ô_,2016-02-29 19:56:40+00:00,35.6141381,36.5606273,IDLIB : Kafranbel nahiyah,RU_1039,Alleged civilian casualties from Russian attacksEl0hWPbrebc,"Huraytan || A report on the child who survived Russian bombardment of the city 2/2/2016",¯¤ôãôÉôÄ¯»¯¬ ¯¤ôã¯´¯_ôã¯¤ôÉô_ ¯_¯±ô_¯»¯¤ô -Harithan media centre,¯_¯±ô_¯»¯¤ô  || ¯»ôâ¯±ô_¯± ¯_ô  ¯¤ôã¯áôôã ¯¤ôã¯¡ô_ ô ¯Â¯¤ ôÉô  ¯¤ôãôâ¯µô ¯¤ôã¯±ôö¯_ô_ ¯_ôãôä ¯¤ôãôÉ¯øô_ô ¯© ¯¬¯»¯¤¯±ô_¯¨ 2-2-2016,2016-02-29 17:14:07+00:00,36.287871,37.0838783,ALEPPO : Harithan,RU_1040,Alleged civilian casualties from Russian attacksyXbaW-PLI2w,Hirbnafsah 36 raid on the third day of the armistice,SMART News Agency - ôöôÄ¯¤ôã¯© ¯_ôÉ¯¤¯±¯» ôãôã¯£ô ¯¬¯¤¯Á,36 ¯¼¯¤¯±¯© ¯_ôãôä ¯_¯±¯¬ô ô¯_ôà ôô_ ¯Ç¯¤ôã¯Ç ¯£ô_¯¤ôÉ ¯¤ôãôà¯øô ¯©,2016-02-29 16:33:00+00:00,34.9376702,36.6298663,,RU_1041,Alleged civilian casualties from Russian attacksa3jUg50l0O0,Sham Aleppo Kafr Hamra local council for the town manager denied any presence Al-nosar front in the region,ShaamNetwork S.N.N,¯«¯¤ôÉ ¯±ô_ô ¯_ôã¯¬ ôÄô¯±¯_ôÉ¯±¯© ôÉ¯øô_¯± ¯¤ôãôÉ¯Âôã¯_ ¯¤ôãôÉ¯_ôãô_ ôãôã¯¬ôã¯ø¯© ô_ô ôô_ ¯£ô_ ¯»ôö¯¤¯Â¯ø ôã¯Â¯¬ôà¯© ¯¤ôãô ¯µ¯±¯© ôô_ ¯¤ôãôÉô ¯áôâ¯© 29 2 2016,2016-02-29 13:23:26+00:00,36.253303,37.087435,ALEPPO : Kafr hamrah,RU_1042,Alleged civilian casualties from Russian attacksRtiZGwMP9QM,"Unified Observatory: Talking about breach of the ceasefire in Kafr Zita, Hama countryside",¯¤ôãôÉ¯±ôÄ¯_ ¯¤ôã¯µ¯_ôô_ ¯¤ôã¯_ôö¯±ô_-Syrian Press Centre,¯¤ôãôÉ¯±¯µ¯ø ¯¤ôãôÉôö¯_¯ø ô_¯»¯_¯ø¯Ç ¯_ô  ¯¨¯±ôâ ¯¤ôãôà¯øô ¯© ôô_ ôÄô¯±¯_ô_¯»¯¤ ¯¬¯±ô_ô ¯_ôÉ¯¤¯©,2016-02-29 13:09:10+00:00,35.373461,36.601458,HAMA : KafrZita,RU_1043,Alleged civilian casualties from Russian attacksP8QlOWPo2CY,"Eyewitnesses assert breaking the ceasefire and Russian planes bombing the city of Dara Aza on Sunday morning",ShaamNetwork S.N.N,¯«ôàôö¯ø ¯_ô_¯¤ô  ô_¯_ôÄ¯øôöô  ¯¨¯±ôâ ¯¤ôãôà¯øô ¯© ôöôâ¯µô ¯¤ôã¯á¯¤¯_¯±¯¤¯» ¯¤ôã¯±ôö¯_ô_¯© ôÉ¯øô_ô ¯© ¯ø¯¤¯±¯© ¯_¯_¯© ¯µ¯¬¯¤¯_ ô_ôöôÉ ¯£ôÉ¯_ ¯¤ôã¯£¯_¯ø 28 2 2016,2016-02-29 13:02:54+00:00,36.2833397,36.8499899,ALEPPO : Darat Izzah,RU_1044,Alleged civilian casualties from Russian attacks6cdLQiu_aEA,The first violation of the ceasefire by Russian warplanes in Kafr Zita in northern Hama countryside,¯¤ôãôÉ¯±ôÄ¯_ ¯¤ôã¯µ¯_ôô_ ¯¤ôã¯_ôö¯±ô_-Syrian Press Centre,¯£ôöôã ¯¨¯±ôâ ôãôãôà¯øô ¯© ôÉô  ôâ¯¬ôã ¯¤ôã¯áô_¯±¯¤ô  ¯¤ôã¯_¯±¯¬ô_ ¯¤ôã¯±ôö¯_ô_ ¯«ôÉ¯¤ôã ôÉ¯øô_ô ¯© ôÄô¯±¯_ô_¯»¯¤ ôô_ ¯±ô_ô ¯_ôÉ¯¤¯©,2016-02-29 13:02:15+00:00,35.373461,36.601458,HAMA : KafrZita,RU_1045,Alleged civilian casualties from Russian attacksW5eem2womus,The place where rockets landed,¯«¯¬ôÄ¯© ¯»ôã¯¬ô_¯_¯© ôÉ¯¬¯¤¯«¯±-Talbisah network,¯»ôôâ¯ø ôÉôÄ¯¤ô  ¯_ôâôö¯á ¯¤ôã¯µôö¯¤¯±ô_¯¨ ¯¤ôãô¯±¯¤¯¼ô_¯© ôÉô  ôâ¯¬ôã ¯¤ôã¯áô_¯±¯¤ô  ¯¤ôã¯_¯±¯¬ô_ ¯¤ôã¯±ôö¯_ô_,2016-02-29 12:13:50+00:00,34.8015188,36.7085659,HOMS : Ter Maela,RU_1046,Alleged civilian casualties from Russian attacks2D6gIwBY4KM,Unified Observatory in the town of Kafr Zita documents warplanes violation and targeting the town airstrike,¯_ô_ô  ¯_ôãôä ¯¤ôãôö¯áô -Ein ala watan media office,¯¤ôãôÉ¯±¯µ¯ø ¯¤ôãôÉôö¯_¯ø ôô_ ¯¬ôã¯ø¯© ôÄô¯±¯_ô_¯»¯¤ ô_ôö¯Çôâ ¯¤ô ¯»ôà¯¤ôÄ ¯¤ôã¯áô_¯±¯¤ô  ¯¤ôã¯_¯±¯¬ô_ ôö¯¤¯_¯»ôà¯ø¯¤ô ¯¤ôã¯¬ôã¯ø¯© ¯¬¯¼¯¤¯±¯© ¯Âôöô_¯© 29\2\2016,2016-02-29 11:37:02+00:00,35.373461,36.601458,HAMA : KafrZita,RU_1047,Alleged civilian casualties from Russian attacksaDHBb5il-eg,Continuous massacres committed by Russian aerial bombardment on Kobtan Al Jabal town before and after the ceasefeire.,ôâô ¯¤¯© ¯¤ôã¯Â¯_¯± ¯¤ôãô¯¦¯¤¯_ô_¯©-Jisr satellite media channel,ôÉ¯Â¯¤¯_¯± ôÉ¯»ôÄ¯±¯±¯© ôãôãôâ¯µô ¯¤ôã¯Âôöô_ ¯¤ôã¯±ôö¯_ô_ ¯_ôãôä ¯¬ôã¯ø¯© ôâ¯¬¯»¯¤ô  ¯¤ôã¯Â¯¬ôã ôâ¯¬ôã ¯¤ôãôà¯øô ¯© ôö ¯¬¯_¯øôà¯¤,2016-02-29 11:33:06+00:00,36.2666667,36.95,ALEPPO : Qabtan al Jabal,RU_1048,Alleged civilian casualties from Russian attacks5cxGc_bPQ-0,"Russian warplanes targeted farmland north of the city of Kafr Zita",¯_ô_ô  ¯_ôãôä ¯¤ôãôö¯áô -Ein ala watan media office,¯¤ôã¯áô_¯±¯¤ô  ¯¤ôã¯_¯±¯¬ô_ ¯¤ôã¯±ôö¯_ô_ ô_¯_¯»ôà¯øô ¯¤ôã¯¤¯±¯¤¯¦ô_ ¯¤ôã¯±¯_¯_ô_¯© ¯¤ôãôö¯¤ôâ¯_¯© ¯«ôÉ¯¤ôã ôÉ¯øô_ô ¯© ôÄô¯±¯_ô_¯»¯¤ 29\2\2016,2016-02-29 10:26:42+00:00,35.373461,36.601458,HAMA : KafrZita,RU_1049,Alleged civilian casualties from Russian attacksCz1CO35V6D0,The United Observatory talks about the Russian bombardment on the Kafarzeta city of Hama province on the third day of ceasefire.,ôÉ¯_ôÉôö¯ø ¯¤ôã¯_ôÉôöô_-Mahmoud Alhamwi,¯¤ôãôÉ¯±¯µ¯ø ¯¤ôãôÉôö¯_¯ø ôÉ¯»¯_¯ø¯Ç¯¤ôÜ ¯_ô  ¯¤ôãôâ¯µô ¯¤ôã¯±ôö¯_ô_ ôãôÉ¯øô_ô ¯© ôÄô¯±¯_ô_¯»¯¤ ¯¬¯±ô_ô ¯_ôÉ¯¤¯© ôô_ ¯Ç¯¤ôã¯Ç ¯£ô_¯¤ôÉ ¯¤ôãôà¯øô ¯© 29 2 2016,2016-02-29 09:11:00+00:00,35.373461,36.601458,HAMA : KafrZita,RU_1050,Alleged civilian casualties from Russian attacksRTbvsehuxmg,Yesterday's violation of the ceasefire by Russian aircraft bombing Darat Izzah city on Sunday morning 28/2/2016,ôÉ¯±ôÄ¯_ ¯_ôã¯¬ ¯¤ôã¯´¯_ôã¯¤ôÉô_ AMC-Aleppo media centre,¯«ôàôö¯ø ¯_ô_¯¤ô  ô_¯_ôÄ¯øôöô  ¯¨¯±ôâ ¯¤ôãôà¯øô ¯© ôöôâ¯µô ¯¤ôã¯á¯¤¯_¯±¯¤¯» ¯¤ôã¯±ôö¯_ô_¯© ôÉ¯øô_ô ¯© ¯ø¯¤¯±¯© ¯_¯_¯© ¯µ¯¬¯¤¯_ ô_ôöôÉ ¯£ôÉ¯_ ¯¤ôã¯£¯_¯ø 28-2-2016,2016-02-29 07:38:16+00:00,36.2833397,36.8499899,ALEPPO : Darat Izzah,RU_1051,Alleged civilian casualties from Russian attacksrWs6k-JkiD4,Russian warplanes break the ceasefire and bombard agricultural fields of the Kafarzeta city of Hama province.,ôÉ¯_ôÉôö¯ø ¯¤ôã¯_ôÉôöô_-Mahmoud Alhamwi,¯¤ôã¯áô_¯±¯¤ô  ¯¤ôã¯_¯±¯¬ô_ ¯¤ôã¯±ôö¯_ô_ ô_¯¨¯±ôâ ¯¤ôãôà¯øô ¯© ôöô_ôâ¯µô ¯¤ôã¯£¯±¯¤¯¦ô_ ¯¤ôã¯_¯±¯¤¯_ô_¯© ôãôÉ¯øô_ô ¯© ôÄô¯±¯_ô_¯»¯¤ ¯¬¯±ô_ô¯¤ ¯_ôÉ¯¤¯© 29 2 2016,2016-02-29 07:22:12+00:00,35.373461,36.601982,HAMA : KafrZita,RU_1052,Alleged civilian casualties from Russian attacks8BGh1Xx1BJY,Talbiseh - Homs: Ahmed al-Daqa was killed while dismantling the remnants of the Russian bombing of Talbiseh [GRAPHIC],¯»¯ÂôÉ¯_ ¯Çôö¯¤¯± ¯_ôö¯±ô_¯¤ SRG,¯»ôã¯¬ô_¯_¯© -¯_ôÉ¯µ: ¯¤¯_¯»¯«ôà¯¤¯ø ¯¤¯_ôÉ¯ø ¯¤ôã¯øôâ¯© ¯¤¯Çô ¯¤¯Á ¯»ôôÄô_ôÄôà ôãôÉ¯¨ôãô¯¤¯» ¯¤ôãôâ¯µô ¯¤ôã¯±ôö¯_ô_ ¯_ôãôä ôÉ¯øô_ô ¯© ¯»ôã¯¬ô_¯_¯©,2016-02-28 22:52:40+00:00,34.833601,36.735749,HOMS : Talbisah,RU_1053,Alleged civilian casualties from Russian attacksleKCpIzJce0,Paneling - Homs: Martyrdom of  Ahmed Sheikh Hamoud by Russain Air raids on the Hirbnafsah front southern countryside of Hama,¯»¯ÂôÉ¯_ ¯Çôö¯¤¯± ¯_ôö¯±ô_¯¤ SRG,¯»ôã¯¬ô_¯_¯© - ¯_ôÉ¯µ: ¯¤¯_¯»¯«ôà¯¤¯ø ¯¤¯_ôÉ¯ø ¯¤ôã¯«ô_¯¨ ¯_ôÉôö¯ø ¯¬¯¼¯¤¯±¯¤¯» ôãôã¯áô_¯±¯¤ô  ¯¤ôã¯±ôö¯_ô_ ¯_ôãôä ¯Â¯¬ôà¯© ¯_¯±¯¬ô ô¯_¯© ¯¬¯±ô_ô ¯_ôÉ¯¤ôà ¯¤ôã¯Âô ôö¯¬ô_,2016-02-28 22:03:52+00:00,34.9376702,36.6298663,,RU_1054,Alleged civilian casualties from Russian attacksn5cbTcYbnPE,"Russian aircraft targeting the village of Hirbnafsah with 25 raids on the second day of the ceasefire",SMART News Agency - ôöôÄ¯¤ôã¯© ¯_ôÉ¯¤¯±¯» ôãôã¯£ô ¯¬¯¤¯Á,¯¤ôã¯á¯¤¯_¯±¯¤¯» ¯¤ôã¯±ôö¯_ô_¯© ¯»¯_¯»ôà¯øô ôâ¯±ô_¯© ¯_¯±¯¬ô ô¯_ôà ¯¬ôÛ 25 ¯¼¯¤¯±¯© ôô_ ¯¤ôãô_ôöôÉ ¯¤ôã¯Ç¯¤ô ô_ ôãôãôà¯øô ¯©,2016-02-28 19:42:59+00:00,34.9376702,36.6298663,HAMA : Hirbinafsah,RU_1055,Alleged civilian casualties from Russian attacksTEVkHL-7t90,"Homs: Fourth raid on the town of Teir Maalah by Russian warplanes on the second day of the ceasefire 28/2/2016",¯»¯ÂôÉ¯_ ¯Çôö¯¤¯± ¯_ôö¯±ô_¯¤ SRG,¯_ôÉ¯µ ¯¤ôã¯¼¯¤¯±¯© ¯¤ôã¯±¯¤¯¬¯_¯© ôÉô  ¯¤ôã¯áô_¯±¯¤ô  ¯¤ôã¯_¯±¯¬ô_ ¯¤ôã¯±ôö¯_ô_ ¯_ôãôä ¯¬ôã¯ø¯© ¯»ô_¯±ôÉ¯_ôã¯© ¯Ç¯¤ô ô_ ¯£ô_¯¤ôÉ ¯¤ôãôà¯øô ¯©28-2-2016,2016-02-28 17:14:13+00:00,34.8015188,36.7085659,HOMS : Ter Maela,RU_1056,Alleged civilian casualties from Russian attacks8A5cvgQjPTo,Homs: Russian warplanes in the skies above Talbiseh during the second day of the ceasefire 28/2/2016,¯»¯ÂôÉ¯_ ¯Çôö¯¤¯± ¯_ôö¯±ô_¯¤ SRG,¯_ôÉ¯µ ¯»¯_ôãô_ôâ ôãôã¯áô_¯±¯¤ô  ¯¤ôã¯_¯±¯¬ô_ ¯¤ôã¯±ôö¯_ô_ ôô_ ¯_ôÉ¯¤¯Á ôÉ¯øô_ô ¯© ¯»ôã¯¬ô_¯_¯© ¯¨ôã¯¤ôã ¯Ç¯¤ô ô_ ¯£ô_¯¤ôÉ ¯¤ôãôà¯øô ¯© 28-2-2016,2016-02-28 16:35:41+00:00,34.833601,36.735749,HOMS : Talbisah,RU_1057,Alleged civilian casualties from Russian attacksordHuH554pU,Step || Watch the Russian air strikes on Teir Maalah and the bombing of Talbiseh in a new breach of the ceasefire,Step News Agency,¯¨¯áôö¯© || ¯«¯¤ôà¯ø ¯¤ôã¯¼¯¤¯±¯¤¯» ¯¤ôã¯Âôöô_¯© ¯¤ôã¯±ôö¯_ô_¯© ¯_ôãôä ¯»ô_¯±ôÉ¯_ôã¯© ôö ôâ¯µô ¯_ôãôä ¯»ôã¯¬ô_¯_¯© ¯¦ôÉô  ¯¨¯±ôâ ¯Â¯øô_¯ø ôãôãôà¯øô ¯©,2016-02-28 16:20:58+00:00,34.833601,36.735749,HOMS : Talbisah,RU_1058,Alleged civilian casualties from Russian attacksPlAahjjtUes,Russian warplanes targeting the town of Teir Maalah in the northern countryside of Homs 28/2/2016,¯_ô_ô  ¯_ôãôä ¯¤ôãôö¯áô -Ein ala watan media office,¯¤ôã¯áô_¯±¯¤ô  ¯¤ôã¯_¯±¯¬ô_ ¯¤ôã¯±ôö¯_ô_ ô_¯_¯»ôà¯øô ¯¬ôã¯ø¯© ¯»ô_¯± ôÉ¯_ôã¯© ôô_ ¯±ô_ô ¯_ôÉ¯µ ¯¤ôã¯«ôÉ¯¤ôãô_ ¯¬¯¤ôã¯µôö¯¤¯±ô_¯¨28\2\2016,2016-02-28 15:59:29+00:00,34.8015188,36.7085659,HOMS : Ter Maela,RU_1059,Alleged civilian casualties from Russian attacks7NxwQjZRM8o,"Paneling Russian plane a new kind of raid on the city",talbisa h,¯»ôã¯¬ô_¯_¯© 28 2 2016 ¯á¯¤¯_¯±¯© ¯±ôö¯_ô_¯© ôÉô  ô ôö¯_ ¯Â¯øô_¯ø ¯»¯¼ô_¯±¯_ôãôä ¯¤ôãôÉ¯øô_ô ¯©,2016-02-28 15:38:10+00:00,34.833601,36.735749,HOMS : Talbisah,RU_1060,Alleged civilian casualties from Russian attacks2_n64J0uKlw,Teir Maalah Homs raids by Russian warplanes center of neighborhoods of the town Teir Maalah,motasem homs,¯»ô_¯±ôÉ¯_ôã¯© ¯_ôÉ¯µ ¯¼¯¤¯±¯¤¯» ôÉô  ¯¤ôã¯áô_¯±¯¤ô  ¯¤ôã¯_¯±¯¬ô_ ¯¤ôã¯±ôö¯_ô_ ôö¯_¯á ¯¤¯_ô_¯¤¯Á ¯¬ôã¯ø¯© ¯»ô_¯±ôÉ¯_ôã¯© 28/2/2016,2016-02-28 15:07:22+00:00,34.8015188,36.7085659,HOMS : Ter Maela,RU_1061,Alleged civilian casualties from Russian attacksZqwxf-UVHZA,Clearing the streets and removing rubble after Russian air strikes,¯«¯¬ôÄ¯© ¯»ôã¯¬ô_¯_¯© ôÉ¯¬¯¤¯«¯±-Talbisah network,ô¯»¯_ ¯¤ôã¯á¯±ôâ¯¤¯» ôö¯´¯_¯¤ôã¯© ¯¤ôã¯£ô ôâ¯¤¯¦ ô ¯»ô_¯Â¯© ¯¤ôã¯¼¯¤¯±¯¤¯» ¯¤ôã¯±ôö¯_ô_¯©,2016-02-28 12:13:50+00:00,34.833601,36.735749,HOMS : Talbisah,RU_1062,Alleged civilian casualties from Russian attacksO_Qg0-bl1TY,The Lattameneh Civil Defense restores roads that were destroyed by Russia.,ôÉ¯_ôÉôö¯ø ¯¤ôã¯_ôÉôöô_-Mahmoud Alhamwi,¯¤ôã¯øô¯¤¯_ ¯¤ôãôÉ¯øô ô_ ôô_ ôÉ¯øô_ô ¯© ¯¤ôãôã¯á¯¤ôÉô ¯© ¯¬¯±ô_ô ¯_ôÉ¯¤¯© ô_ô¯µôã¯_ ¯¤ôã¯á¯±ôâ¯¤¯» ¯¤ôã¯»ô_ ¯øôÉ¯±ôà¯¤ ¯¤ôã¯ø¯¬ ¯¤ôã¯±ôö¯_ô_ 28 2 2016,2016-02-28 12:08:29+00:00,35.326749,36.621766,HAMA : latamneh,RU_1063,Alleged civilian casualties from Russian attacksuIxqvG7gTW0,Shelling by Russian aircrafts on Daret Ezzah this morning.,ôâô ¯¤¯© ¯¤ôã¯Â¯_¯± ¯¤ôãô¯¦¯¤¯_ô_¯©-Jisr satellite media channel,ôâ¯µô ôã¯áô_¯±¯¤ô  ¯¤ôã¯±ôö¯_ô_ ¯_ôãôä ¯ø¯¤¯±¯© ¯_¯_¯© ¯µ¯¬¯¤¯_ ¯¤ôãô_ôöôÉ,2016-02-28 11:54:54+00:00,36.2833397,36.8499899,ALEPPO : Darat Izzah,RU_1064,Alleged civilian casualties from Russian attacksJ3XLbLlmllo,A violation of the ceasefire committed by Russian aircraft in Hirbinafsah in Hama province,SMO Syria,#¯¨¯±ôâ ¯¤ôãôà¯øô ¯© ôÉô  ôâ¯¬ôã ¯¤ôã¯áô_¯±¯¤ô  ¯¤ôã¯±ôö¯_ô_ ¯_ôãôä ¯¬ôã¯ø¯© ¯_¯±¯¬ô ô¯_ôà ¯¬¯±ô_ô ¯_ôÉ¯¤ôà 1,2016-02-28 11:22:32+00:00,34.9376702,36.6298663,,RU_1065,Alleged civilian casualties from Russian attacksktAg_2zGmk4,A violation of the ceasefire committed by Russian aircraft in Hirbinafsah in Hama province,SMO Syria,#¯¨¯±ôâ ¯¤ôãôà¯øô ¯© ôÉô  ôâ¯¬ôã ¯¤ôã¯áô_¯±¯¤ô  ¯¤ôã¯±ôö¯_ô_ ¯_ôãôä ¯¬ôã¯ø¯© ¯_¯±¯¬ô ô¯_ôà ¯¬¯±ô_ô ¯_ôÉ¯¤ôà 2,2016-02-28 11:22:32+00:00,34.9376702,36.6298663,,RU_1066,Alleged civilian casualties from Russian attacksh_AtRaC7GxY,Hama south - Hirbnafsah: a field trip to monitor the destruction happening in the town due to the Russian aviation,¯»¯ÂôÉ¯_ ¯Çôö¯¤¯± ¯_ôö¯±ô_¯¤ SRG,¯±ô_ô ¯_ôÉ¯¤ôà ¯¤ôã¯Âô ôö¯¬ô_ - ¯_¯±¯¬ô ô¯_¯© : ¯Âôöôã¯© ôÉô_¯ø¯¤ô ô_¯© ¯»¯±¯µ¯ø ¯¤ôã¯øôÉ¯¤¯± ¯¤ôã¯_¯¤¯µôã ôô_ ¯¤ôã¯¬ôã¯ø¯© ¯Â¯±¯¤¯Á ¯¤ôã¯áô_¯±¯¤ô  ¯¤ôã¯±ôö¯_ô_,2016-02-28 11:11:15+00:00,34.9376702,36.6298663,,RU_1067,Alleged civilian casualties from Russian attackspgU1g9rJyvA,Russian warplanes fly in the atmosphere of the west countryside of Aleppo after the implementation of several raids on Mudbnh Dara Aza,Mohammed Rasoul,¯»¯_ôãô_ôâ ¯¤ôã¯á¯±¯¤ô  ¯¤ôã¯_¯±¯¬ô_ ¯¤ôã¯±ôö¯_ô_ ôô_ ¯£¯Âôö¯¤¯Á ¯±ô_ô ¯_ôã¯¬ ¯¤ôã¯¼¯±¯¬ô_ ¯¬¯_¯ø ¯»ô ôô_¯¡ ¯_¯ø¯© ¯¼¯¤¯±¯¤¯» ¯_ôãôä ôÉ¯ø¯¬ô ¯© ¯ø¯¤¯±¯© ¯_¯_¯© 28/02/2016,2016-02-28 04:54:25+00:00,36.2833397,36.8499899,ALEPPO : Darat Izzah,RU_1068,Alleged civilian casualties from Russian attacksdWu-7CLHpvw,#Witness: 8 killed by Russian airstrikes on the town of Kafr Hamra in the northern countryside of Aleppo last night 27/2/2016,ôÉ¯±ôÄ¯_ ¯_ôã¯¬ ¯¤ôã¯´¯_ôã¯¤ôÉô_ AMC-Aleppo media centre,#¯«¯¤ôà¯ø ¯ÇôÉ¯¤ô ô_¯© ¯«ôà¯ø¯¤¯Á ¯Â¯±¯¤¯Á ôâ¯µô ¯Âôöô_ ¯±ôö¯_ô_ ¯_ôãôä ¯¬ôã¯ø¯© ôÄô¯± ¯_ôÉ¯±¯© ¯¬¯±ô_ô ¯_ôã¯¬ ¯¤ôã¯«ôÉ¯¤ôãô_ ôãô_ôã¯© ¯£ôÉ¯_ 27-2-2016,2016-02-27 17:03:25+00:00,36.253303,37.087435,ALEPPO : Kafr hamrah,RU_1069,Alleged civilian casualties from Russian attacksOdP2PVrzlNw,"Sham Aleppo countryside Kafr Hamra martyrs the Russian aviation bombarded video very harsh warning",ShaamNetwork S.N.N,¯«¯¤ôÉ ¯±ô_ô ¯_ôã¯¬ ôÄô¯±¯_ôÉ¯±¯© ¯«ôà¯ø¯¤¯Á ¯¬ôâ¯µô ôãôã¯áô_¯±¯¤ô  ¯¤ôã¯±ôö¯_ô_ 27 2 2016 ¯»¯_¯¡ô_¯± ¯¤ôãôô_¯øô_ôö ôâ¯¤¯_ô_ ¯Â¯ø¯¤ôÜ,2016-02-27 15:01:37+00:00,36.253303,37.087435,ALEPPO : Kafr hamrah,RU_1070,Alleged civilian casualties from Russian attacks5f0D2T7pEB0,Russian aircrafts commit a massacre in Kafar Hamra in Aleppo just an hour before the ceasefire began.,ôâô ¯¤¯© ¯¤ôã¯Â¯_¯± ¯¤ôãô¯¦¯¤¯_ô_¯©-Jisr satellite media channel,¯¤ôã¯áô_¯±¯¤ô  ¯¤ôã¯±ôö¯_ô_ ô_¯±¯»ôÄ¯¬ ôÉ¯Â¯_¯±¯© ôô_ ôÄô¯± ¯_ôÉ¯±¯¤ ¯¬¯_ôã¯¬ ôâ¯¬ôã ¯_¯¤¯_¯© ôö¯¤¯_¯ø¯© ôÉô  ¯¬¯ø¯Á ¯¤ôãôà¯øô ¯©,2016-02-27 14:16:24+00:00,36.253303,37.087435,ALEPPO : Kafr hamrah,RU_1071,Alleged civilian casualties from Russian attackseGMGdan99cM,"The massacre of Kafr Hamra",¯¤ôã¯øô¯¤¯_ ¯¤ôãôÉ¯øô ô_ ¯¤ôã¯_ôö¯±ô_ ¯_ôã¯¬-Aleppo civil defense,lôÉ¯Â¯_¯±¯© ôÄô¯± ¯_ôÉ¯±¯©26-2-2016,2016-02-27 13:28:25+00:00,36.253303,37.087435,ALEPPO : Kafr hamrah,RU_1072,Alleged civilian casualties from Russian attacks#NAME?,Step || Watch smoke rising after Russian air strikes on the town of Darat Izzah yesterday,Step News Agency,¯¨¯áôö¯© ||¯«¯¤ôà¯ø ¯»¯µ¯¤¯_¯ø ¯¤ôã¯ø¯¨¯¤ô  ¯Â¯±¯¤¯Á ¯¤ôã¯¼¯¤¯±¯¤¯» ¯¤ôã¯Âôöô_¯© ¯¤ôã¯±ôö¯_ô_¯© ¯_ôãôä ôÉ¯øô_ô ¯© ¯ø¯¤¯±¯© ¯_¯_¯© ô_ôöôÉ ¯£ôÉ¯_,2016-02-27 12:38:21+00:00,36.2833397,36.8499899,ALEPPO : Darat Izzah,RU_1073,Alleged civilian casualties from Russian attacksTDtVh9hRva4,"Russian air force in first violation of the truce bombard "" Maaret Alartiqe"" Aleppo",Step News Agency,¯¨¯±ôâ ¯¤ôãôà¯øô ¯© ôÉô  ôâ¯¬ôã ¯¤ôã¯áô_¯±¯¤ô  ¯¤ôã¯±ôö¯_ô_ ô ¯»ô_¯Â¯© ¯¤ôãôâ¯µô ¯_ôãôä ôÉ¯_¯±¯© ¯¤ôã¯¤¯±¯»ô_ôâ,2016-02-27 11:20:16+00:00,36.250556,37.053611,,RU_1074,Alleged civilian casualties from Russian attacks4hkJXln8qe4,Step || The first violation of the ceasefire by Russian aircraft targeting Ma'arat al-Artiq town in Aleppo countryside 27/2/2016,Step News Agency,¯¨¯áôö¯© || ¯¤ôöôã ¯¨¯±ôâ ôô_ ¯¤ôãôà¯øô ¯© ôÉô  ¯¤ôã¯áô_¯±¯¤ô  ¯¤ôã¯±ôö¯_ô_ ¯¤¯_¯»ôà¯øô ¯¬ôã¯ø¯© ôÉ¯_¯¤¯±¯© ¯¤ôã¯¤¯±¯»ô_ôâ ¯¬¯±ô_ô ¯_ôã¯¬ 27 2 2016,2016-02-27 09:58:58+00:00,36.250556,37.053611,,RU_1075,Alleged civilian casualties from Russian attacks7YHbL5fqzxY,Two families are missing under rubble as a result of an airstrike. The civil defense team is looking for them. ,¯¤ôã¯øô¯¤¯_ ¯¤ôãôÉ¯øô ô_ ¯¤ôã¯_ôö¯±ô_ ¯_ôã¯¬-Aleppo civil defense,ôÉ¯Â¯_¯±¯© ôÄô¯± ¯_ôÉ¯±¯© ¯_¯¤¯_ôã¯»ô_ô  ¯»¯_¯» ¯¤ôã¯¤ô ôâ¯¤¯¦ ôöôÉ¯¤¯_¯¤ôã ¯¤ôã¯¬¯_¯Ç ¯Â¯¤¯±ô_ ôÉô  ôâ¯¬ôã ¯_ô ¯¤¯µ ¯¤ôã¯øô¯¤¯_ ¯¤ôãôÉ¯øô ô_ ¯_ô  ¯¬¯¤ôâô_ ¯¤ôãôÉôôâôö¯øô_ô ,2016-02-27 09:29:10+00:00,36.253303,37.087435,ALEPPO : Kafr hamrah,RU_1076,Alleged civilian casualties from Russian attacks3YHxsoFxpgw,Wounded being transported to a field hospital,¯«¯¬ôÄ¯© ¯»ôã¯¬ô_¯_¯© ôÉ¯¬¯¤¯«¯±-Talbisah network,ô ôâôã ¯£¯_¯ø ¯¤ôã¯Â¯±¯Âôä ¯¤ôãôä ¯¤ôãôÉ¯«ôôä ¯¤ôãôÉô_¯ø¯¤ô ô_,2016-02-27 07:51:15+00:00,34.833601,36.735749,HOMS : Talbisah,RU_1077,Alleged civilian casualties from Russian attacksBn2Ak2POvNM,Russian aircrafts bombard Lattameneh with high explosive rockets hours before the ceasefire.  ,ôÉ¯_ôÉôö¯ø ¯¤ôã¯_ôÉôöô_-Mahmoud Alhamwi,ôâ¯¬ôã ¯¤ôãôà¯øô ¯© ¯¬¯_¯¤¯_¯¤¯» ¯¤ôã¯áô_¯±¯¤ô  ¯¤ôã¯±ôö¯_ô_ ô_ôâ¯µô ôÉ¯øô_ô ¯© ¯¤ôãôã¯á¯¤ôÉô ¯© ¯¬¯µôö¯¤¯±ô_¯¨ ¯«¯øô_¯ø¯© ¯¤ôã¯´ô ô¯Â¯¤¯± 27 2 2016,2016-02-27 06:50:09+00:00,35.326749,36.621766,HAMA : latamneh,RU_1078,Alleged civilian casualties from Russian attackseQTEryVS0tE,Three families including two female children were pulled out from under the rubble an hour before the ceasefire.,¯¤ôãôÉôÄ¯»¯¬ ¯¤ôã¯´¯_ôã¯¤ôÉô_ ôô_ ôÉ¯øô_ô ¯© ôÄô¯±¯_ôÉ¯±¯©-Media office in Kafr hamrah,ôÄô¯±¯_ôÉ¯±¯©: ôÉ¯Â¯_¯±¯© ¯¬¯_ôâ 3 ¯_¯¤¯_ôã¯¤¯» ¯¬ô_ô ôàôÉ ¯áôôã¯»ô_ô  ¯»ôÉ ¯¤¯¨¯±¯¤¯ÂôàôÉ ôÉô  ¯»¯_¯» ¯¤ôã¯¤ô ôâ¯¤¯¦ ôâ¯¬ô_ôã ¯¤ôãôà¯øô ¯© ¯¬¯_¯¤¯_¯© 27-2,2016-02-27 06:05:51+00:00,36.253303,37.087435,ALEPPO : Kafr hamrah,RU_1079,Alleged civilian casualties from Russian attackstutP7RGejAg,"Talbiseh fires in the houses of civilians as a result of Russian raids",talbisa h,¯»ôã¯¬ô_¯_¯© ¯¤¯«¯»¯_¯¤ôã ôãôã¯_¯±¯¤¯_ôâ ôô_ ôÉô ¯¤¯_ôã ¯¤ôãôÉ¯øô ô_ô_ô  ô ¯»ô_¯Â¯© ¯¤ôã¯¼¯¤¯±¯¤¯» ¯¤ôã¯±ôö¯_ô_¯© 26 2 2016,2016-02-26 21:28:48+00:00,34.833601,36.735749,HOMS : Talbisah,RU_1080,Alleged civilian casualties from Russian attacksN8RuGQBLg_0,"Talbiseh injures after Russian bombardment of the city",talbisa h,¯»ôã¯¬ô_¯_¯© 26 2 2016 ¯´¯µ¯¤¯¬¯¤¯» ¯¤ôãôâ¯µô ¯¤ôã¯±ôö¯_ô_ ¯_ôãôä ¯¤ôãôÉ¯øô_ô ¯©,2016-02-26 20:40:20+00:00,34.833601,36.735749,HOMS : Talbisah,RU_1081,Alleged civilian casualties from Russian attacksjdAeT4JB8CE,"Talbiseh a small child infected as a result of Russian raids on the city",talbisa h,¯»ôã¯¬ô_¯_¯© ¯áôôã ¯µ¯¼ô_¯± ôÉ¯µ¯¤¯¬ ô ¯»ô_¯Â¯© ¯¤ôã¯¼¯¤¯±¯¤¯» ¯¤ôã¯±ôö¯_ô_¯© ¯_ôãôä ¯¤ôãôÉ¯øô_ô ¯© 26 2 2016,2016-02-26 20:38:32+00:00,34.833601,36.735749,HOMS : Talbisah,RU_1082,Alleged civilian casualties from Russian attacksiTnkQ-LJc2Y,"Talbiseh injuring a baby as a result of Russian raids",talbisa h,¯»ôã¯¬ô_¯_¯© ¯¤¯µ¯¤¯¬¯© ¯áôôã ¯±¯¦ô_¯_ ô ¯»ô_¯Â¯© ¯¤ôã¯¼¯¤¯±¯¤¯» ¯¤ôã¯±ôö¯_ô_¯© 26 2 2016,2016-02-26 20:20:32+00:00,34.833601,36.735749,HOMS : Talbisah,RU_1083,Alleged civilian casualties from Russian attacks49xFaDikEng,"Talbiseh Homs overnight raids by aviation the Russian occupation targeted city neighborhoods at night",motasem homs,¯»ôã¯¬ô_¯_¯© ¯_ôÉ¯µ ¯¼¯¤¯±¯¤¯» ôãô_ôãô_¯© ôÉô  ¯¤ôã¯áô_¯±¯¤ô  ¯¤ôã¯¤¯_¯»ôã¯¤ôã ¯¤ôã¯±ôö¯_ô_ ô_¯_¯»ôà¯øô ¯¤¯_ô_¯¤¯Á ¯¤ôãôÉ¯øô_ô ¯© ôãô_ôã¯¤26/2/2016,2016-02-26 20:18:05+00:00,34.833601,36.735749,HOMS : Talbisah,RU_1084,Alleged civilian casualties from Russian attacksJUnT-TSmfS0,Sham DamascusDumaa martyrs the Russian aviation bombarded video Warning very tough P3,ShaamNetwork S.N.N,¯«¯¤ôÉ ¯±ô_ô ¯øôÉ¯«ôâ ¯øôöôÉ¯¤ ¯«ôà¯ø¯¤¯Á ¯¬ôâ¯µô ôãôã¯áô_¯±¯¤ô  ¯¤ôã¯±ôö¯_ô_ 26 2 2016 ¯»¯_¯¡ô_¯± ¯¤ôãôô_¯øô_ôö ôâ¯¤¯_ô_ ¯Â¯ø¯¤ôÜ ¯Â3,2016-02-26 19:19:38+00:00,33.5709426,36.3968945,DAMASCUS : Duma,RU_1085,Alleged civilian casualties from Russian attacks7ar2xfTYKQU,8 killed in raids on military aircraft is Dumaa in the Eastern Ghouta,SMART News Agency - ôöôÄ¯¤ôã¯© ¯_ôÉ¯¤¯±¯» ôãôã¯£ô ¯¬¯¤¯Á,8 ôâ¯»ôãôä ôô_ ¯¼¯¤¯±¯¤¯» ôã¯á¯¤¯_¯±¯¤¯» ¯_¯±¯¬ô_¯© ¯_ôãôä ¯øôöôÉ¯¤ ôô_ ¯¤ôã¯¼ôö¯á¯© ¯¤ôã¯«¯±ôâô_¯©,2016-02-26 18:46:08+00:00,33.5709426,36.3968945,DAMASCUS : Duma,RU_1086,Alleged civilian casualties from Russian attackswifSUs3akRc,Three raids on villages in the eastern countryside Talbisa in Homs,SMART News Agency - ôöôÄ¯¤ôã¯© ¯_ôÉ¯¤¯±¯» ôãôã¯£ô ¯¬¯¤¯Á,¯Çôã¯¤¯Ç ¯¼¯¤¯±¯¤¯» ¯_ôãôä ôâ¯±ôä ¯±ô_ô ¯»ôã¯¬ô_¯_¯© ¯¤ôã¯«¯±ôâô_ ôô_ ¯_ôÉ¯µ,2016-02-26 17:36:20+00:00,34.833601,36.735749,HOMS : Talbisah,RU_1087,Alleged civilian casualties from Russian attacksmyWaa88ML_g,"Shahba Press | The flight of Russian warplanes in the skies of the city of Dara Aza countryside west of Aleppo",ôöôÄ¯¤ôã¯© ¯«ôà¯¬¯¤ ¯¬¯±¯_ Shahba Press Agency,¯«ôà¯¬¯¤ ¯¬¯±¯_ | ¯»¯_ôãô_ôâ ¯¤ôã¯áô_¯±¯¤ô  ¯¤ôã¯_¯±¯¬ô_ ¯¤ôã¯±ôö¯_ô_ ôô_ ¯_ôÉ¯¤¯Á ôÉ¯øô_ô ¯© ¯ø¯¤¯±¯© ¯_¯_¯© ¯¬¯±ô_ô ¯_ôã¯¬ ¯¤ôã¯¼¯±¯¬ô_,2016-02-26 17:00:44+00:00,36.2833397,36.8499899,ALEPPO : Darat Izzah,RU_1088,Alleged civilian casualties from Russian attacksbpIZDxhEpQ8,"Anadan || Scenes from the ongoing Russian strikes on the city",¯¤ôãôÉôÄ¯»¯¬ ¯¤ôã¯´¯_ôã¯¤ôÉô_ ¯_¯±ô_¯»¯¤ô -Harithan media centre,¯_ô ¯ø¯¤ô  || ôÉ¯«¯¤ôà¯ø ôÉô  ¯¤ôã¯¼¯¤¯±¯¤¯» ¯¤ôã¯±ôö¯_ô_¯© ¯¤ôãôÉ¯_¯»ôÉ¯±¯© ¯_ôãôä ¯¤ôãôÉ¯øô_ô ¯© 26-2-2016,2016-02-26 15:41:56+00:00,36.2924395,37.041918,ALEPPO : Anadan,RU_1089,Alleged civilian casualties from Russian attacksWJOKydb7SfY,"Dumaa bombardment and fall of 8 martyrs, including Maleeh family ",Yasser Doumany-ô_¯¤¯_¯± ¯¤ôã¯øôöôÉ¯¤ô ô_,¯¤ôãôâ¯µô ¯_ôãôä ¯øôöôÉ¯¤ ôö¯_ôâôö¯á 8¯«ôà¯ø¯¤¯Á ¯¬ô_ô ôàôÉ ¯_¯¤¯_ôã¯© ¯¤ôãôÉôãô_¯_ 2016.2.26,2016-02-26 15:09:49+00:00,33.5709426,36.3968945,DAMASCUS : Duma,RU_1090,Alleged civilian casualties from Russian attacks8sICM8kek98,More than 56 raid in the eastern Ghouta Joubar neighborhood before the armistice,SMART News Agency - ôöôÄ¯¤ôã¯© ¯_ôÉ¯¤¯±¯» ôãôã¯£ô ¯¬¯¤¯Á,¯£ôÄ¯Ç¯± ôÉô  56 ¯¼¯¤¯±¯© ¯_ôãôä ¯¤ôã¯¼ôö¯á¯© ¯¤ôã¯«¯±ôâô_¯© ôö¯_ô_ ¯Âôö¯¬¯± ôâô¯¬ô_ôã ¯¤ôãôà¯øô ¯©,2016-02-26 15:06:04+00:00,33.5296468,36.3848593,DAMASCUS : Eastern Ghouta,RU_1091,Alleged civilian casualties from Russian attacks8sICM8kek98,"More than 56 raid in the eastern Ghouta neighborhood Joubar ahead of the armistice",SMART News Agency - ôöôÄ¯¤ôã¯© ¯_ôÉ¯¤¯±¯» ôãôã¯£ô ¯¬¯¤¯Á,¯£ôÄ¯Ç¯± ôÉô  56 ¯¼¯¤¯±¯© ¯_ôãôä ¯¤ôã¯¼ôö¯á¯© ¯¤ôã¯«¯±ôâô_¯© ôö¯_ô_ ¯Âôö¯¬¯± ôâô¯¬ô_ôã ¯¤ôãôà¯øô ¯©,2016-02-26 15:06:04+00:00,33.538893,36.365787,DAMASCUS : Irbin nahiyah,RU_1092,Alleged civilian casualties from Russian attacks6CuLnr0nFpU,"Step || Saw three Russian fighter jets accompanied by a large cargo aircraft skies  ""the northern countryside  of Homs",Step News Agency,"¯¨¯áôö¯© || ¯«¯¤ôà¯ø ¯Çôã¯¤¯Ç¯© ôÉôâ¯¤¯»ôã¯¤¯» ¯±ôö¯_ô_¯© ¯»¯±¯¤ôôâ ¯á¯¤¯_¯±¯© ¯«¯_ô  ôÄ¯¬ô_¯±¯© ¯¬¯_ôÉ¯¤¯Á ¯±ô_ô ""¯_ôÉ¯µ ¯¤ôã¯«ôÉ¯¤ôãô_",2016-02-26 14:41:57+00:00,34.91639,36.733818,HOMS,RU_1093,Alleged civilian casualties from Russian attacksnnNvNOP8gj0,"Syria - Damascus: air strikes from Russian warplanes on the town of Ein Tarma",SMO Syria,¯_ôö¯±ô_¯¤ - ¯±ô_ô_¯øôÉ¯«ôâ : ¯¼¯¤¯±¯¤¯» ¯Âôöô_¯© ôÉô  ¯¤ôã¯áô_¯±¯¤ô  ¯¤ôã¯_¯±¯¬ô_ ¯¤ôã¯±ôö¯_ô_ ¯_ôãôä ¯¬ôã¯ø¯© ¯_ô_ô  ¯»¯±ôÉ¯¤,2016-02-26 13:54:45+00:00,33.5709426,36.3968945,DAMASCUS : Duma,RU_1094,Alleged civilian casualties from Russian attacksMVeoUv2WTJo,Syria - Damascus: 21 rockets fired by Russian warplanes within two minutes target the Jobar district of Damascus.,SMO Syria,¯_ôö¯±ô_¯¤ - ¯øôÉ¯«ôâ : ôÁô¢ ¯µ¯¤¯±ôö¯¨ ôÉô  ¯¤ôã¯áô_¯±¯¤ô  ¯¤ôã¯_¯±¯¬ô_ ¯¤ôã¯±ôö¯_ô_ ¯_ôãôä ¯øô¯_¯»ô_ô  ¯¤¯_¯»ôà¯øô¯» ¯_ô_ ¯Âôö¯¬¯± ¯¤ôã¯øôÉ¯«ôâô_,2016-02-26 13:04:48+00:00,33.531162,36.336808,DAMASCUS : Jobar,RU_1095,Alleged civilian casualties from Russian attacksDwmhl44yebk,Place of the fall of the missiles by Russian occupation airplanes over Dumaa country side of  Damascus,baladi- news,ôÉôÄ¯¤ô  ¯_ôâôö¯á ¯µôö¯¤¯±ô_¯¨ ¯á¯¤¯_¯±¯¤¯» ¯¤ôã¯¤¯_¯»ôã¯¤ôã ¯¤ôã¯±ôö¯_ô_ ¯_ôãôä ôÉ¯øô_ô ¯© ¯øôöôÉ¯¤ ¯¬¯±ô_ô ¯øôÉ¯«ôâ 2016/2/26,2016-02-26 12:24:31+00:00,33.5709426,36.3968945,DAMASCUS : Duma,RU_1096,Alleged civilian casualties from Russian attacks8v-rDg5t71w,Russian warplanes shell the Lattameneh city of Hama northern province.,ôÉ¯_ôÉôö¯ø ¯¤ôã¯_ôÉôöô_-Mahmoud Alhamwi,¯¤ôã¯áô_¯±¯¤ô  ¯¤ôã¯_¯±¯¬ô_ ¯¤ôã¯±ôö¯_ô_ ô_ôâ¯µô ôÉ¯øô_ô ¯© ¯¤ôãôã¯á¯¤ôÉô ¯© ¯¬¯±ô_ô ¯_ôÉ¯¤¯© ¯¤ôã¯«ôÉ¯¤ôãô_ 26 2 2016,2016-02-26 12:11:03+00:00,35.326749,36.621766,HAMA : latamneh,RU_1097,Alleged civilian casualties from Russian attackslShPPo2vF6M,The Russian occupation airplans launches several air strikes on Jobar neighborhood of Damascus,baladi- news,¯áô_¯±¯¤ô  ¯¤ôã¯¤¯_¯»ôã¯¤ôã ¯¤ôã¯±ôö¯_ô_ ô_¯«ô  ¯_¯ø¯© ¯¼¯¤¯±¯¤¯» ¯Âôöô_¯© ¯_ôãôä ¯_ô_ ¯Âôö¯¬¯± ôô_ ¯øôÉ¯«ôâ 2016/2/26,2016-02-26 12:07:30+00:00,33.531162,36.336808,DAMASCUS : Jobar,RU_1098,Alleged civilian casualties from Russian attacksvHjinlyS_jw,Syria once again more of a flight by the Russian occupation colony Humaimam countryside of lattakia,motasem homs,ôÉ¯Â¯ø¯ø¯¤ ¯_ôö¯±ô_¯¤¯¤ôãôÉ¯_ô_¯ø ôÉô  ¯áô_¯±¯¤ô  ¯¤ôã¯¤¯_¯»ôã¯¤ôã¯¤¯¤ôã¯±ôö¯_ô_ ¯¤ôãôäôä ôÉ¯_¯»¯_ôÉ¯±¯© ¯_ôÉô_ôÉô_ôÉ ¯¬¯±ô_ô ¯¤ôã¯¤¯¡ôâô_¯© 26/2/2016,2016-02-26 11:47:30+00:00,34.91639,36.733818,HOMS,RU_1099,Alleged civilian casualties from Russian attacks44TUoQY_iIY,"Anadan || Scenes from the strikes of Russian warplanes on city",¯¤ôãôÉôÄ¯»¯¬ ¯¤ôã¯´¯_ôã¯¤ôÉô_ ¯_¯±ô_¯»¯¤ô -Harithan media centre,¯_ô ¯ø¯¤ô  || ôÉ¯«¯¤ôà¯ø ôÉô  ¯¤ôã¯¼¯¤¯±¯¤¯» ôÉô  ¯¤ôã¯áô_¯±¯¤ô  ¯¤ôã¯_¯±¯¬ô_ ¯¤ôã¯±ôö¯_ô_ ¯_ôãôä ¯¤ôãôÉ¯øô_ô ¯© 26-2-2016,2016-02-26 11:08:58+00:00,36.2924395,37.041918,ALEPPO : Anadan,RU_1100,Alleged civilian casualties from Russian attacksh61TfjoHNLY,"Russian aircraft bombardment on Jobar neighborhood in Damascus",SMART News Agency - ôöôÄ¯¤ôã¯© ¯_ôÉ¯¤¯±¯» ôãôã¯£ô ¯¬¯¤¯Á,ôâ¯µô ôÉô  ¯¤ôã¯á¯¤¯_¯±¯¤¯» ¯¤ôã¯±ôö¯_ô_¯© ¯_ôãôä ¯_ô_ ¯Âôö¯¬¯± ¯¬¯øôÉ¯«ôâ,2016-02-26 10:41:32+00:00,33.531162,36.336808,DAMASCUS : Jobar,RU_1101,Alleged civilian casualties from Russian attacksGRcfL69aEnk,Agency Qassioun | The moment of launching several Russian raids on the Jobar neighborhood of Damascus,Qasioun News Agency,ôöôÄ¯¤ôã¯© ôâ¯¤¯_ô_ôöô | ôã¯_¯ü¯© ¯«ô  ¯_¯ø¯© ¯¼¯¤¯±¯¤¯» ¯±ôö¯_ô_¯© ¯_ôãôä ¯_ô_ ¯Âôö¯¬¯± ¯¬¯øôÉ¯«ôâ 26-2-2016,2016-02-26 10:28:54+00:00,33.5709426,36.3968945,DAMASCUS : Duma,RU_1102,Alleged civilian casualties from Russian attacksRyaFZJnPYGA,the Russian occupation Aviation bombed Dumaa city by several air strikes in Damascus,baladi- news,¯áô_¯±¯¤ô  ¯¤ôã¯¤¯_¯»ôã¯¤ôã ¯¤ôã¯±ôö¯_ô_ ô_ôâ¯µô ôÉ¯øô_ô ¯© ¯øôöôÉ¯¤ ¯¬¯_¯ø¯© ¯¼¯¤¯±¯¤¯» ¯Âôöô_¯© ôô_ ¯±ô_ô ¯øôÉ¯«ôâ 2016/2/26,2016-02-26 09:43:19+00:00,33.5709426,36.3968945,DAMASCUS : Duma,RU_1103,Alleged civilian casualties from Russian attacksCnbhvstLcpk,"Aleppo || Dozens of strikes from Russian warplanes cities and towns of the northern countryside",¯¤ôãôÉôÄ¯»¯¬ ¯¤ôã¯´¯_ôã¯¤ôÉô_ ¯_¯±ô_¯»¯¤ô -Harithan media centre,¯_ôÛôãôÛ¯¬ || ¯_¯«¯±¯¤¯» ¯¤ôã¯¼¯¤¯±¯¤¯» ôÉô  ¯¤ôã¯áô_¯±¯¤ô  ¯¤ôã¯_¯±¯¬ô_ ¯¤ôã¯±ôö¯_ô_ ¯_ôãôä ôÉ¯øô  ôö¯¬ôã¯ø¯¤¯» ¯¤ôã¯±ô_ô ¯¤ôã¯«ôÉ¯¤ôãô_ 26-2-2016,2016-02-26 07:37:41+00:00,36.287871,37.0838783,ALEPPO : Harithan,RU_1104,Alleged civilian casualties from Russian attacksMxIl4f61YmM,Aftermath of cluster bombs in Ghantoo.,¯«¯¬ôÄ¯© ¯»ôã¯¬ô_¯_¯© ôÉ¯¬¯¤¯«¯±-Talbisah network,ôÉ¯¨ôãô¯¤¯» ¯¤ôãôâô ¯¤¯¬ôã ¯¤ôã¯_ô ôâôö¯øô_¯© ôô_ ¯¤ôã¯¼ô ¯áôö,2016-02-25 15:45:13+00:00,34.8223907,36.6935635,HOMS : Al-Ghantu,RU_1105,Alleged civilian casualties from Russian attacksP2NjystWXws,Step || View the Russian air raids on the Jobar neighborhood of Damascus,Step News Agency,¯¨¯áôö¯© || ¯«¯¤ôà¯ø ¯¤ôã¯¼¯¤¯±¯¤¯» ¯¤ôã¯Âôöô_¯© ¯¤ôã¯±ôö¯_ô_¯© ¯_ôãôä ¯_ô_ ¯Âôö¯¬¯± ¯¤ôã¯øôÉ¯«ôâô_,2016-02-25 15:07:31+00:00,33.5709426,36.3968945,DAMASCUS : Duma,RU_1106,Alleged civilian casualties from Russian attacksPFz0F9BuEF8,"Massive destruction caused by the bombing of Russian warplanes for the city of Al-Lataminah in Hama",¯¤ôãôÉ¯±ôÄ¯_ ¯¤ôã¯µ¯_ôô_ ¯¤ôã¯_ôö¯±ô_-Syrian Press Centre,¯øôÉ¯¤¯± ôà¯¤¯_ôã ¯Â¯±¯¤¯Á ôâ¯µô ¯¤ôã¯áô_¯±¯¤ô  ¯¤ôã¯_¯±¯¬ô_ ¯¤ôã¯±ôö¯_ô_ ôãôÉ¯øô_ô ¯© ‰ÛÇ‰Û¯¤ôãôã¯á¯¤ôÉô ¯© ôô_ ¯±ô_ô ¯_ôÉ¯¤¯©,2016-02-25 14:20:12+00:00,35.326749,36.621766,HAMA : latamneh,RU_1107,Alleged civilian casualties from Russian attacks9ua9tIY4zm8,"Huraytan || The devastation caused by strikes of Russian warplanes on the city",¯¤ôãôÉôÄ¯»¯¬ ¯¤ôã¯´¯_ôã¯¤ôÉô_ ¯_¯±ô_¯»¯¤ô -Harithan media centre,¯_¯±ô_¯»¯¤ô  || ¯¢¯Ç¯¤¯± ¯¤ôã¯øôÉ¯¤¯± ¯Â¯±¯¤¯Á ¯¤ôã¯¼¯¤¯±¯¤¯» ¯¤ôã¯±ôö¯_ô_¯© ¯_ôãôä ¯¤ôãôÉ¯øô_ô ¯© 25-2-2016,2016-02-25 13:59:36+00:00,36.287871,37.0838783,ALEPPO : Harithan,RU_1108,Alleged civilian casualties from Russian attacks1xTD0euEw2U,Consecutive air strikes carried out by Russia leave large destruction in the Lattameneh city of Hama province.,ôÉ¯_ôÉôö¯ø ¯¤ôã¯_ôÉôöô_-Mahmoud Alhamwi,¯¼¯¤¯±¯¤¯» ôÉ¯»ôã¯¤¯_ôâ¯© ô_¯«ô ôà¯¤ ¯¤ôã¯ø¯¬ ¯¤ôã¯±ôö¯_ô_ ôÉ¯_¯ø¯Ç¯¤ôÜ ¯øôÉ¯¤¯± ôà¯¤¯_ôã ôô_ ôÉ¯øô_ô ¯© ¯¤ôãôã¯á¯¤ôÉô ¯© ¯¬¯±ô_ô ¯_ôÉ¯¤¯© 25 2 2016,2016-02-25 13:23:45+00:00,35.326749,36.621766,HAMA : latamneh,RU_1109,Alleged civilian casualties from Russian attacks8hXUlR0PDTM,Qasioun News: Daraa: 3rd airstrike by the russian warplanes over Inkhil city 25-2-2016,Qasion News Agency EN, ôöôÄ¯¤ôã¯© ôâ¯¤¯_ô_ôöô : ¯ø¯±¯_¯¤: ¯¤ôã¯¼¯¤¯±¯© ¯¤ôã¯Âôöô_¯© ¯¤ôã¯Ç¯¤ôã¯Ç¯© ôÉô  ôâ¯¬ôã ¯¤ôã¯áô_¯±¯¤ô  ¯¤ôã¯_¯±¯¬ô_ ¯¤ôã¯±ôö¯_ô_ ¯_ôãôä ôÉ¯øô_ô ¯© ¯¤ô ¯¨ôã. 25-2-2016,2016-02-25 12:37:02+00:00,33.015319,36.127467,DARAA : Inkhil,RU_1110,Alleged civilian casualties from Russian attacksG3Z0j813x6M,Qasioun News: Daraa: Russian warplanes launch an airstrike over Inkhil city 25-2-2016,Qasion News Agency EN, ôöôÄ¯¤ôã¯© ôâ¯¤¯_ô_ôöô : ¯ø¯±¯_¯¤: ¯¤ôã¯áô_¯±¯¤ô  ¯¤ôã¯_¯±¯¬ô_ ¯¤ôã¯±ôö¯_ô_ ô_ô ô¯¡ ¯¼¯¤¯±¯© ¯Âôöô_¯© ¯_ôãôä ôÉ¯øô_ô ¯© ¯¤ô ¯¨ôã. 25-2-2016,2016-02-25 12:36:47+00:00,33.0176527,36.0882419,DARAA : Inkhil,RU_1111,Alleged civilian casualties from Russian attackszwBri4mzuhk,Qasioun news : Russian airstrikes on Eastern Ghouta in countryside of Damascus (1) 24-2-2016,Qasion News Agency EN, ôöôÄ¯¤ôã¯© ôâ¯¤¯_ô_ôöô : ¯¼¯¤¯±¯¤¯» ¯Âôöô_¯© ¯±ôö¯_ô_¯© ¯_ôãôä ¯¤ôã¯¼ôö¯á¯© ¯¤ôã¯«¯±ôâô_¯© ôô_ ¯±ô_ô ¯øôÉ¯«ôâ (1) 24-2-2016,2016-02-25 08:57:59+00:00,33.5296468,36.3848593,DAMASCUS : Eastern Ghouta,RU_1112,Alleged civilian casualties from Russian attacks8um7Li2d0K4,Qasioun news : Russian airstrikes on Inkhil city in countryside of Daraa 24-2-2016,Qasion News Agency EN, ôöôÄ¯¤ôã¯© ôâ¯¤¯_ô_ôöô : ¯¼¯¤¯±¯¤¯» ¯Âôöô_¯© ¯±ôö¯_ô_¯© ¯_ôãôä ôÉ¯øô_ô ¯© ¯¤ô ¯¨ôã ôô_ ¯±ô_ô ¯ø¯±¯_¯¤ 24-2-2016,2016-02-24 22:12:06+00:00,33.0176527,36.0882419,DARAA : Inkhil,RU_1113,Alleged civilian casualties from Russian attacksDKZ1AhfqxYs,Qasioun news : russian airstrikes on Anter hill in northern countryside of Daraa 24-2-2016,Qasion News Agency EN, ôöôÄ¯¤ôã¯© ôâ¯¤¯_ô_ôöô : ¯¼¯¤¯±¯¤¯» ¯Âôöô_¯© ¯±ôö¯_ô_¯© ¯_ôãôä ¯»ôã ¯_ô ¯»¯± ôô_ ¯±ô_ô ¯ø¯±¯_¯¤ ¯¤ôã¯«ôÉ¯¤ôãô_ 24-2-2016,2016-02-24 21:52:50+00:00,32.6228886,36.0819402,DARAA,RU_1114,Alleged civilian casualties from Russian attacksVCBH9VWd6JA,"View Deraa aviation Russian launches air raid on the town of Kafr Nasej",ôÉ¯_¯_¯_¯© ¯«¯¤ôà¯ø ¯¤ôã¯´¯_ôã¯¤ôÉô_¯©-shahed media association,¯«¯¤ôà¯ø ¯ø¯±¯_¯¤ ¯¤ôã¯áô_¯±¯¤ô  ¯¤ôã¯±ôö¯_ô_ ô_¯«ô  ¯¼¯¤¯±¯© ¯Âôöô_¯© ¯_ôãôä ¯¬ôã¯ø¯© ôÄô¯±ô ¯¤¯_¯Â,2016-02-24 19:09:33+00:00,33.1502745,36.0392375,DARAA : Kafr Nasij,RU_1115,Alleged civilian casualties from Russian attacksYUQQahC4fL4,View Aqraba Deraa air strike of the Russian aviation on the town,ôÉ¯_¯_¯_¯© ¯«¯¤ôà¯ø ¯¤ôã¯´¯_ôã¯¤ôÉô_¯©-shahed media association,¯«¯¤ôà¯ø ¯ø¯±¯_¯¤ ¯_ôâ¯±¯¬¯¤ ¯¼¯¤¯±¯© ¯Âôöô_¯© ôÉô  ¯¤ôã¯áô_¯±¯¤ô  ¯¤ôã¯±ôö¯_ô_ ¯_ôãôä ¯¤ôã¯¬ôã¯ø¯©,2016-02-24 18:50:58+00:00,33.1081569,36.0072227,IDLIB : Aqrabat,RU_1116,Alleged civilian casualties from Russian attacksrY-gh5IzcsY,Aleppo - Tell Rifaat || Witness: some of the Russian raids on the city to support the PYD,ôÉ¯øô_ô ¯© ¯»ôã ¯±ô¯_¯» Tall Refaat City,¯±ô_ô ¯_ôã¯¬ - ¯»ôã ¯±ô¯_¯» || ¯«¯¤ôà¯ø : ¯¬¯_¯¦ ôÉô  ¯¤ôã¯¼¯¤¯±¯¤¯» ¯¤ôã¯±ôö¯_ô_¯© ¯¤ôã¯»ô_ ¯¤¯_¯»ôà¯øô¯» ¯¤ôãôÉ¯øô_ô ¯© ôãôÉ¯_¯¤¯_¯±¯© ¯¤ôãôÛPYD,2016-02-24 17:32:19+00:00,36å¡28'36N,37å¡5‰Û_50‰Û_E,ALEPPO : Tal Rifaat,RU_1117,Alleged civilian casualties from Russian attacksxgNcCdkPfwQ, View Anjel Deraa air strike of the Russian aviation targeted the area around the city,ôÉ¯_¯_¯_¯© ¯«¯¤ôà¯ø ¯¤ôã¯´¯_ôã¯¤ôÉô_¯©-shahed media association,¯«¯¤ôà¯ø ¯ø¯±¯_¯¤ ¯¤ô ¯¨ôã ¯¼¯¤¯±¯© ¯Âôöô_¯© ôÉô  ¯¤ôã¯áô_¯±¯¤ô  ¯¤ôã¯±ôö¯_ô_ ¯»¯_¯»ôà¯øô ôÉ¯_ô_¯á ¯¤ôãôÉ¯øô_ô ¯©,2016-02-24 15:32:11+00:00,33.015319,36.127467,DARAA : Inkhil,RU_1118,Alleged civilian casualties from Russian attacksDtto4du2Va8,Aleppo: Claimed Russian warplanes bombed gathering of civilian trucks between Ahras and Harbel 24/12/2015,Syrian Network for Human Rights,¯_ôã¯¬: ôâ¯µô ¯¤ôã¯áô_¯±¯¤ô  ¯¤ôã¯_¯±¯¬ô_ ô_¯_¯_ôÉ ¯¤ô ôà ¯±ôö¯_ô_ ¯¬¯¤ôã¯µôö¯±¯¤ô_¯¨ ¯»¯ÂôÉ¯_¯¤ôÜ ôã¯«¯¤¯_ô ¯¤¯» ôÉ¯øô ô_¯© ¯¬ô_ô  ôâ¯±ô_¯»ô_ ¯¤¯_¯±¯µ ôö¯_¯±¯¬ôã 24 12 2015,2016-02-22 22:09:30+00:00,36.40805,37.153231,ALEPPO : Ahras,RU_1119,Alleged civilian casualties from Russian attacksFdk0h6BlRGk,Aleppo: Burning trucks as a result of alleged Russian airstrike between Ahras and Harbel 24/12/2015,Syrian Network for Human Rights,¯_ôã¯¬:¯´¯_¯»¯±¯¤ôâ ¯«¯¤¯_ô ¯¤¯» ¯Â¯±¯¤¯Á ôâ¯µôôà¯¤ ¯¬¯¤ôã¯áô_¯±¯¤ô  ¯¤ôã¯_¯±¯¬ô_ ô_¯_¯_ôÉ ¯¤ô ôà ¯±ôö¯_ô_ ¯¬¯¤ôã¯µôö¯±¯¤ô_¯¨ ¯¬ô_ô  ôâ¯±ô_¯»ô_ ¯¤¯_¯±¯µ ôö¯_¯±¯¬ôã 24 12 2015,2016-02-22 22:09:30+00:00,36.40805,37.153231,ALEPPO : Ahras,RU_1120,Alleged civilian casualties from Russian attackse_H3B8HkEzg,Intensified hovering by Russian aircrafts in Idlib countryside 22/2/2016,almarra today,¯»¯_ôãô_ôâ ôÉôÄ¯Çô ôã¯á¯¤¯_¯±¯¤¯» ¯¤ôã¯_¯øôö¯¤ô  ¯¤ôã¯±ôö¯_ô_ ôô_ ¯±ô_ô ¯¤¯øôã¯¬ 22-2-2016,2016-02-22 16:04:49+00:00,35.9266549,36.6180588,IDLIB,RU_1121,Alleged civilian casualties from Russian attacksvKrsvN973vU,Q.News: destruction in Gharnata village in countryside of Homs due to russian airstrikes 22-2-2016,Qasion News Agency EN, ôöôÄ¯¤ôã¯© ôâ¯¤¯_ô_ôöô : ¯¤ôã¯øôÉ¯¤¯± ôô_ ôâ¯±ô_¯© ¯¼¯±ô ¯¤¯á¯© ôô_ ¯±ô_ô ¯_ôÉ¯µ ¯Â¯±¯¤¯Á ¯¤ôã¯¼¯¤¯±¯¤¯» ¯¤ôã¯Âôöô_¯© ¯¤ôã¯±ôö¯_ô_¯©. 22-2-2016,2016-02-22 14:53:07+00:00,34.8956213,36.6789216,HOMS : Gharnatah,RU_1122,Alleged civilian casualties from Russian attacksBVb6y26svzc,Signs of destruction in the Jobar district of Damascus as a result of daily continuous shelling by Russian aircrafts.,SMO Syria,¯¤¯Ç¯¤¯± ¯¤ôã¯øôÉ¯¤¯± ôô_ ¯_ô_ ¯Âôö¯¬¯± ¯¤ôã¯øôÉ¯«ôâô_ ¯Â¯±¯¤¯Á ¯¤ôãôâ¯µô ¯¤ôãô_ôöôÉô_ ¯¤ôãôÉ¯»ôÄ¯±¯± ôÉô  ôâ¯¬ôã ¯¤ôã¯áô_¯±¯¤ô  ¯¤ôã¯±ôö¯_ô_,2016-02-21 17:49:28+00:00,33.531162,36.336808,DAMASCUS : Jobar,RU_1123,Alleged civilian casualties from Russian attacksQc4uDo-58jQ,"Sham: Aleppo province, Ein Jara: Russian warplanes target the town with cluster bombs.",ShaamNetwork S.N.N,"¯«¯¤ôÉ ¯±ô_ô ¯_ôã¯¬ ¯_ô ¯Â¯¤¯±¯© ¯¤ôã¯áô_¯±¯¤ô  ¯¤ôã¯_¯±¯¬ô_ ¯¤ôã¯±ôö¯_ô_ ô_¯_¯»ôà¯øô ¯¤ôã¯¬ôã¯ø¯© ¯¬¯¤ôãôâô ¯¤¯¬ôã ¯¤ôã¯_ô ôâôö¯øô_¯© 21 2 2016",2016-02-21 17:49:28+00:00,36.2208884,36.943674,,RU_1124,Alleged civilian casualties from Russian attacksfnLUgTgN1EI,Qasioun news : destruction in Mayser neighborhood in Aleppo due to russian airstrikes 21-2-2016,Qasioun News Agency,ôöôÄ¯¤ôã¯© ôâ¯¤¯_ô_ôöô : ¯¤ôã¯øôÉ¯¤¯± ¯¤ôã¯¡ô_ ¯¨ôãôôà ¯¤ôã¯áô_¯±¯¤ô  ¯¤ôã¯±ôö¯_ô_ ¯¬¯_ô_ ¯¤ôãôÉô_¯_¯± ¯¬¯_ôã¯¬ 21-2-2016,2016-02-21 15:01:49+00:00,36.1961392,37.1830665,,RU_1125,Alleged civilian casualties from Russian attacksFtt10ETLcL0,Huraytan || Russian warplanes targeting the city with incendiary rockets,¯¤ôãôÉôÄ¯»¯¬ ¯¤ôã¯´¯_ôã¯¤ôÉô_ ¯_¯±ô_¯»¯¤ô -Harithan media centre,¯_¯±ô_¯»¯¤ô  || ¯¤ôã¯áô_¯±¯¤ô  ¯¤ôã¯_¯±¯¬ô_ ¯¤ôã¯±ôö¯_ô_ ô_¯_¯»ôà¯øô ¯¤ôãôÉ¯øô_ô ¯© ¯¬¯µôö¯¤¯±ô_¯¨ ¯_ôÛ¯¤¯±ôâ¯© 21-2-2016,2016-02-21 14:53:21+00:00,36.287871,37.0838783,ALEPPO : Harithan,RU_1126,Alleged civilian casualties from Russian attacksjsGf-Ms41Do,Statement of the Maarat Al Nouman Local Council condemns the aggression by Russian warplanes and Assad regime on hospitals.,almarra today,¯¬ô_¯¤ô  ôÉô  ¯¤ôãôÉ¯Âôã¯_ ¯¤ôãôÉ¯_ôãô_ ôô_ ôÉ¯_¯±¯© ¯¤ôãô ¯_ôÉ¯¤ô  ô ¯ø¯ø ¯¬¯¤ôã¯¤¯_¯»¯ø¯¤¯Á ¯_ôãôä ¯¤ôãôÉ¯«¯¤ôô_ ôÉô  ôâ¯¬ôã ¯¤ôã¯áô_¯±¯¤ô  ¯¤ôã¯±ôö¯_ô_ ôöô ¯ü¯¤ôÉ ¯¤ôã¯£¯_¯ø,2016-02-21 12:47:03+00:00,35.6478097,36.6679429,IDLIB : Maret Numan,RU_1127,Alleged civilian casualties from Russian attacksMqiIitkCuAM,Statement of the Maarat Al Nouman Local Council,¯«¯¬ôÄ¯© ¯¤ôãôÉ¯_¯±¯© ¯¤ôã¯¢ô -Maret network now,¯¬ô_¯¤ô  ôãôãôÉ¯Âôã¯_ ¯¤ôãôÉ¯_ôãô_ ôô_ ôÉ¯øô_ô ¯© ôÉ¯_¯±¯© ¯¤ôãô ¯_ôÉ¯¤ô  2016/2/21,2016-02-21 12:30:28+00:00,35.6478097,36.6679429,IDLIB : Maret Numan,RU_1128,Alleged civilian casualties from Russian attacksCc8fc8AdMCM,Maara_Media_Center - Sit in in solidarity with the Doctors Without Borders Hospital that was shelled by Russian aircrafts.,maara media center,ôÉ¯±ôÄ¯_ ¯¤ôãôÉ¯_¯±¯© ¯¤ôã¯´¯_ôã¯¤ôÉô_ -ôöôâô¯© ¯»¯¦¯¤ôÉô ô_¯© ôÉ¯_ ôÉ¯«ôôä ¯¤¯á¯¬¯¤¯Á ¯¬ôã¯¤ ¯_¯øôö¯ø ¯¤ôã¯¡ô_ ôâ¯µôôàôö ¯¤ôã¯áô_¯±¯¤ô  ¯¤ôã¯±ôö¯_ô_,2016-02-21 12:30:07+00:00,35.6478097,36.6679429,IDLIB : Maret Numan,RU_1129,Alleged civilian casualties from Russian attacksnROEz0F9oC0,Cham Observatory confirms that Russian warplanes targeting the city of Al-Lataminah with 450  cluster bombs mostly did not explode,¯¤ôãôÉ¯±ôÄ¯_ ¯¤ôã¯µ¯_ôô_ ¯¤ôã¯_ôö¯±ô_-Syrian Press Centre,ôÉ¯±¯µ¯ø ¯«¯¤ôÉ ô_¯_ôÄ¯ø ¯£ô  ¯¤ôã¯áô_¯±¯¤ô  ¯¤ôã¯±ôö¯_ô_ ¯¤¯_¯»ôà¯øô ôÉ¯øô_ô ¯© ¯¤ôãôã¯á¯¤ôÉô ¯© ¯¬ôÛ 450 ôâô ôã¯© ¯_ô ôâôö¯øô_¯© ôÉ¯_¯üôÉôà¯¤ ôãôÉ ô_ô ô¯Â¯±,2016-02-20 20:39:29+00:00,35.326749,36.621766,HAMA : latamneh,RU_1130,Alleged civilian casualties from Russian attacksrgeJSCKTwAY,# Aleppo-news | The effects of the Russian aviation bombing AL-Myseer neighborhood,¯«¯¬ôÄ¯© ¯_ôã¯¬ ô ô_ôö¯_ - Halab News Network,#¯_ôã¯¬_ô ô_ôö¯_| ¯¢¯Ç¯¤¯± ¯¤ôãôâ¯µô ¯¤ôã¯áô_¯±¯¤ô  ¯¤ôã¯±ôö¯_ô_ ¯_ôãôä ¯_ô_ ¯¤ôãôÉô_¯_¯± 20_2_2016,2016-02-20 15:43:43+00:00,36.1961392,37.1830665,,RU_1131,Alleged civilian casualties from Russian attacksw7ji6OnPUsI,An elderly woman talks about how she fled in tears and the suffering as a result of Russian air strikes on the Bosra Al Sham town of Daraa province.,SMO Syria,¯´ôÉ¯±¯£¯© ôÉ¯_ô ¯© ¯»¯±ôöô_ ôâ¯µ¯© ô ¯_ôö¯_ôà¯¤ ¯¬¯øôÉôö¯_ ôö¯¤ôãôÉ ¯Â¯±¯¤¯Á ¯¤ôã¯¼¯¤¯±¯¤¯» ¯¤ôã¯±ôö¯_ô_¯© ¯_ôãôä ¯¬ôã¯ø¯© ¯¬¯µ¯± ¯¤ôã¯_¯±ô_¯± ¯¬¯±ô_ô ¯ø¯±¯_¯¤,2016-02-20 15:26:35+00:00,32.8378332,36.3413725,DARAA : Busra al-Harir,RU_1132,Alleged civilian casualties from Russian attacksabJ4lf9HFeQ,Nearly 500 cluster bomb which targeted town of Al-Lataminah in Hama,¯¤ôãôÉ¯±ôÄ¯_ ¯¤ôã¯µ¯_ôô_ ¯¤ôã¯_ôö¯±ô_-Syrian Press Centre,ôâ¯±¯¤¯¬¯© ¯¤ôãôÛ 500 ôâô ¯¬ôã¯© ¯_ô ôâôö¯øô_¯© ¯¤ôã¯»ô_ ¯¤¯_¯»ôà¯øô¯» ôÉ¯øô_ô ¯© ¯¤ôãôã¯á¯¤ôÉô ¯© ôô_ ¯±ô_ô ¯_ôÉ¯¤¯©,2016-02-20 14:00:12+00:00,35.326749,36.621766,HAMA : latamneh,RU_1133,Alleged civilian casualties from Russian attacksn7mdNvAV-tw,Russian aircrafts target with cluster bombs the middle of the Lattameneh city of Hama province.,ôÉ¯_ôÉôö¯ø ¯¤ôã¯_ôÉôöô_-Mahmoud Alhamwi,¯¤ôã¯áô_¯±¯¤ô  ¯¤ôã¯_¯±¯¬ô_ ¯¤ôã¯±ôö¯_ô_ ô_¯_¯»ôà¯øôöô ¯¬¯¤ôãôâô ¯¤¯¬ôã ¯¤ôã¯_ô ôâôö¯øô_¯© ôö¯_¯á ôÉ¯øô_ô ¯© ¯¤ôãôã¯á¯¤ôÉô ¯© ¯¬¯±ô_ô ¯_ôÉ¯¤¯© 20 2 2016,2016-02-20 13:10:43+00:00,35.326749,36.621766,HAMA : latamneh,RU_1134,Alleged civilian casualties from Russian attackszMmeFoYX3nI,Qasioun News: Daraa: Russian warplanes launch an airstrike over Kafrnasej town 20-2-2016,Qasion News Agency EN, ôöôÄ¯¤ôã¯© ôâ¯¤¯_ô_ôöô : ¯ø¯±¯_¯¤: ¯¤ôã¯áô_¯±¯¤ô  ¯¤ôã¯_¯±¯¬ô_ ¯¤ôã¯±ôö¯_ô_ ô_ô ô¯¡ ¯¼¯¤¯±¯© ¯Âôöô_¯© ¯_ôãôä ¯¬ôã¯ø¯© ôÄô¯±ô ¯_ô_¯Â 20-2-2016,2016-02-20 11:55:52+00:00,32.6228886,36.0819402,DARAA,RU_1135,Alleged civilian casualties from Russian attacksTMeTbHTRKBk,Qasioun News: Rif Dimashq: Russian warplanes mounting airstrikes over Erbin surroundings 20-2-2016,Qasion News Agency EN, ôöôÄ¯¤ôã¯© ôâ¯¤¯_ô_ôöô : ¯±ô_ô ¯øôÉ¯«ôâ: ¯¤ôã¯áô_¯±¯¤ô  ¯¤ôã¯_¯±¯¬ô_ ¯¤ôã¯±ôö¯_ô_ ô_ô ô¯¡ ¯¼¯¤¯±¯¤¯» ¯Âôöô_¯© ¯_ôãôä ôÉ¯_ô_¯á ôÉ¯øô_ô ¯© ¯_¯±¯¬ô_ô  20-2-2016,2016-02-20 11:48:19+00:00,33.538893,36.365787,DAMASCUS : Irbin nahiyah,RU_1136,Alleged civilian casualties from Russian attacks4tffNWs6IYc,Qasioun News: Homs: Destruction caused by the Russian warplanes over Rastan city 20-2-2016,Qasion News Agency EN, ôöôÄ¯¤ôã¯© ôâ¯¤¯_ô_ôöô : ¯_ôÉ¯µ: ¯¤ôã¯øôÉ¯¤¯± ¯¤ôã¯¡ô_ ¯¨ôãôôà ¯¤ôã¯áô_¯±¯¤ô  ¯¤ôã¯_¯±¯¬ô_ ¯¤ôã¯±ôö¯_ô_ ôô_ ôÉ¯øô_ô ¯© ¯¤ôã¯±¯_¯»ô  20-2-2016,2016-02-20 11:47:33+00:00,34.91639,36.733818,HOMS : Rastan,RU_1137,Alleged civilian casualties from Russian attacks8IEhSN0g2CQ,Cluster bombs that were dropped by Russian warplanes on the Lattameneh city of Hama province.,ôÉ¯_ôÉôö¯ø ¯¤ôã¯_ôÉôöô_-Mahmoud Alhamwi,¯£ôÄ¯Ç¯± ôÉô  ¯£¯±¯¬¯_ ôÉ¯_¯© ôâô ¯¬ôã¯© ¯_ô ôâôö¯øô_¯© ¯£ôãôâ¯¤ôà¯¤ ¯¤ôã¯áô_¯±¯¤ô  ¯¤ôã¯_¯±¯¬ô_ ¯¤ôã¯±ôö¯_ô_ ¯_ôãôä ôÉ¯øô_ô ¯© ¯¤ôãôã¯á¯¤ôÉô ¯© ¯¬¯±ô_ô ¯_ôÉ¯¤¯© 20 2 2016,2016-02-20 08:25:31+00:00,35.326749,36.621766,HAMA : latamneh,RU_1138,Alleged civilian casualties from Russian attacks7uAF8W3T6x4,Cluster bombs fired by Russian warplanes on the Lattameneh city of Hama province.,ôÉ¯_ôÉôö¯ø ¯¤ôã¯_ôÉôöô_-Mahmoud Alhamwi,ôâô ¯¤¯¬ôã ¯_ô ôâôö¯øô_¯© ôâ¯µôôà¯¤ ¯¤ôã¯áô_¯±¯¤ô  ¯¤ôã¯_¯±¯¬ô_ ¯¤ôã¯±ôö¯_ô_ ¯_ôãôä ôÉ¯øô_ô ¯© ¯¤ôãôã¯á¯¤ôÉô ¯© ¯¬¯±ô_ô ¯_ôÉ¯¤¯© 20 2 2016,2016-02-20 06:18:42+00:00,35.326749,36.621766,HAMA : latamneh,RU_1139,Alleged civilian casualties from Russian attacksR7eNPukKZ1c,Step Agency || Russian aerial shelling on Saraqib and victims among civilians.,Step News Agency,¯¨¯áôö¯© || ôâ¯µô ¯Âôöô_ ¯±ôö¯_ô_ ¯_ôãôä ¯_¯±¯¤ôâ¯¬ ôö¯¦¯_¯¤ô_¯¤ ôÉô  ¯¤ôãôÉ¯øô ô_ô_ô ,2016-02-20 02:27:09+00:00,35.863558,36.799534,IDLIB : Saraqib nahiyah,RU_1140,Alleged civilian casualties from Russian attacksMsu0GAyQNoA,"Watch Deraa air strike of the Russian aviation targeted the town of Kafr Nasej",ôÉ¯_¯_¯_¯© ¯«¯¤ôà¯ø ¯¤ôã¯´¯_ôã¯¤ôÉô_¯©-shahed media association,¯«¯¤ôà¯ø ¯ø¯±¯_¯¤ ¯¼¯¤¯±¯© ¯Âôöô_¯©ôÉô  ¯¤ôã¯áô_¯±¯¤ô  ¯¤ôã¯±ôö¯_ô_ ¯»¯_¯»ôà¯øô ¯¬ôã¯ø¯© ôÄô¯±ô ¯¤¯_¯Â,2016-02-19 19:25:48+00:00,33.1502745,36.0392375,DARAA : Kafr Nasij,RU_1141,Alleged civilian casualties from Russian attacksq9ovUaLKdVA,Qasioun News: Rif Dimashq: Russian warplanes launching airstrike over Eastern Ghouta 19-2-2016,Qasion News Agency EN,ôöôÄ¯¤ôã¯© ôâ¯¤¯_ô_ôöô : ¯±ô_ô ¯øôÉ¯«ôâ: ¯¤ôã¯áô_¯±¯¤ô  ¯¤ôã¯_¯±¯¬ô_ ¯¤ôã¯±ôö¯_ô_ ô_ô ô¯¡ ¯¼¯¤¯±¯© ¯Âôöô_¯© ¯_ôãôä ¯¤ôã¯¼ôö¯á¯© ¯¤ôã¯«¯±ôâô_¯© 19-2-2016,2016-02-19 14:37:27+00:00,33.5296468,36.3848593,DAMASCUS : Eastern Ghouta,RU_1142,Alleged civilian casualties from Russian attacks6IHV5URj5p4,Step || Movement of exodus taking place in some villages in the countryside of Daraa because of Russian strikes that affect their homes,Step News Agency,¯¨¯áôö¯© || ¯_¯±ôÄ¯© ô ¯_ôö¯_ ¯»¯«ôà¯øôà¯¤ ¯¬¯_¯¦ ôâ¯±ôä ¯±ô_ô ¯ø¯±¯_¯¤ ¯Â¯±¯¤¯Á ¯¤ôã¯¼¯¤¯±¯¤¯» ¯¤ôã¯±ôö¯_ô_¯© ¯¤ôã¯»ô_ ¯»¯á¯¤ôã ôÉô ¯¤¯_ôãôàôÉ,2016-02-19 12:02:32+00:00,32.6228886,36.0819402,DARAA,RU_1143,Alleged civilian casualties from Russian attacksrHYnPGSzRYo,"Anadan || Russian warplanes launches several raids on the city",¯¤ôãôÉôÄ¯»¯¬ ¯¤ôã¯´¯_ôã¯¤ôÉô_ ¯_¯±ô_¯»¯¤ô -Harithan media centre,¯_ô ¯ø¯¤ô  || ¯¤ôã¯áô_¯±¯¤ô  ¯¤ôã¯_¯±¯¬ô_ ¯¤ôã¯±ôö¯_ô_ ô_¯«ô  ¯_¯ø¯© ¯¼¯¤¯±¯¤¯» ¯_ôãôä ¯¤ôãôÉ¯øô_ô ¯© 19-2-2016,2016-02-19 10:48:39+00:00,36.2924395,37.041918,ALEPPO : Anadan,RU_1144,Alleged civilian casualties from Russian attacksxaUwqIkNIb4,"Huraytan || Scenes from the Russian raids on the city's neighborhoods",¯¤ôãôÉôÄ¯»¯¬ ¯¤ôã¯´¯_ôã¯¤ôÉô_ ¯_¯±ô_¯»¯¤ô -Harithan media centre,¯_¯±ô_¯»¯¤ô  || ôÉ¯«¯¤ôà¯ø ôÉô  ¯¤ôã¯¼¯¤¯±¯¤¯» ¯¤ôã¯±ôö¯_ô_¯© ¯_ôãôä ¯£¯_ô_¯¤¯Á ¯¤ôãôÉ¯øô_ô ¯© 19-2-2016,2016-02-19 10:45:06+00:00,36.287871,37.0838783,ALEPPO : Harithan,RU_1145,Alleged civilian casualties from Russian attackslwDpFS8FlvY,"Huraytan || Scenes from the strikes of Russian warplanes on the city's neighborhoods",¯¤ôãôÉôÄ¯»¯¬ ¯¤ôã¯´¯_ôã¯¤ôÉô_ ¯_¯±ô_¯»¯¤ô -Harithan media centre,¯_¯±ô_¯»¯¤ô  || ôÉ¯«¯¤ôà¯ø ôÉô  ¯¤ôã¯¼¯¤¯±¯¤¯» ôÉô  ¯¤ôã¯áô_¯±¯¤ô  ¯¤ôã¯_¯±¯¬ô_ ¯¤ôã¯±ôö¯_ô_ ¯_ôãôä ¯£¯_ô_¯¤¯Á ¯¤ôãôÉ¯øô_ô ¯© 19-2-2016,2016-02-19 09:14:49+00:00,36.287871,37.0838783,ALEPPO : Harithan,RU_1146,Alleged civilian casualties from Russian attacksw3AM-4g6uug,Aleppo News Network || City Huraytan stricken by the Russian Aviation,¯«¯¬ôÄ¯© ¯_ôã¯¬ ô ô_ôö¯_ - Halab News Network,¯«¯¬ôÄ¯© ¯_ôã¯¬ ô ô_ôö¯_|| ôÉ¯øô_ô ¯© ¯_¯±ô_¯»¯¤ô  ¯¤ôãôÉ¯øô_ô ¯© ¯¤ôãôÉô ôÄôö¯¬¯© ¯¬ô¯_ôã ¯¤ôã¯áô_¯±¯¤ô  ¯¤ôã¯±ôö¯_ô_,2016-02-19 08:21:40+00:00,36.287871,37.0838783,ALEPPO : Harithan,RU_1147,Alleged civilian casualties from Russian attacksl2JbasUWK6s,"Watch Deraa Russian warplanes targeting Tel Hamad airstrike",ôÉ¯_¯_¯_¯© ¯«¯¤ôà¯ø ¯¤ôã¯´¯_ôã¯¤ôÉô_¯©-shahed media association,¯«¯¤ôà¯ø ¯ø¯±¯_¯¤ ¯¤ôã¯áô_¯±¯¤ô  ¯¤ôã¯_¯±¯¬ô_ ¯¤ôã¯±ôö¯_ô_ ô_¯_¯»ôà¯øô ¯»ôã ¯_ôÉ¯ø ¯¬¯¼¯¤¯±¯© ¯Âôöô_¯© 17 2 2016,2016-02-18 19:37:19+00:00,32.844545,36.224456,DARAA : Izraa,RU_1148,Alleged civilian casualties from Russian attacksj4S00rG0aCU,"Step || Watch the first moments of the Russian bombing which targeted the western neighborhoods in Aleppo",Step News Agency,¯¨¯áôö¯© || ¯«¯¤ôà¯ø ¯¤ôãôã¯_¯ü¯¤¯» ¯¤ôã¯£ôöôãôä ôãôãôâ¯µô ¯¤ôã¯±ôö¯_ô_ ¯¤ôã¯¡ô_ ¯¤¯_¯»ôà¯øô ¯¤ôã¯£¯_ô_¯¤¯Á ¯¤ôã¯¼¯±¯¬ô_¯© ¯¬ôÉ¯øô_ô ¯© ¯_ôã¯¬,2016-02-18 18:42:54+00:00,36.2065528,37.0785454,ALEPPO,RU_1149,Alleged civilian casualties from Russian attacksuhyfDK0r3Vg,Russian warplanes targeting civilian facilities in Idlib countryside,Idleb Press,¯¤¯_¯»ôà¯ø¯¤ô ¯¤ôã¯áô_¯±¯¤ô  ¯¤ôã¯_¯±¯¬ô_ ¯¤ôã¯±ôö¯_ô_ ôãôãôÉ¯±¯¤ôôâ ¯¤ôãôÉ¯øô ô_¯© ¯¬¯±ô_ô ¯¤¯øôã¯¬,2016-02-18 17:34:43+00:00,35.9266549,36.6180588,IDLIB,RU_1150,Alleged civilian casualties from Russian attackszpsbGbf5yas,"Sham of Aleppo neighborhood Hajj bridge bombing by warplanes Russian successor to martyrs and wounded",ShaamNetwork S.N.N,¯«¯¤ôÉ ¯_ôã¯¬ ¯_ô_ ¯Â¯_¯± ¯¤ôã¯_¯Â ôâ¯µô ôãôã¯áô_¯±¯¤ô  ¯¤ôã¯_¯±¯¬ô_ ¯¤ôã¯±ôö¯_ô_ ô_¯¨ôãô ¯«ôà¯ø¯¤¯Á ôö¯Â¯±¯_ôä 18 2 2016,2016-02-18 13:37:56+00:00,36.1821817,37.1424553,ALEPPO : Aljaser,RU_1151,Alleged civilian casualties from Russian attacksgURSXU_Xsd8,The effects of the devastation in the village Kafr kalben as a result of the bombing by Russian occupation airplanes on the northern Aleppo countryside,baladi- news,¯¢¯Ç¯¤¯± ¯¤ôã¯øôÉ¯¤¯± ôô_ ôâ¯±ô_¯© ôÄô¯± ôÄôã¯¬ô_ô  ô ¯»ô_¯Â¯© ôâ¯µô ¯á¯¤¯_¯±¯¤¯» ¯¤ôã¯¤¯_¯»ôã¯¤ôã ¯¤ôã¯±ôö¯_ô_ ¯_ôãô_ôà¯¤ ¯¬¯±ô_ô ¯_ôã¯¬ ¯¤ôã¯«ôÉ¯¤ôãô_2016/2/18,2016-02-18 13:00:19+00:00,36.5564503,37.0847393,ALEPPO : Kafar Kalbin,RU_1152,Alleged civilian casualties from Russian attacksJsm0YdxXlhY,# Aleppo_news | The effects of the Russian bombardment of the ancient archaeological homes in Aleppo - Aljlom behind Shaibani Church,¯«¯¬ôÄ¯© ¯_ôã¯¬ ô ô_ôö¯_ - Halab News Network,#¯_ôã¯¬_ô ô_ôö¯_| ¯¢¯Ç¯¤¯± ¯¤ôãôâ¯µô ¯¤ôã¯±ôö¯_ô_ ¯_ôãôä ¯¬ô_ôö¯» ¯£¯Ç¯±ô_¯© ôô_ ¯_ôã¯¬ ¯¤ôãôâ¯øô_ôÉ¯© - ¯¤ôã¯ÂôãôöôÉ ¯¨ôãô ôÄô ô_¯_¯© ¯¤ôã¯«ô_¯¬¯¤ô ô_ 18_2_2016,2016-02-18 12:57:25+00:00,36.584381,37.049911,ALEPPO : Azaz,RU_1153,Alleged civilian casualties from Russian attacksKHWSb1tQrts,Qasioun News: Daraa: Moment of mounting the airstrike by the Russian warplane 18-2-2016,Qasion News Agency EN,ôöôÄ¯¤ôã¯© ôâ¯¤¯_ô_ôöô : ¯ø¯±¯_¯¤: ôã¯_¯ü¯© ¯¤ôã¯¼¯¤¯±¯© ¯¤ôã¯Âôöô_¯© ôÉô  ôâ¯¬ôã ¯¤ôã¯áô_¯±¯¤ô  ¯¤ôã¯_¯±¯¬ô_ ¯¤ôã¯±ôö¯_ô_ 18-2-2016,2016-02-18 12:39:51+00:00,32.6228886,36.0819402,DARAA,RU_1154,Alleged civilian casualties from Russian attacksVKheY15TYkM,"Talbiseh injury to a little girl as a result of cluster strikes of the Russian aviation",talbisa h,¯»ôã¯¬ô_¯_¯© 18 2 2016 ¯´¯µ¯¤¯¬¯© ¯áôôã¯© ¯µ¯¼ô_¯±¯© ô ¯»ô_¯Â¯© ¯¤ôã¯¼¯¤¯±¯¤¯» ¯¤ôã¯_ô ôâôö¯øô_¯© ôÉô  ¯¤ôã¯áô_¯±¯¤ô  ¯¤ôã¯±ôö¯_ô_,2016-02-18 01:24:33+00:00,34.833601,36.735749,HOMS : Talbisah,RU_1155,Alleged civilian casualties from Russian attacksO112iba830g,Watch Deraa Russian aviation targeted the outskirts of Kaf rnaseg with secound airstrike.,ôÉ¯_¯_¯_¯© ¯«¯¤ôà¯ø ¯¤ôã¯´¯_ôã¯¤ôÉô_¯©-shahed media association,¯«¯¤ôà¯ø ¯ø¯±¯_¯¤ ¯¤ôã¯áô_¯±¯¤ô  ¯¤ôã¯±ôö¯_ô_ ô_¯_¯»ôà¯øô ¯¤¯á¯±¯¤ô ¯¬ôã¯ø¯© ôÄô¯±ô ¯¤¯_¯Â ¯¬¯¼¯¤¯±¯© ¯Âôöô_¯© ¯Ç¯¤ô ô_¯©,2016-02-17 21:29:52+00:00,33.1502745,36.0392375,DARAA : Kafr Nasij,RU_1156,Alleged civilian casualties from Russian attacksguu5X_KsVkU,Rocket bombed by Russian warplanes on the revolutionaries stationed against ISIS in the city of Mare`,ôà¯¤¯øô_ ¯¤ôã¯_¯¬¯ø¯¤ôãôãôà Hadi Alabdallah,¯µ¯¤¯±ôö¯¨ ¯£ôãôâ¯¤ôà ¯¤ôã¯áô_¯±¯¤ô  ¯¤ôã¯_¯±¯¬ô_ ¯¤ôã¯±ôö¯_ô_ ¯_ôãôä ¯¤ôã¯Çôö¯¤¯± ¯¤ôãôÉ¯±¯¤¯¬¯áô_ô  ¯¦¯ø ¯»ô ¯üô_ôÉ ¯ø¯¤¯_¯« ôô_ ôÉ¯øô_ô ¯© ôÉ¯¤¯±¯_,2016-02-17 19:24:20+00:00,36.4814643,37.1968431,ALEPPO : Mar'e,RU_1157,Alleged civilian casualties from Russian attacks8xy9N-q_QHo,After three weeks of continuous Russian bombardment Ghariyah al-Gharbiyah is almost depopulated.,SMART News Agency - ôöôÄ¯¤ôã¯© ¯_ôÉ¯¤¯±¯» ôãôã¯£ô ¯¬¯¤¯Á,¯¬¯_¯ø ¯Çôã¯¤¯Ç¯© ¯£¯_¯¤¯¬ô_¯_ ôÉô  ¯¤ôãôâ¯µô ¯¤ôã¯±ôö¯_ô_ ¯¤ôãôÉ¯»ôö¯¤¯µôã ¯¤ôã¯¼¯¤¯±ô_¯© ¯¤ôã¯¼¯±¯¬ô_¯© ¯«¯¬ôà ¯¨¯¤ôãô_¯© ôÉô  ¯¤ôã¯_ôÄ¯¤ô ,2016-02-17 17:40:32+00:00,32.6830347,36.2054012,DARAA : Western Al-Ghariyah,RU_1158,Alleged civilian casualties from Russian attacksMKpon4xU4Co,Q.news : the second russian airstrike on Deir-Assafer town in countryside of Damascus 17-2-2016,Qasion News Agency EN,ôöôÄ¯¤ôã¯© ôâ¯¤¯_ô_ôöô : ¯¤ôã¯¼¯¤¯±¯© ¯¤ôã¯Âôöô_¯© ¯¤ôã¯±ôö¯_ô_¯© ¯¤ôã¯Ç¯¤ô ô_¯© ¯_ôãôä ¯¬ôã¯ø¯© ¯øô_¯± ¯¤ôã¯_¯µ¯¤ôô_¯± ôô_ ¯±ô_ô ¯øôÉ¯«ôâ 17-2-2016,2016-02-17 17:00:49+00:00,33.4650336,36.4159012,DAMASCUS : Deir al-Asafir,RU_1159,Alleged civilian casualties from Russian attacksi1Uk7iQxWks,"""Um Ibrahim"" forced by the Russian bombardment to leave her home and seek safety in camp.",ôÉ¯±ôÄ¯_ ¯_ôã¯¬ ¯¤ôã¯´¯_ôã¯¤ôÉô_ AMC-Aleppo media centre,"""¯£ôÉ ¯´¯¬¯±¯¤ôàô_ôÉ"" ¯£¯Â¯¬¯±ôà¯¤ ¯¤ôãôâ¯µô ¯¤ôã¯±ôö¯_ô_ ¯_ôãôä ¯¤ôãôà¯±ôö¯¬ ôÉô  ôÉô ¯_ôãôà¯¤ ôö¯¤ôãôã¯Âôö¯Á ôã¯¨ô_ôÉ¯© ¯ÂôÉ¯¤¯_ô_¯©",2016-02-17 16:48:04+00:00,36.584381,37.049911,ALEPPO : Azaz,RU_1160,Alleged civilian casualties from Russian attacksXBIKh7ukBR8,"Hama-South Hirbnafsah: violent raids from Russian warplanes on the town",¯»¯ÂôÉ¯_ ¯Çôö¯¤¯± ¯_ôö¯±ô_¯¤ SRG,¯±ô_ô ¯_ôÉ¯¤ôà ¯¤ôã¯Âô ôö¯¬ô_- ¯_¯±¯¬ô ô¯_¯© : ¯¼¯¤¯±¯¤¯» ¯_ô ô_ô¯© ôÉô  ¯¤ôã¯áô_¯±¯¤ô  ¯¤ôã¯_¯±¯¬ô_ ¯¤ôã¯±ôö¯_ô_ ¯_ôãôä ¯¤ôã¯¬ôã¯ø¯©,2016-02-17 16:20:24+00:00,34.9376702,36.6298663,,RU_1161,Alleged civilian casualties from Russian attacksY-2qDMYfQAc,"Hama-South Hirbnafsah: violent raids from Russian warplanes on the town",¯»¯ÂôÉ¯_ ¯Çôö¯¤¯± ¯_ôö¯±ô_¯¤ SRG,¯±ô_ô ¯_ôÉ¯¤ôà ¯¤ôã¯Âô ôö¯¬ô_- ¯_¯±¯¬ô ô¯_¯© : ¯¼¯¤¯±¯¤¯» ¯_ô ô_ô¯© ôÉô  ¯¤ôã¯áô_¯±¯¤ô  ¯¤ôã¯_¯±¯¬ô_ ¯¤ôã¯±ôö¯_ô_ ¯_ôãôä ¯¤ôã¯¬ôã¯ø¯©,2016-02-17 16:20:24+00:00,34.9376702,36.6298663,,RU_1162,Alleged civilian casualties from Russian attackss49cT_g7X-M,Watch intensive raids by the Russian warplanes on the outskirts city of Sheikh meskin and village Gaillah,ôÉ¯_¯_¯_¯© ¯«¯¤ôà¯ø ¯¤ôã¯´¯_ôã¯¤ôÉô_¯©-shahed media association,¯«¯¤ôà¯ø ¯¼¯¤¯±¯¤¯» ôÉôÄ¯Çô¯© ôãôã¯áô_¯±¯¤ô  ¯¤ôã¯_¯±¯¬ô_ ¯¤ôã¯±ôö¯_ô_ ¯_ôãôä ¯¤¯á¯±¯¤ô ôÉ¯øô_ô ¯© ¯¤ôã¯«ô_¯¨ ôÉ¯_ôÄô_ô  ôöôâ¯±ô_¯© ¯Â¯_ô_ôã¯©,2016-02-17 13:32:55+00:00,32.827996,36.158238,DARAA : Sheikh Miskin,RU_1163,Alleged civilian casualties from Russian attacksFCqd8g29nLs,Civil Defence finishing work and extracted the body of another nurse from the rubble of a hospital without borders,media.civildefense idlib,¯¤ôã¯øô¯¤¯_ ¯¤ôãôÉ¯øô ô_ ô_ô ôàô_ ¯¤ôã¯_ôÉôã ôöô_¯_¯»¯¨¯±¯Â ¯¢¯¨¯± ¯Â¯Ç¯© ôãôÉôÉ¯±¯¦¯© ôÉô  ¯»¯_¯» ¯£ô ôâ¯¤¯¦ ôÉ¯«ôôä ¯¬ôã¯¤ ¯_¯øôö¯ø 17-2-2016,2016-02-17 12:59:11+00:00,35.6478097,36.6679429,IDLIB : Maret Numan,RU_1164,Alleged civilian casualties from Russian attacksRtgvou6GwIA,"Civil Defence finishing searches in the hospital MSF Maarrat al-Nu'man",SMART News Agency - ôöôÄ¯¤ôã¯© ¯_ôÉ¯¤¯±¯» ôãôã¯£ô ¯¬¯¤¯Á,¯¤ôã¯øô¯¤¯_ ¯¤ôãôÉ¯øô ô_ ô_ô ôàô_ ¯_ôÉôãô_¯¤¯» ¯¤ôã¯¬¯_¯Ç ôô_ ôÉ¯«ôôä ¯£¯á¯¬¯¤¯Á ¯¬ôã¯¤ ¯_¯øôö¯ø ¯¬ôÉ¯_¯±¯© ¯¤ôãô ¯_ôÉ¯¤ô ,2016-02-17 10:36:41+00:00,35.6478097,36.6679429,IDLIB : Maret Numan,RU_1165,Alleged civilian casualties from Russian attacksEuPcFdOlpe4,Four air raids by the Russian warplanes on the city and the village of Al-Lataminah Maarkaba in Hama countryside,¯¤ôãôÉ¯±ôÄ¯_ ¯¤ôã¯µ¯_ôô_ ¯¤ôã¯_ôö¯±ô_-Syrian Press Centre,¯£¯±¯¬¯_ ¯¼¯¤¯±¯¤¯» ¯Âôöô_¯© ¯«ô ôà¯¤ ¯¤ôã¯áô_¯±¯¤ô  ¯¤ôã¯_¯±¯¬ô_ ¯¤ôã¯±ôö¯_ô_ ¯_ôãôä ôÉ¯øô_ô ¯© ¯¤ôãôã¯á¯¤ôÉô ¯© ôöôâ¯±ô_¯© ôÉ¯_¯±ôÄ¯¬¯© ôô_ ¯±ô_ô ¯_ôÉ¯¤¯©,2016-02-17 07:39:57+00:00,35.326749,36.621766,HAMA : latamneh,RU_1166,Alleged civilian casualties from Russian attackssw4J7VNGA-g,Russian warplanes shell the Maarkebbeh village of Hama northern countryside.,ôÉ¯_ôÉôö¯ø ¯¤ôã¯_ôÉôöô_-Mahmoud Alhamwi,¯¤ôã¯áô_¯±¯¤ô  ¯¤ôã¯_¯±¯¬ô_ ¯¤ôã¯±ôö¯_ô_ ô_ôâ¯µô ôâ¯±ô_¯© ôÉ¯_¯±ôÄ¯¬¯© ¯¬¯±ô_ô ¯_ôÉ¯¤¯© ¯¤ôã¯«ôÉ¯¤ôãô_ 17 2 2016,2016-02-17 05:54:47+00:00,35.31813,36.6683854,HAMA : Mar kbeh,RU_1167,Alleged civilian casualties from Russian attacksgdIqndUIR4g,Shelling by Russian warplanes on the Lattameneh city of Hama northern countryside.,ôÉ¯_ôÉôö¯ø ¯¤ôã¯_ôÉôöô_-Mahmoud Alhamwi,ôâ¯µô ¯¬¯¤ôã¯áô_¯±¯¤ô  ¯¤ôã¯_¯±ô_ ¯¤ôã¯±ôö¯_ô_ ¯_ôãôä ôÉ¯øô_ô ¯© ¯¤ôãôã¯á¯¤ôÉô ¯© ¯¬¯±ô_ô ¯_ôÉ¯¤¯© ¯¤ôã¯«ôÉ¯¤ôãô_ 17 2 2016,2016-02-17 05:54:14+00:00,35.326749,36.621766,HAMA : latamneh,RU_1168,Alleged civilian casualties from Russian attackshWGxnyxEwzE,Watch Daraa in a moment of targeting the town Akrba raid of the Russian aviation,ôÉ¯_¯_¯_¯© ¯«¯¤ôà¯ø ¯¤ôã¯´¯_ôã¯¤ôÉô_¯©-shahed media association,¯«¯¤ôà¯ø ¯ø¯±¯_¯¤ ôã¯_¯ü¯© ¯¤¯_¯»ôà¯ø¯¤ô ¯¬ôã¯ø¯© ¯_ôâ¯±¯¬¯¤ ¯¬¯¼¯¤¯±¯© ôÉô  ¯¤ôã¯áô_¯±¯¤ô  ¯¤ôã¯±ôö¯_ô_,2016-02-17 00:02:41+00:00,33.1081569,36.0072227,IDLIB : Aqrabat,RU_1169,Alleged civilian casualties from Russian attacksTg1DOFzYeQc,Destruction in al dar al kabera as a result of the Russian airstrikes,Syrian Network for Human Rights,¯_ôÉ¯µ ‰ÛÒ ¯¤ôã¯ø¯¤¯± ¯¤ôãôÄ¯¬ô_¯±¯©: ¯øôÉ¯¤¯± ¯Â¯±¯¤¯Á ôâ¯µô ¯¤ôã¯áô_¯±¯¤ô  ¯¤ôã¯_¯±¯¬ô_ ô_¯_¯_ôÉ ¯£ô ôà ¯±ôö¯_ô_ ¯¤ôãôâ¯±ô_¯© ¯¬¯¤ôã¯µôö¯¤¯±ô_¯¨ 8 2 2016,2016-02-16 21:50:00+00:00,34.78751944,36.68223889,HOMS : Aldar alkabera,RU_1170,Alleged civilian casualties from Russian attacksutsHiRn718E,Injured civilians including children as a result fo the Russian airstrikes in Homs,Syrian Network for Human Rights,¯_ôÉ¯µ ¯¬¯±¯Â ôâ¯¤¯_ô_: ¯Â¯±¯_ôä ¯Â¯±¯¤¯Á ôâ¯µô ¯¤ôã¯áô_¯±¯¤ô  ¯¤ôã¯_¯±¯¬ô_ ô_¯_¯_ôÉ ¯£ô ôà ¯±ôö¯_ô_ ¯¤ôãôâ¯±ô_¯© ¯¬¯¤ôã¯µôö¯¤¯±ô_¯¨ 2 2 2016,2016-02-16 21:50:00+00:00,34.8817769,36.5768337,HOMS : Burj qai,RU_1171,Alleged civilian casualties from Russian attacksjzB2v5Az9bU,"""Abu Badr"" Syrian citizen forced to flee the Russian bombardment of Tel Refaat after he was already displaced from his home in Aleppo city",ôÉ¯±ôÄ¯_ ¯_ôã¯¬ ¯¤ôã¯´¯_ôã¯¤ôÉô_ AMC-Aleppo media centre,"""¯£¯¬ôö ¯¬¯ø¯±"" ôÉôö¯¤¯áô  ¯_ôö¯±ô_ ¯£¯Â¯¬¯±ôà ¯¤ôãôâ¯µô ¯¤ôã¯±ôö¯_ô_ ¯_ôãôä ¯¤ôãô ¯_ôö¯_ ôÉô  ¯»ôã ¯±ô¯_¯» ¯¬¯_¯ø ô ¯_ôö¯_ôà ¯¤ôã¯£ôöôã ôÉô  ôÉ¯øô_ô ¯»ôà ¯_ôã¯¬",2016-02-16 17:27:02+00:00,36å¡28'36N,37å¡5‰Û_50‰Û_E,ALEPPO : Tal Rifaat,RU_1172,Alleged civilian casualties from Russian attacksxcduy0JGf04,"Civil defense team working in place of the ruins of the Hospital Doctors Without Borders for the next day",media.civildefense idlib,¯_ôÉôã ô¯±ô_ôâ ¯¤ôã¯øô¯¤¯_ ¯¤ôãôÉ¯øô ô_ ôô_ ôÉôÄ¯¤ô  ¯£ô ôâ¯¤¯¦ ôÉ¯«ôôä ¯£¯á¯¬¯¤¯Á ¯¬ôã¯¤ ¯_¯øôö¯ø ôãôãô_ôöôÉ ¯¤ôã¯»¯¤ôãô_ 16-2-2016,2016-02-16 17:19:41+00:00,35.6478097,36.6679429,IDLIB : Maret Numan,RU_1173,Alleged civilian casualties from Russian attacks6VCiaJVjYl0,#Aleppo_News: Witness the moment airplanes of Russian aggressor target Ashrafieh neighbourhood with cluster bombs 16/2/2016,¯«¯¬ôÄ¯© ¯_ôã¯¬ ô ô_ôö¯_ - Halab News Network,#¯_ôã¯¬_ô ô_ôö¯_ : ¯«¯¤ôà¯ø ôã¯_¯ü¯© ¯¤¯_¯»ôà¯ø¯¤ô ¯áô_¯±¯¤ô  ¯¤ôã¯_¯øôö¯¤ô  ¯¤ôã¯±ôö¯_ô_ ôã¯_ô_ôÔ ¯¤ôã¯£¯«¯±ôô_¯© ¯¬¯¤ôãôâô ¯¤¯¬ôã ¯¤ôã¯_ô ôâôö¯øô_¯© 2016/2/16,2016-02-16 17:15:37+00:00,36.228981,37.1344869,ALEPPO : Ashrafieh,RU_1174,Alleged civilian casualties from Russian attacksCOUp2UVwktk,The killing of five children by the Russian aircraft bombing al-Sakhur neighborhood of Aleppo 16/1/2016,ôÉ¯±ôÄ¯_ ¯_ôã¯¬ ¯¤ôã¯´¯_ôã¯¤ôÉô_ AMC-Aleppo media centre,¯¤¯_¯»¯«ôà¯¤¯ø ¯¨ôÉ¯_¯© ¯£¯áô¯¤ôã ¯Â¯±¯¤¯Á ôâ¯µô ¯¤ôã¯áô_¯±¯¤ô  ¯¤ôã¯±ôö¯_ô_ ¯_ôãôä ¯_ô_ ¯¤ôã¯µ¯¤¯¨ôö¯± ¯¬ôÉ¯øô_ô ¯© ¯_ôã¯¬ 16-1-2016,2016-02-16 17:05:10+00:00,36.2203437,37.1804809,ALEPPO : Sakhour,RU_1175,Alleged civilian casualties from Russian attacksjpf8cOzLBnY,The civil defense team is rescuing a nurse that works in Doctors without boarders hospital as she was injured as a result of the Russian attacks in Maret Numan,maara media center,ô¯±ôâ ¯¤ôã¯øô¯¤¯_ ¯¤ôãôÉ¯øô ô_ ¯»¯_¯»¯¨¯±¯Â ôÉôÉ¯±¯¦¯© ôÉô  ôÄ¯¤¯ø¯± ôÉ¯«ôôä ¯¬ôã¯¤¯ø ¯_¯øôö¯ø ôÄ¯¤ô ¯» ¯_¯¤ôãôâ¯© ¯»¯_¯» ¯¤ôã¯´ô ôâ¯¤¯¦ ¯´¯Ç¯± ôâ¯µô ¯¤ôã¯á¯¤¯_¯±¯¤¯» ¯¤ôã¯±ôö¯_ô_¯© ôÉ¯«ôôä ¯¬ôã¯¤ ¯_¯øôö¯ø ¯¬¯±ô_ô ¯´¯øôã¯¬,2016-02-16 13:56:55+00:00,35.6478097,36.6679429,IDLIB : Maret Numan,RU_1176,Alleged civilian casualties from Russian attacksS2J7kpwV6_s,Monitoring the destruction left in the hospital of Azaz,Qasion News Agency EN,¯±¯µ¯ø ¯¤ôã¯øôÉ¯¤¯± ¯¤ôã¯¡ô_ ¯_ôã ¯¬¯¤ôãôÉ¯«ôôä ôô_ ôÉ¯øô_ô ¯© ¯¤¯_¯_¯¤¯_,2016-02-15 21:29:01+00:00,36.584381,37.049911,ALEPPO : Azaz,RU_1177,Alleged civilian casualties from Russian attacksnlYatqV-1es,Qasioun news : first moments of bombardments on gathering of trucks in Ezaz city 15-2-2016,Qasion News Agency EN,¯¤ôãôã¯_¯ü¯¤¯» ¯¤ôã¯£ôöôãôä ôÉô  ¯¤ôãôâ¯µô ¯¤ôã¯¡ô_ ¯¤¯_¯»ôà¯øô ôÉôöôâô ôã¯»¯ÂôÉ¯_ ¯¤ôã¯«¯¤¯_ô ¯¤¯» ôô_ ôÉ¯øô_ô ¯© ¯¤¯_¯_¯¤¯_ 15-2-2016,2016-02-15 20:49:16+00:00,36.584381,37.049911,ALEPPO : Azaz,RU_1178,Alleged civilian casualties from Russian attackshJA4VuNURFg,Syria - Daraa countryside: Russian warplanes target a fuel depot belonging to a resident of Ghariyah al-Gharbiyah,SMO Syria,¯_ôö¯±ô_¯¤ - ¯±ô_ô_¯ø¯±¯_¯¤ : ¯¤ôã¯áô_¯±¯¤ô  ¯¤ôã¯_¯±¯¬ô_ ¯¤ôã¯±ôö¯_ô_ ô_¯_¯»ôà¯øô ôÉ¯_¯»ôö¯ø¯_ ôÉ¯_¯±ôöôâ¯¤¯» ô_¯_ôö¯ø ôã¯¤¯_¯ø ¯¤ôã¯¤ôà¯¤ôãô_ ¯¤ôã¯¼¯¤¯±ô_¯© ¯¤ôã¯¼¯±¯¬ô_¯©,2016-02-15 17:41:32+00:00,32.6830347,36.2054012,DARAA : Western Al-Ghariyah,RU_1179,Alleged civilian casualties from Russian attackssEb3D1ULZhE,"Huraytan || The devastation caused by the Russian air raids on the city",¯¤ôãôÉôÄ¯»¯¬ ¯¤ôã¯´¯_ôã¯¤ôÉô_ ¯_¯±ô_¯»¯¤ô -Harithan media centre,¯_¯±ô_¯»¯¤ô  || ¯¢¯Ç¯¤¯± ¯¤ôã¯øôÉ¯¤¯± ¯Â¯±¯¤¯Á ¯¤ôã¯¼¯¤¯±¯¤¯» ¯¤ôã¯Âôöô_¯© ¯¤ôã¯±ôö¯_ô_¯© ¯_ôãôä ¯¤ôãôÉ¯øô_ô ¯© 15-2-2016,2016-02-15 17:08:12+00:00,36.287871,37.0838783,ALEPPO : Harithan,RU_1180,Alleged civilian casualties from Russian attacksD17rkiI-m1U,Russian planes bombed a primary school in the Great Orme countryside of Aleppo,SMART News Agency - ôöôÄ¯¤ôã¯© ¯_ôÉ¯¤¯±¯» ôãôã¯£ô ¯¬¯¤¯Á,¯á¯¤¯_¯±¯¤¯» ¯±ôö¯_ô_¯© ¯»ôâ¯µô ôÉ¯ø¯±¯_¯© ¯¤¯¬¯»¯ø¯¤¯_ô_¯© ôô_ ¯¤ôö¯±ôÉ ¯¤ôãôÄ¯¬¯±ôä ¯¬¯±ô_ô ¯_ôã¯¬,2016-02-15 17:00:36+00:00,36.15,36.95,ALEPPO : Urum al-Kubra,RU_1181,Alleged civilian casualties from Russian attackszSGIgr2bzKE,Idlib Press destruction Hospital Doctors Without Borders in Maart al noman by the Russian raids,Idleb Press,¯¤¯øôã¯¬ ¯¬¯±¯__¯øôÉ¯¤¯± ôÉ¯«ôôä ¯¤¯á¯¬¯¤¯Á ¯¬ôã¯¤ ¯_¯øôö¯ø ôô_ ôÉ¯_¯±¯© ¯¤ôãô ¯_ôÉ¯¤ô  ¯Â¯±¯¤¯Á ¯¤ôã¯¼¯¤¯±¯¤¯» ¯¤ôã¯±ôö¯_ô_¯©,2016-02-15 16:43:11+00:00,35.6478097,36.6679429,IDLIB : Maret Numan,RU_1182,Alleged civilian casualties from Russian attacksCXoIy3IKEso,Russian enemy in the dirtiest weapons cluster kills in Huraytan countryside of Aleppo,ShaamNetwork S.N.N,¯¤ôã¯_¯øôö ¯¤ôã¯±ôö¯_ô_ ôô_ ¯£ôâ¯¡¯± ¯£¯_ôã¯_¯»ôà ¯¤ôã¯_ô ôâôö¯øô_ ô_ô¯»ôÄ ôô_ ¯_¯±ô_¯»¯¤ô  ¯¬¯±ô_ô ¯_ôã¯¬,2016-02-15 16:34:49+00:00,36.287871,37.0838783,ALEPPO : Harithan,RU_1183,Alleged civilian casualties from Russian attacks321-NNdBnUY,"Russian aviation destroys the hospital ""Doctors Without Borders"" and bombarding the National Hospital in Maart ..",ôÉ¯_¯¤¯¡ ¯¤ôã¯«¯¤ôÉô_-Muaz al shamy,"¯¤ôã¯áô_¯±¯¤ô  ¯¤ôã¯±ôö¯_ô_ ô_¯øôÉ¯± ôÉ¯«ôôä "" ¯£¯á¯¬¯¤¯Á ¯¬ôã¯¤ ¯_¯øôö¯ø "" ôöô_ôâ¯µô ¯¤ôãôÉ¯«ôôä ¯¤ôãôö¯áô ô_ ôô_ ôÉ¯_¯±¯© ¯¤ôãô ¯_ôÉ¯¤ô  ..",2016-02-15 16:23:50+00:00,35.6478097,36.6679429,IDLIB : Maret Numan,RU_1184,Alleged civilian casualties from Russian attacks6_AlNClKgeE,Huraytan || Witness the moment the Russian warplanes targeting the city with cluster bombs,¯¤ôãôÉôÄ¯»¯¬ ¯¤ôã¯´¯_ôã¯¤ôÉô_ ¯_¯±ô_¯»¯¤ô -Harithan media centre,¯_¯±ô_¯»¯¤ô  || ¯«¯¤ôà¯ø ôã¯_¯ü¯© ¯¤¯_¯»ôà¯ø¯¤ô ¯¤ôã¯áô_¯±¯¤ô  ¯¤ôã¯_¯±¯¬ô_ ¯¤ôã¯±ôö¯_ô_ ¯¤ôãôÉ¯øô_ô ¯© ¯¬¯¤ôãôâô ¯¤¯¬ôã ¯¤ôã¯_ô ôâôö¯øô_¯© 15-2-2016,2016-02-15 16:23:42+00:00,36.287871,37.0838783,ALEPPO : Harithan,RU_1185,Alleged civilian casualties from Russian attackspXqqDZprc7A,"Daraa, Ghariyah Sharkiyah: effects of shelling by Russian aircrafts.",¯¤¯¬ôö ¯_ô ¯ø¯_ ¯¤ôã¯_ôö¯±¯¤ô ô_-Abo Sundos alhorany,¯ø¯±¯_¯¤ ¯¼¯¤¯±ô_¯© ¯«¯±ôâô_¯© ¯¢¯Ç¯¤¯± ¯¤ôãôâ¯µô ¯¬¯¤ôã¯áô_¯±¯¤ô  ¯¤ôã¯±ôö¯_ô_,2016-02-15 15:24:56+00:00,32.6783603,36.2606822,DARAA : Eastern Al-Ghariyah,RU_1186,Alleged civilian casualties from Russian attacksOISn8swp9B4,Massacre in the #Doctors_Without_Borders Hospital after two Russian air strikes (were carried out) while searching for survivors under the rubble.,almarra today,ôã¯_¯ü¯© ¯¤¯_¯»ôà¯ø¯¤ô ôÉ¯«ôôä ¯£¯á¯¬¯¤¯Á ¯¬ôã¯¤ ¯_¯øôö¯ø ôô_ ôÉ¯_¯±¯© ¯¤ôãô ¯_ôÉ¯¤ô  ¯¬¯¼¯¤¯±¯»ô_ô  ¯±ôö¯_ô_¯»ô_ô  ¯¨ôã¯¤ôã ¯¤ôã¯¬¯_¯Ç ¯_ô  ô ¯¤¯Âô_ô  ¯»¯_¯» ¯¤ôã¯£ô ôâ¯¤¯¦,2016-02-15 14:29:01+00:00,35.6478097,36.6679429,IDLIB : Maret Numan,RU_1187,Alleged civilian casualties from Russian attacksfZjj1vQBI6w,"Russian warplanes targeting the civil defense team in Maart al-noman while working in a hospital, MSF",media.civildefense idlib,¯¤¯_¯»ôà¯ø¯¤ô ¯¤ôã¯áô_¯±¯¤ô  ¯¤ôã¯±ôö¯_ô_ ôãô¯±ô_ôâ ¯¤ôã¯øô¯¤¯_ ¯¤ôãôÉ¯øô ô_ ôô_ ôÉ¯_¯±¯© ¯¤ôãô ¯_ôÉ¯¤ô  ¯£¯Çô ¯¤¯Á ¯¤ôã¯_ôÉôã ôô_ ôÉ¯«ôôä ¯£¯á¯¬¯¤¯Á ¯¬ôã¯¤ ¯_¯øôö¯ø,2016-02-15 13:34:33+00:00,35.6478097,36.6679429,IDLIB : Maret Numan,RU_1188,Alleged civilian casualties from Russian attacksxCDZ9idNSIw,"Huraytan || The devastation caused by the Russian air raids on the city",¯¤ôãôÉôÄ¯»¯¬ ¯¤ôã¯´¯_ôã¯¤ôÉô_ ¯_¯±ô_¯»¯¤ô -Harithan media centre,¯_¯±ô_¯»¯¤ô  || ¯¢¯Ç¯¤¯± ¯¤ôã¯øôÉ¯¤¯± ¯Â¯±¯¤¯Á ¯¤ôã¯¼¯¤¯±¯¤¯» ¯¤ôã¯±ôö¯_ô_¯© ¯_ôãôä ¯¤ôãôÉ¯øô_ô ¯© 15-2-2016,2016-02-15 12:41:25+00:00,36.287871,37.0838783,ALEPPO : Harithan,RU_1189,Alleged civilian casualties from Russian attacksIppm49iNXYY,"Aleppo northern countryside, #Azaz: wounded as a result of Russian bombardment on the city with ballistic missiles.",¯¤¯_¯±¯¤¯± ¯¤¯_¯_¯¤¯_-Ahrar Azaz media network,¯±ô_ô ¯_ôã¯¬ ¯¤ôã¯«ôÉ¯¤ôãô_ #¯¤¯_¯_¯¤¯_ 15_2_2016. ¯´¯µ¯¤¯¬¯¤¯» ¯Â¯±¯¤¯Á ¯¤ôãôâ¯µô ¯¤ôã¯±ôö¯_ô_ ôãôãôÉ¯øô_ô ¯© ¯¬¯¤ôã¯µôö¯¤¯±ô_¯¨ ¯¤ôã¯¬¯¤ôã¯_¯»ô_¯©,2016-02-15 12:32:24+00:00,36.584381,37.049911,ALEPPO : Azaz,RU_1190,Alleged civilian casualties from Russian attacksai-QaE_FO9Q,Syrian Civil Defense Idlib: the side of the searches and rubble after air raids on the Hospital Doctors Without Borders,media.civildefense idlib,¯¤ôã¯øô¯¤¯_ ¯¤ôãôÉ¯øô ô_ ¯¤ôã¯_ôö¯±ô_ ¯¤¯øôã¯¬ : ¯Â¯¤ô ¯¬ ôÉô  ¯_ôÉôãô_¯¤¯» ¯¤ôã¯¬¯_¯Ç ôö ¯¤ôã¯¤ô ôâ¯¤¯¡ ¯¬¯_¯ø ¯¼¯¤¯±¯¤¯» ¯Âôöô_¯© ¯_ôãôä ôÉ¯«ôôä ¯¤¯á¯¬¯¤¯Á ¯¬ôã¯¤ ¯_¯øôö¯ø,2016-02-15 12:08:37+00:00,35.6478097,36.6679429,IDLIB : Maret Numan,RU_1191,Alleged civilian casualties from Russian attacksxXmdMuDkhDU,Retrieving a victim from the national hospital in the Maarat Al Nouman city of Idlib province.,¯«¯¬ôÄ¯© ¯¤ôãôÉ¯_¯±¯© ¯¤ôã¯¢ô -Maret network now,¯¤ô ¯»¯«¯¤ôã ¯¤ôã¯«ôà¯ø¯¤¯Á ôÉô  ¯ø¯¤¯¨ôã ¯¤ôãôÉ¯«ôôä ¯¤ôãôö¯áô ô_ ôô_ ôÉ¯øô_ô ¯© ôÉ¯_¯±¯© ¯¤ôãô ¯_ôÉ¯¤ô  ¯¬¯±ô_ô ¯¤¯øôã¯¬,2016-02-15 12:07:41+00:00,35.6478097,36.6679429,IDLIB : Maret Numan,RU_1192,Alleged civilian casualties from Russian attacksdn7seKo2QQg,The moment Russian warplanes hover Ghariyah Sharkiyah.,¯¤¯¬ôö ¯_ô ¯ø¯_ ¯¤ôã¯_ôö¯±¯¤ô ô_-Abo Sundos alhorany,ôã¯_¯ü¯© ¯»¯_ôãô_ôâ ôãôã¯áô_¯±¯¤ô  ¯¤ôã¯_¯±¯¬ô_ ¯¤ôã¯±ôö¯_ô_ ôôöôâ ¯¼¯¤¯±ô_¯© ¯«¯±ôâô_¯©,2016-02-15 11:56:24+00:00,32.6783603,36.2606822,DARAA : Eastern Al-Ghariyah,RU_1193,Alleged civilian casualties from Russian attackszGI-acvwThs,#Witness: Noon prayers at the Grand Sheikh Qassem Mosque in the town Hayan after it was completely destroyed by Russian bombardment,ôÉ¯±ôÄ¯_ ¯_ôã¯¬ ¯¤ôã¯´¯_ôã¯¤ôÉô_ AMC-Aleppo media centre,#¯«¯¤ôà¯ø ¯±ô¯_ ¯£¯¡¯¤ô  ¯¤ôã¯üôà¯± ôô_ ¯Â¯¤ôÉ¯_ ¯¤ôã¯«ô_¯¨ ôâ¯¤¯_ôÉ ¯¤ôãôÄ¯¬ô_¯± ôô_ ¯¬ôã¯ø¯© ¯_ô_¯¤ô  ¯¬¯_¯ø ¯£ô  ¯øôÉ¯±ôà ¯¤ôãôâ¯µô ¯¤ôã¯±ôö¯_ô_ ¯¬¯«ôÄôã ôÄ¯¤ôÉôã,2016-02-15 11:47:44+00:00,36.3248097,37.0586887,ALEPPO : Hayyan,RU_1194,Alleged civilian casualties from Russian attacksROuFusO_Tt8,"Aleppo northern countryside, Azaz: some victims of Russian bombardment on Azaz and Kel Jebreen.",¯¤¯_¯±¯¤¯± ¯¤¯_¯_¯¤¯_-Ahrar Azaz media network,¯±ô_ô ¯_ôã¯¬ ¯¤ôã¯«ôÉ¯¤ôãô_ ¯¤¯_¯_¯¤¯_ 15_2_2016 ¯¬¯_¯¦ ¯«ôà¯ø¯¤¯Á ¯¤ôãôâ¯µô ¯¤ôã¯±ôö¯_ô_ ¯_ôãôä ¯_ôãôä ¯¤¯_¯_¯¤¯_ ôö ôÄôã ¯Â¯¬¯±ô_ô ,2016-02-15 11:43:12+00:00,36.584381,37.049911,ALEPPO : Azaz,RU_1195,Alleged civilian casualties from Russian attacksEURnNCpgJs0,Targeting the Doctors Without Borders Hospital in the Maarat Al Nouman city of Idlib province.,¯«¯¬ôÄ¯© ¯¤ôãôÉ¯_¯±¯© ¯¤ôã¯¢ô -Maret network now,¯¤¯_¯»ôà¯ø¯¤ô ôÉ¯«ôôä ¯£¯á¯¬¯¤¯Á ¯¬ôã¯¤ ¯_¯øôö¯ø ôô_ ôÉ¯øô_ô ¯© ôÉ¯_¯±¯© ¯¤ôãô ¯_ôÉ¯¤ô  ¯¬¯±ô_ô ¯¤¯øôã¯¬,2016-02-15 11:30:48+00:00,35.6478097,36.6679429,IDLIB : Maret Numan,RU_1196,Alleged civilian casualties from Russian attacksglCMSSaOEgM,"Daraa, Ghariyah Sharkiyah: effects of shelling by Russian aircrafts.",¯¤¯¬ôö ¯_ô ¯ø¯_ ¯¤ôã¯_ôö¯±¯¤ô ô_-Abo Sundos alhorany,¯ø¯±¯_¯¤ ¯¼¯¤¯±ô_¯© ¯«¯±ôâô_¯© ¯¢¯Ç¯¤¯± ¯¤ôãôâ¯µô ¯¬¯¤ôã¯áô_¯±¯¤ô  ¯¤ôã¯±ôö¯_ô_,2016-02-15 11:25:22+00:00,32.6783603,36.2606822,DARAA : Eastern Al-Ghariyah,RU_1197,Alleged civilian casualties from Russian attacksb94Ffmx39BA,Qasioun News: Daraa: Russian warplanes hovering over Daraa city's airspace 15-2-2016,Qasion News Agency EN,ôöôÄ¯¤ôã¯© ôâ¯¤¯_ô_ôöô : ¯ø¯±¯_¯¤: ¯»¯_ôãô_ôâ ¯¤ôã¯áô_¯±¯¤ô  ¯¤ôã¯_¯±¯¬ô_ ¯¤ôã¯±ôö¯_ô_ ôô_ ¯¤¯Âôö¯¤¯Á ôÉ¯øô_ô ¯© ¯ø¯±¯_¯¤ 15-2-2016 ,2016-02-15 11:19:52+00:00,32.6228886,36.0819402,DARAA,RU_1198,Alleged civilian casualties from Russian attackslLuTnogAdkw,Civil Defense venue Russian raid on the hospital MSF Maart al-noman,media.civildefense idlib,¯¤ôã¯øô¯¤¯_ ¯¤ôãôÉ¯øô ô_ ôÉôÄ¯¤ô  ¯¤ôã¯¼¯¤¯±¯© ¯¤ôã¯±ôö¯_ô_¯© ¯_ôãôä ôÉ¯«ôôä ¯£¯á¯¬¯¤¯Á ¯¬ôã¯¤ ¯_¯øôö¯ø ôô_ ôÉ¯_¯±¯© ¯¤ôãô ¯_ôÉ¯¤ô ,2016-02-15 10:57:36+00:00,35.6478097,36.6679429,IDLIB : Maret Numan,RU_1199,Alleged civilian casualties from Russian attacksgU7TAvfR_4M,Targeting the Doctors Without Borders Hospital in the Maarat Al Nouman city with an air strike by Russian aircrafts.,almarra today,¯¤¯_¯»ôà¯ø¯¤ô ¯¤ôãôÉ¯«ôôä ¯¤ôãôö¯áô ô_ ôô_ ôÉ¯øô_ô ¯© ôÉ¯_¯±¯© ¯¤ôãô ¯_ôÉ¯¤ô  ¯¬¯¼¯¤¯±¯© ¯Âôöô_¯© ôÉô  ¯áô_¯±¯¤ô  ¯¤ôã¯_¯øôö¯¤ô  ¯¤ôã¯±ôö¯_ô_ 15-2-2016,2016-02-15 10:34:05+00:00,35.6478097,36.6679429,IDLIB : Maret Numan,RU_1200,Alleged civilian casualties from Russian attacksUTsL_z35z6g,An air strike by regime warplanes targeted the perimeter of the National hospital in Maarat Al Nouman.,almarra today,¯¼¯¤¯±¯© ¯Âôöô_¯© ôã¯áô_¯±¯¤ô  ¯¤ôãô ¯ü¯¤ôÉ ¯¤ôã¯_¯±¯¬ô_ ¯¤¯_¯»ôà¯øô¯» ôÉ¯_ô_¯á ¯¤ôãôÉ¯«ôôä ¯¤ôãôö¯áô ô_ ôô_ ôÉ¯øô_ô ¯© ôÉ¯_¯±¯© ¯¤ôãô ¯_ôÉ¯¤ô  15-2-2016,2016-02-15 10:31:07+00:00,35.6478097,36.6679429,IDLIB : Maret Numan,RU_1201,Alleged civilian casualties from Russian attacks_g1I7GUSP-c,Destruction left by a surface-to-surface missile that hit the women's and children's hospital in Azaz city.,ôÉôÄ¯»¯¬ ¯¤¯_¯_¯¤¯_ ¯¤ôã¯´¯_ôã¯¤ôÉô_-Azaz media centre,¯«¯¤ôà¯ø ¯¤ôã¯øôÉ¯¤¯± ¯¤ôã¯¡ô_ ¯¨ôãôôà ¯_ôâôö¯á ¯µ¯¤¯±ôö¯¨ ¯¤¯±¯¦ ¯¤¯±¯¦ ¯_ôãôä ôÉ¯«ôôä ¯¤ôãô ¯_¯¤¯_ô_¯© ôö¯¤ôã¯¤¯áô¯¤ôã ôô_ ôÉ¯øô_ô ¯© ¯¤¯_¯_¯¤¯_,2016-02-15 10:22:48+00:00,36.584381,37.049911,ALEPPO : Azaz,RU_1202,Alleged civilian casualties from Russian attacks3HwA0-f__X0,"Aleppo northern cuntryside, Azaz: a child wounded in his leg as a result of Russian bombardment on the city.",¯¤¯_¯±¯¤¯± ¯¤¯_¯_¯¤¯_-Ahrar Azaz media network,¯±ô_ô ¯_ôã¯¬ ¯¤ôã¯«ôÉ¯¤ôãô_ #¯¤¯_¯_¯¤¯_ ¯´¯µ¯¤¯¬¯© ¯áôôã ¯¬ôÄ¯_¯± ¯¬ôâ¯øôÉôà ¯Â¯±¯¤¯Á ¯¤ôãôâ¯µô ¯¤ôã¯±ôö¯_ô_ ôãôãôÉ¯øô_ô ¯© 15_2_2016,2016-02-15 10:21:34+00:00,36.584381,37.049911,ALEPPO : Azaz,RU_1203,Alleged civilian casualties from Russian attacksHFBHohcgerQ,The martyrs and the wounded after the bombing of the Russian occupation airplanes hospital in the town of Maaret al-Numan countryside of Idlib,baladi- news,¯«ôà¯ø¯¤¯Á ôö¯Â¯±¯_ôä ¯´¯Ç¯± ôâ¯µô ¯á¯¤¯_¯±¯¤¯» ¯¤ôã¯¤¯_¯»ôã¯¤ôã ¯¤ôã¯±ôö¯_ô_ ôÉ¯«ôô_ô_ô  ôô_ ôÉ¯øô_ô ¯© ôÉ¯_¯±¯© ¯¤ôãô ¯_ôÉ¯¤ô  ¯¬¯±ô_ô ¯´¯øôã¯¬ 2016/2/15,2016-02-15 10:19:05+00:00,35.6478097,36.6679429,IDLIB : Maret Numan,RU_1204,Alleged civilian casualties from Russian attacksIYE-pDQBYfY,Azaz: burnt relief vehicles and dead and wounded after it was targeted with cluster bombs.,ôÉôÄ¯»¯¬ ¯¤¯_¯_¯¤¯_ ¯¤ôã¯´¯_ôã¯¤ôÉô_-Azaz media centre,¯¤¯_¯_¯¤¯_ ¯¤¯_¯»¯±¯¤ôâ ¯_ô_¯¤¯±¯¤¯» ô ôâôã ¯¤ôã¯¤¯¼¯¤¯Ç¯© ôö¯_ôâôö¯á ¯«ôà¯ø¯¤¯Á ¯Â¯±¯_ôä ¯Â¯±¯¤¯Á ¯¤¯_¯»ôà¯ø¯¤ôôà¯¤ ¯¬¯¤ôã¯µôö¯¤¯±ô_¯¨ ¯¤ôã¯_ô ôâôö¯øô_¯©,2016-02-15 10:18:18+00:00,36.584381,37.049911,ALEPPO : Azaz,RU_1205,Alleged civilian casualties from Russian attacks9nKPF4E6N6c,"Aleppo northern cuntryside, Azaz: a severely wounded case as a result of Russian bombardment on the city with ballistic missiles.",¯¤¯_¯±¯¤¯± ¯¤¯_¯_¯¤¯_-Ahrar Azaz media network,¯±ô_ô ¯_ôã¯¬ ¯¤ôã¯«ôÉ¯¤ôãô_ ¯¤¯_¯_¯¤¯_ ¯´¯µ¯¤¯¬¯© ¯¨¯á¯±¯© ¯Â¯±¯¤¯Á ¯¤ôãôâ¯µô ¯¤ôã¯±ôö¯_ô_ ôãôãôÉ¯øô_ô ¯© ¯¬¯¤ôã¯µôö¯¤¯±ô_¯¨ ¯¤ôã¯¬¯¤ôã¯_¯»ô_¯© 15_2_2016,2016-02-15 10:09:19+00:00,36.584381,37.049911,ALEPPO : Azaz,RU_1206,Alleged civilian casualties from Russian attacksefJ4BHBUP18,"Dara Bosra Sham third airstrike of the Russian aviation",¯«¯¬ôÄ¯© ¯¬¯µ¯±ôä ¯¤ôã¯¤¯¨¯¬¯¤¯±ô_¯©-Bosra news network,¯ø¯±¯_¯¤ ¯¬¯µ¯±ôä ¯¤ôã¯«¯¤ôÉ ¯¤ôã¯¼¯¤¯±¯© ¯¤ôã¯Âôöô_¯© ¯¤ôã¯Ç¯¤ôã¯Ç¯© ôÉô  ¯¤ôã¯áô_¯±¯¤ô  ¯¤ôã¯±ôö¯_ô_ 15/2/2016,2016-02-15 10:07:13+00:00,32.5168311,36.4446968,DARAA : Bosra,RU_1207,Alleged civilian casualties from Russian attackstqrmdEdv9TY,Dara Bosra Sham second airstrike of the Russian aviation on The city,¯«¯¬ôÄ¯© ¯¬¯µ¯±ôä ¯¤ôã¯¤¯¨¯¬¯¤¯±ô_¯©-Bosra news network,¯ø¯±¯_¯¤ ¯¬¯µ¯±ôä ¯¤ôã¯«¯¤ôÉ ¯¤ôã¯¼¯¤¯±¯© ¯¤ôã¯Âôöô_¯© ¯¤ôã¯Ç¯¤ô ô_¯© ôÉô  ¯¤ôã¯áô_¯±¯¤ô  ¯¤ôã¯±ôö¯_ô_ ¯_ôãôä ¯¤ôãôÉ¯øô_ô ¯© 15/2/2016,2016-02-15 10:03:50+00:00,32.5168311,36.4446968,DARAA : Bosra,RU_1208,Alleged civilian casualties from Russian attacksb-zvWWTgRoU,"Aleppo province, Azaz: wounded after ballistic missiles targeted the city.",¯¤¯_¯±¯¤¯± ¯¤¯_¯_¯¤¯_-Ahrar Azaz media network,¯±ô_ô ¯_ôã¯¬ ¯¤¯_¯_¯¤¯_ ¯´¯µ¯¤¯¬¯¤¯» ¯Â¯±¯¤¯Á ¯¤¯_¯»ôà¯øô ¯¤ôãôÉ¯øô_ô ¯© ¯¬¯¤ôã¯µôö¯¤¯±ô_¯¨ ¯¤ôã¯¬¯¤ôã¯_¯»ô_¯© 15_2_2016,2016-02-15 10:02:47+00:00,36.584381,37.049911,ALEPPO : Azaz,RU_1209,Alleged civilian casualties from Russian attacksj176xNJnzGk,Dara Bosra Sham second airstrike of the Russian aviation on The city,¯«¯¬ôÄ¯© ¯¬¯µ¯±ôä ¯¤ôã¯¤¯¨¯¬¯¤¯±ô_¯©-Bosra news network,¯ø¯±¯_¯¤ ¯¬¯µ¯±ôä ¯¤ôã¯«¯¤ôÉ ¯¤ôã¯¼¯¤¯±¯© ¯¤ôã¯Âôöô_¯© ¯¤ôã¯£ôöôãôä ôÉô  ¯¤ôã¯áô_¯±¯¤ô  ¯¤ôã¯±ôö¯_ô_ ¯_ôãôä ¯¤ôãôÉ¯øô_ô ¯© 15/2/2016,2016-02-15 09:59:20+00:00,32.5168311,36.4446968,DARAA : Bosra,RU_1210,Alleged civilian casualties from Russian attacksy7kU3W87tmM,Idlib | The second raid by the Russian Aviation on Hospital Doctors Without Borders after trying to rescue attempt remained outside the hospital,ôÉ¯_ôÉ¯ø ¯¤ôãôÄô ¯«-Mouhammed Alkhensh,¯´¯øôã¯¬ | ¯¤ôã¯¼¯¤¯±¯© ¯¤ôã¯Ç¯¤ô ô_¯© ôãôã¯áô_¯±¯¤ô  ¯¤ôã¯±ôö¯_ô_ ¯_ôãôä ôÉ¯«ôôä ¯£¯á¯¬¯¤¯Á ¯¬ôã¯¤¯_¯øôö¯ø ¯¬¯_¯ø ôÉ¯_¯¤ôöôã¯© ¯´ô ôâ¯¤¯¡ ôÉô  ¯¬ôâô_ ¯¨¯¤¯±¯Â ¯¤ôãôÉ¯«ôôä,2016-02-15 08:00:01+00:00,35.6478097,36.6679429,IDLIB : Maret Numan,RU_1211,Alleged civilian casualties from Russian attacksz678GHl3q2E,"Russian aviation targets Hospital Doctors Without Borders in the countryside of of Idlib",Syrian Mirror,¯¤ôã¯áô_¯±¯¤ô  ¯¤ôã¯±ôö¯_ô_ ô_¯_¯»ôà¯øô ôÉ¯«ôôä ¯£¯á¯¬¯¤¯Á ¯¬ôã¯¤ ¯_¯øôö¯ø ôô_ ¯±ô_ô ¯´¯øôã¯¬,2016-02-15 07:54:24+00:00,35.6478097,36.6679429,IDLIB : Maret Numan,RU_1212,Alleged civilian casualties from Russian attacksrp5FT7dZSnM,Idlib | Killed and wounded in a raid by warplanes on the Hospital Doctors Without Borders and scan the entire hospital,ôÉ¯_ôÉ¯ø ¯¤ôãôÄô ¯«-Mouhammed Alkhensh,¯´¯øôã¯¬ | ¯«ôà¯ø¯¤¯Á ôö¯Â¯±¯_ôä ¯¬¯¼¯¤¯±¯© ôãôã¯áô_¯±¯¤ô  ¯¤ôã¯_¯±¯¬ô_ ¯_ôãôä ôÉ¯«ôôä ¯£¯á¯¬¯¤¯Á ¯¬ôã¯¤¯_¯øôö¯ø ôöôÉ¯_¯_ ¯¤ôãôÉ¯«ôôä ¯¬¯¤ôãôÄ¯¤ôÉôã,2016-02-15 07:48:01+00:00,35.6478097,36.6679429,IDLIB : Maret Numan,RU_1213,Alleged civilian casualties from Russian attacksu5T-M1MJsFY,Shelling by Russian warplanes on the Lattameneh city of Hama northern countryside.,ôÉ¯_ôÉôö¯ø ¯¤ôã¯_ôÉôöô_-Mahmoud Alhamwi,ôâ¯µô ¯¬¯¤ôã¯áô_¯±¯¤ô  ¯¤ôã¯_¯±¯¬ô_ ¯¤ôã¯±ôö¯_ô_ ¯_ôãôä ôÉ¯øô_ô ¯© ¯¤ôãôã¯á¯¤ôÉô ¯© ¯¬¯±ô_ô ¯_ôÉ¯¤¯© 15 2 2016,2016-02-15 05:43:11+00:00,35.326749,36.621766,HAMA : latamneh,RU_1214,Alleged civilian casualties from Russian attacksW_Y8BREOJWo,Civil Defense members searching for survivors trapped under the rubble after Russian airstrikes on al-Katraji neighborhood Aleppo 14/2/2016,ôÉ¯±ôÄ¯_ ¯_ôã¯¬ ¯¤ôã¯´¯_ôã¯¤ôÉô_ AMC-Aleppo media centre,¯¤ôã¯øô¯¤¯_ ¯¤ôãôÉ¯øô ô_ ô_ôö¯¤¯µôã ¯¤ôã¯¬¯_¯Ç ¯_ô  ¯_¯¤ôãôâô_ô  ¯»¯_¯» ¯¤ôã¯£ô ôâ¯¤¯¦ ¯¬¯_¯ø ôâ¯µô ¯¤ôã¯á¯¤¯_¯±¯¤¯» ¯¤ôã¯±ôö¯_ô_¯© ¯_ô_ ¯¤ôãôâ¯¤¯á¯±¯Âô_ 14-2-2016,2016-02-14 19:41:27+00:00,"36å¡11'58""N","37å¡10'53""E",ALEPPO : Karam al-Qaterji,RU_1215,Alleged civilian casualties from Russian attacksQtRlsDSZ_hI,"Step || Watch the effects of the devastation of in the town of Kafr Zita by the Russian air strikes",Step News Agency,¯¨¯áôö¯© ||¯«¯¤ôà¯ø ¯¢¯Ç¯¤¯± ¯¤ôã¯øôÉ¯¤¯± ¯¤ôã¯¡ô_ ¯_ôã ¯¬¯¬ôã¯ø¯© ôÄô¯±¯_ô_¯»¯¤ ¯Â¯±¯¤¯Á ¯¤ôã¯¼¯¤¯±¯¤¯» ¯¤ôã¯Âôöô_¯© ¯¤ôã¯±ôö¯_ô_¯©,2016-02-14 17:11:51+00:00,35.373461,36.601458,HAMA : KafrZita,RU_1216,Alleged civilian casualties from Russian attackse5VhCL7iJc8,Russian enemy in the dirtiest weapons cluster kills in Huraytan countryside of Aleppo,ShaamNetwork S.N.N,¯«¯¤ôÉ ¯±ô_ô ¯_ôã¯¬ ¯_ô ¯ø¯¤ô  ¯¼¯¤¯±¯¤¯» ôÉôÄ¯Çô¯© ôãôã¯áô_¯±¯¤ô  ¯¤ôã¯_¯±¯¬ô_ ¯¤ôã¯±ôö¯_ô_ ¯_ôãôä ¯¤ôã¯¬ôã¯ø¯© 14 2 2016,2016-02-14 13:27:40+00:00,36.2924395,37.041918,ALEPPO : Anadan,RU_1217,Alleged civilian casualties from Russian attackseW2qb16luo0,Sham: Aleppo countryside: Tell Rifaat air support for Syrian Democratic Forces by Russian aircraft,ShaamNetwork S.N.N,¯«¯¤ôÉ ¯±ô_ô ¯_ôã¯¬ ¯»ôã ¯±ô¯_¯» ¯»ôÉôàô_¯ø ¯Âôöô_ ôãôâôö¯¤¯» ¯_ôö¯±ô_¯¤ ¯¤ôã¯øô_ôÉôöôâ¯±¯¤¯áô_¯© ôÉô  ôâ¯¬ôã ¯¤ôã¯áô_¯±¯¤ô  ¯¤ôã¯±ôö¯_ô_ 14 2 2016,2016-02-14 13:01:34+00:00,36å¡28'36N,37å¡5‰Û_50‰Û_E,ALEPPO : Tal Rifaat,RU_1218,Alleged civilian casualties from Russian attacksoj63ehyK-3M,Watch the flight of the Russian aviation Deraa in the countryside north Deraa today,ôÉ¯_¯_¯_¯© ¯«¯¤ôà¯ø ¯¤ôã¯´¯_ôã¯¤ôÉô_¯©-shahed media association,¯«¯¤ôà¯ø ¯ø¯±¯_¯¤ ¯»¯_ôãô_ôâ ¯¤ôã¯áô_¯±¯¤ô  ¯¤ôã¯±ôö¯_ô_ ôô_ ¯±ô_ô ¯ø¯±¯_¯¤ ¯¤ôã¯«ôÉ¯¤ôãô_ ¯¤ôãô_ôöôÉ,2016-02-14 12:52:22+00:00,32.6228886,36.0819402,DARAA,RU_1219,Alleged civilian casualties from Russian attacksscBYc50MCXE,5 martyrs and twenty wounded Russian aviation bombed on village of Hosh Nasri Domaa eastern city during children going out from school,Yasser Doumany-ô_¯¤¯_¯± ¯¤ôã¯øôöôÉ¯¤ô ô_,5 ¯«ôà¯ø¯¤¯Á ôö¯_¯«¯±ô_ô  ¯Â¯±ô_¯_ ¯¬ôâ¯µô ¯¬¯áô_¯±¯¤ô  ¯¤ôã¯±ôö¯_ô_ ¯_ôãôä ôâ¯±ô_¯© ¯_ôö¯« ô ¯µ¯±ô_ ¯«¯±ôâ ôÉ¯øô_ô ¯© ¯øôöôÉ¯¤¯¤¯Çô ¯¤¯Á ¯¨¯±ôö¯Â ¯áôã¯¤¯¬ ¯¤ôãôÉ¯ø¯±¯_¯©,2016-02-14 12:09:19+00:00,33.5709426,36.3968945,DAMASCUS : Duma,RU_1220,Alleged civilian casualties from Russian attacksDijvAaL2oIY,Russian airforce in the sky over the eastern area of Daraa province.,SMO Syria,¯¤ôã¯áô_¯±¯¤ô  ¯¤ôã¯±ôö¯_ô_ ôôöôâ ¯_ôÉ¯¤¯Á ¯¤ôãôÉô ¯áôâ¯© ¯¤ôã¯«¯±ôâô_¯© ¯¬¯±ô_ô ¯ø¯±¯_¯¤,2016-02-14 12:08:23+00:00,32.6228886,36.0819402,DARAA,RU_1221,Alleged civilian casualties from Russian attacksjaiXuetBpdA,"Huraytan || Scenes strikes of Russian warplanes on the city's neighborhoods",¯¤ôãôÉôÄ¯»¯¬ ¯¤ôã¯´¯_ôã¯¤ôÉô_ ¯_¯±ô_¯»¯¤ô -Harithan media centre,¯_¯±ô_¯»¯¤ô  || ôÉ¯«¯¤ôà¯ø ôãôã¯¼¯¤¯±¯¤¯» ôÉô  ¯¤ôã¯áô_¯±¯¤ô  ¯¤ôã¯_¯±¯¬ô_ ¯¤ôã¯±ôö¯_ô_ ¯_ôãôä ¯£¯_ô_¯¤¯Á ¯¤ôãôÉ¯øô_ô ¯© 14-2-2016,2016-02-14 11:21:55+00:00,36.287871,37.0838783,ALEPPO : Harithan,RU_1222,Alleged civilian casualties from Russian attacksoawcHWwe1QI,The destruction of residential property after Russian airstrikes on Duma,baladi- news,¯¢¯Ç¯¤¯± ¯¤ôã¯øôÉ¯¤¯± ¯¤ôã¯¡ô_ ¯_ôãôÔ ¯¬¯¤ôãôÉô ¯¤¯_ôã ¯¤ôã¯_ôÄô ô_¯© ¯Â¯±¯¤¯Á ôâ¯µô ¯áô_¯±¯¤ô  ¯¤ôã¯¤¯_¯»ôã¯¤ôã ¯¤ôã¯±ôö¯_ô_ ôÉ¯øô_ô ¯© ¯øôöôÉ¯¤,2016-02-14 10:19:44+00:00,33.5709426,36.3968945,DAMASCUS : Duma,RU_1223,Alleged civilian casualties from Russian attacksUO_6HtFq7cU,Russian warplanes flying over the Daraa eastern countryside.,SMO Syria,¯»¯_ôãô_ôâ ôãôã¯áô_¯±¯¤¯¤ô  ¯¤ôã¯_¯±¯¬ô_ ¯¤ôã¯±ôö¯_ô_ ôô_ ¯_ôÉ¯¤¯Á ¯±ô_ô ¯ø¯±¯_¯¤ ¯¤ôã¯«¯±ôâô_ 14-2-2016,2016-02-14 09:40:09+00:00,32.6228886,36.0819402,DARAA,RU_1224,Alleged civilian casualties from Russian attacksf-_1stscEj4,Qasioun News: Daraa: Russian warplanes mount airstrikes over Tal Alaqeyat area 13-2-2016,Qasion News Agency EN,ôöôÄ¯¤ôã¯© ôâ¯¤¯_ô_ôöô : ¯ø¯±¯_¯¤: ¯¤ôã¯áô_¯±¯¤ô  ¯¤ôã¯_¯±¯¬ô_ ¯¤ôã¯±ôö¯_ô_ ô_ô ô¯¡ ¯¼¯¤¯±¯¤¯» ¯Âôöô_¯© ¯_ôãôä ôÉô ¯áôâ¯© ¯»ôã ¯¤ôã¯_ôã¯¤ôâô_¯¤¯» 13-2-2016,2016-02-14 08:50:44+00:00,32.6228886,36.0819402,DARAA,RU_1225,Alleged civilian casualties from Russian attacksAM3bLX7ib-4,Qasioun News: Homs: Destruction remnants caused by the Russian airstrikes over Rastan city 13-2-2016,Qasion News Agency EN,ôöôÄ¯¤ôã¯© ôâ¯¤¯_ô_ôöô : ¯_ôÉ¯µ: ¯¤¯Ç¯¤¯± ¯¤ôã¯øôÉ¯¤¯± ¯Â¯±¯¤¯Á ¯¤ôã¯¼¯¤¯±¯¤¯» ¯¤ôã¯Âôöô_¯© ¯¤ôã¯±ôö¯_ô_¯© ¯_ôãôä ôÉ¯øô_ô ¯© ¯¤ôã¯±¯_¯»ô  13-2-2016,2016-02-14 08:47:09+00:00,34.91639,36.733818,HOMS : Rastan,RU_1226,Alleged civilian casualties from Russian attackskoiNaQZeFdc,"Houla, Kaiseen: signs of destruction in the village after it was subjected to air strikes by Russian aircrafts.",ôÉ¯±ôÄ¯_ ¯_ôÉ¯µ ¯¤ôã¯´¯_ôã¯¤ôÉô_-Homs media centre,"tmp 2274 ¯¤ôã¯_ôöôã¯© ôÄô_¯_ô_ô  ¯¤¯Ç¯¤¯± ¯¤ôã¯øôÉ¯¤¯± ôô_ ¯¤ôãôâ¯±ô_¯© ¯¬¯_¯ø ¯»¯_¯±¯¦ôà¯¤ ôã¯¼¯¤¯±¯¤¯» ôÉô  ¯¤ôã¯áô_¯±¯¤ô  ‰ÛÇ¯¤ôã¯±ôö¯_ô_ 2 1284005407",2016-02-14 08:31:44+00:00,34.9015456,36.6218176,,RU_1227,Alleged civilian casualties from Russian attacksDxW-F3zEAeo,"Houla, Kaiseen: signs of destruction in the village after it was subjected to air strikes by Russian aircrafts.",ôÉ¯±ôÄ¯_ ¯_ôÉ¯µ ¯¤ôã¯´¯_ôã¯¤ôÉô_-Homs media centre,tmp 2274 ¯¤ôã¯_ôöôã¯© ôÄô_¯_ô_ô  ¯¤¯Ç¯¤¯± ¯¤ôã¯øôÉ¯¤¯± ôô_ ¯¤ôãôâ¯±ô_¯© ¯¬¯_¯ø ¯»¯_¯±¯¦ôà¯¤ ôã¯¼¯¤¯±¯¤¯» ôÉô  ¯¤ôã¯áô_¯±¯¤ô  ‰ÛÇ¯¤ôã¯±ôö¯_ô_ 3 2141054542,2016-02-14 08:31:44+00:00,34.9015456,36.6218176,,RU_1228,Alleged civilian casualties from Russian attacks_YCIrgkDzls,"Dara / Eastern Region | Monitoring the flight of Russian warplanes in the skies of the region",ô¯±ô_ôÛôâ ¯¤ôã¯¼ôÛ¯±¯¤ô_¯¤ ¯¤ôã¯´¯_ôÛôã¯¤ôÉô_ Al Ghraya Media Team,¯ø¯±¯_¯¤ / ¯¤ôãôÉô ¯áôâ¯© ¯¤ôã¯«¯±ôâô_¯© | ¯±¯µ¯ø ¯»¯_ôãô_ôâ ¯¤ôã¯áô_¯±¯¤ô  ¯¤ôã¯_¯±¯¬ô_ ¯¤ôã¯±ôö¯_ô_ ôô_ ¯_ôÉ¯¤¯Á ¯¤ôãôÉô ¯áôâ¯© 14.2.2016,2016-02-14 07:47:37+00:00,32.6783603,36.2606822,DARAA : Eastern Al-Ghariyah,RU_1229,Alleged civilian casualties from Russian attacksNRc60522IM0,Effects of shelling by Russian aircrafts on Ghariyah Sharkiyah.,¯¤¯¬ôö ¯_ô ¯ø¯_ ¯¤ôã¯_ôö¯±¯¤ô ô_-Abo Sundos alhorany,¯¢¯Ç¯¤¯± ¯¤ôãôâ¯µô ¯¬¯¤ôã¯áô_¯±¯¤ô  ¯¤ôã¯±ôö¯_ô_ ¯_ôãôä ¯¤ôã¯¼¯¤¯±ô_¯© ¯¤ôã¯«¯±ôâô_¯©,2016-02-14 05:00:06+00:00,32.6783603,36.2606822,DARAA : Eastern Al-Ghariyah,RU_1230,Alleged civilian casualties from Russian attacksnH70E2PZONk,Air strikes carried out by the Russian occupation planes on Tal Refaat in northern countryside of Aleppo,ôöôÄ¯¤ôã¯© ¯«ôà¯¬¯¤ ¯¬¯±¯_ Shahba Press Agency,¯¤ôã¯¼¯¤¯±¯¤¯» ¯¤ôã¯Âôöô_¯© ¯¤ôã¯»ô_ ô ô¯¡¯»ôà¯¤ ¯á¯¤¯_¯±¯¤¯» ¯¤ôã¯¤¯_¯»ôã¯¤ôã ¯¤ôã¯±ôö¯_ô_ ¯_ôãôä ¯»ôã ¯±ô¯_¯» ôô_ ¯±ô_ô ¯_ôã¯¬ ¯¤ôã¯«ôÉ¯¤ôãô_.,2016-02-14 01:31:29+00:00,36å¡28'36N,37å¡5‰Û_50‰Û_E,ALEPPO : Tal Rifaat,RU_1231,Alleged civilian casualties from Russian attacksanDn3VLS1pY,Step || Watch the intensive flight of Russain warplanes in the skies countryside of Idlib,Step News Agency,¯¨¯áôö¯© ||¯«¯¤ôà¯ø ¯»¯_ôãô_ôâ ôÉôÄ¯Çô ôãôã¯áô_¯±¯¤ô  ¯¤ôã¯_¯±¯¬ô_ ¯¤ôã¯±ôö¯_ô_ ¯¬¯_ôÉ¯¤¯Á ¯±ô_ô ¯´¯øôã¯¬,2016-02-13 17:57:38+00:00,35.9266549,36.6180588,IDLIB,RU_1232,Alleged civilian casualties from Russian attacksmovafi2bpZU,Agency Qassioun | One of victim's parents talking about the reason for the death of his son in a Russian raid on the city of Rastan in Homs ,Qasioun News Agency,ôöôÄ¯¤ôã¯© ôâ¯¤¯_ô_ôöô  | ¯£¯_¯ø ¯¡ôöô_ ôâ¯»ô_ôã ô_¯»¯_¯ø¯Ç ¯_ô  ¯_¯¬¯¬ ôÉôâ¯»ôãôà ôô_ ¯¼¯¤¯±¯© ¯±ôö¯_ô_¯© ¯_ôãôä ôÉ¯øô_ô ¯© ¯¤ôã¯±¯_¯»ô  ¯¬¯_ôÉ¯µ 13-2-2016,2016-02-13 15:38:03+00:00,34.91639,36.733818,HOMS : Rastan,RU_1233,Alleged civilian casualties from Russian attacks08VX5DeXFeg,Important: the place where a rocket fired by Russian aircrafts landed in the Al Sawarah town of Daraa province.,SMO Syria,ôà¯¤ôÉ: ôÉôÄ¯¤ô  ¯_ôâôö¯á ¯£¯_¯ø ¯µôö¯¤¯±ô_¯¨ ¯¤ôã¯á¯¤¯_¯±¯¤¯» ¯¤ôã¯±ôö¯_ô_¯© ôô_ ¯¬ôã¯ø¯© ¯¤ôã¯µôö¯±¯© ¯¬¯±ô_ô ¯ø¯±¯_¯¤,2016-02-13 11:30:08+00:00,32.7496273,36.2609177,DARAA : Al soura,RU_1234,Alleged civilian casualties from Russian attackslHnzQUmKXNc,Agency Qassioun | The effects of the devastation in the city of hamoria result of air strikes by Russian warplanes,Qasioun News Agency,ôöôÄ¯¤ôã¯© ôâ¯¤¯_ô_ôöô | ¯¢¯Ç¯¤¯± ¯¤ôã¯øôÉ¯¤¯± ôô_ ôÉ¯øô_ô ¯© ¯_ôÉôö¯±ô_¯© ¯Â¯±¯¤¯Á ¯¤ôã¯¼¯¤¯±¯¤¯» ¯¤ôã¯Âôöô_¯© ôÉô  ¯¤ôã¯áô_¯±¯¤ô  ¯¤ôã¯_¯±¯¬ô_ ¯¤ôã¯±ôö¯_ô_ 12-2-2016,2016-02-12 16:06:21+00:00,33.5296468,36.3848593,DAMASCUS : Hammuriyah,RU_1235,Alleged civilian casualties from Russian attacksoQoOf5WiS1M,Syria - Damascus suburb: a neavy air strike carried out by Russian warplanes on the Hammouriyeh area of Eastern Ghouta.,SMO Syria,¯_ôö¯±ô_¯¤ - ¯±ô_ô_¯øôÉ¯«ôâ : ¯¼¯¤¯±¯© ¯Âôöô_¯© ¯_ô ô_ô¯© ô ô¯¡ôà¯¤ ¯¤ôã¯áô_¯±¯¤ô  ¯¤ôã¯_¯±¯¬ô_ ¯¤ôã¯±ôö¯_ô_ ¯_ôãôä ¯¬ôã¯ø¯© ¯_ôÉôö¯±ô_¯© ôô_ ¯¤ôã¯¼ôö¯á¯© ¯¤ôã¯«¯±ôâô_¯©,2016-02-12 15:47:17+00:00,33.5296468,36.3848593,DAMASCUS : Hammuriyah,RU_1236,Alleged civilian casualties from Russian attacksintxEUENJ2U,Syria - Damascus suburb: Russian warplanes flying over Eastern Ghouta.,SMO Syria,¯_ôö¯±ô_¯¤ - ¯±ô_ô_¯øôÉ¯«ôâ : ¯»¯_ôãô_ôâ ôãôã¯áô_¯±¯¤ô  ¯¤ôã¯_¯±¯¬ô_ ¯¤ôã¯±ôö¯_ô_ ôô_ ¯_ôÉ¯¤¯Á ¯¤ôã¯¼ôö¯á¯© ¯¤ôã¯«¯±ôâô_¯© 12-2-2016,2016-02-12 14:50:55+00:00,33.5296468,36.3848593,DAMASCUS : Eastern Ghouta,RU_1237,Alleged civilian casualties from Russian attackseTcgrM55B_k,Destruction in houses and residential neighborhoods in the Kafarbatna suburb after it was targeted by Russian warplanes.,SMO Syria,¯øôÉ¯¤¯± ¯¤ôãôÉô ¯¤¯_ôã ôö¯¤ôã¯£¯_ô_¯¤¯Á ¯¤ôã¯_ôÄô ô_¯© ôô_ ôÉ¯øô_ô ¯© ôÄô¯±¯¬¯áô ¯¤ ¯´¯Ç¯± ¯´¯_¯»ôà¯ø¯¤ôôà¯¤ ôÉô  ôâ¯¬ôã ¯¤ôã¯áô_¯±¯¤ô  ¯¤ôã¯_¯±¯¬ô_ ¯¤ôã¯±ôö¯_ô_,2016-02-12 13:54:17+00:00,33.514295,36.373479,DAMASCUS : Kafar Batna,RU_1238,Alleged civilian casualties from Russian attacks8WaTcbH-aOw,Four air raids by the Russian warplanes on the city Kafr Zita in Hama countryside ,¯¤ôãôÉ¯±ôÄ¯_ ¯¤ôã¯µ¯_ôô_ ¯¤ôã¯_ôö¯±ô_-Syrian Press Centre,¯£¯±¯¬¯_ ¯¼¯¤¯±¯¤¯» ¯Âôöô_¯© ¯«ô ôà¯¤ ¯¤ôã¯áô_¯±¯¤ô  ¯¤ôã¯_¯±¯¬ô_ ¯¤ôã¯±ôö¯_ô_ ¯_ôãôä ôÉ¯øô_ô ¯© ôÄô¯±¯_ô_¯»¯¤ ¯¬¯±ô_ô ¯_ôÉ¯¤¯©,2016-02-12 13:46:35+00:00,35.373461,36.601458,HAMA : KafrZita,RU_1239,Alleged civilian casualties from Russian attacksoyeXCgAzVmQ,Sham Deraa Naemeh martyrs by the Russian aviation bombarded video too harsh warning P1,ShaamNetwork S.N.N,¯«¯¤ôÉ ¯ø¯±¯_¯¤ ¯¤ôãô ¯_ô_ôÉ¯© ¯«ôà¯ø¯¤¯Á ¯¬ôâ¯µô ôãôã¯áô_¯±¯¤ô  ¯¤ôã¯±ôö¯_ô_ 12 2 2016 ¯»¯_¯¡ô_¯± ¯¤ôãôô_¯øô_ôö ôâ¯¤¯_ô_ ¯Â¯ø¯¤ôÜ ¯ÂôÛ1,2016-02-12 13:21:41+00:00,32.63574722,36.15920556,DARAA : Al naymah,RU_1240,Alleged civilian casualties from Russian attackseZ0BNxAlN3c,Sham Al-Ghantu Homs massacre against the civilian aviation bombarded the Russian video warning very tough P4,ShaamNetwork S.N.N,¯«¯¤ôÉ ¯_ôÉ¯µ ¯¤ôã¯¼ô ¯áôö ôÉ¯Â¯_¯±¯© ¯¬¯_ôâ ¯¤ôãôÉ¯øô ô_ô_ô  ¯¬ôâ¯µô ôãôã¯áô_¯±¯¤ô  ¯¤ôã¯±ôö¯_ô_ 12 2 2016 ¯»¯_¯¡ô_¯± ¯¤ôãôô_¯øô_ôö ôâ¯¤¯_ô_ ¯Â¯ø¯¤ôÜ ¯Â4,2016-02-12 12:11:21+00:00,34.8223907,36.6935635,HOMS : Al-Ghantu,RU_1241,Alleged civilian casualties from Russian attacksz-9JISCtiyQ,"Sham Al-Ghantu Homs massacre against the civilian aviation bombarded the Russian video warning very tough p3",ShaamNetwork S.N.N,¯«¯¤ôÉ ¯_ôÉ¯µ ¯¤ôã¯¼ô ¯áôö ôÉ¯Â¯_¯±¯© ¯¬¯_ôâ ¯¤ôãôÉ¯øô ô_ô_ô  ¯¬ôâ¯µô ôãôã¯áô_¯±¯¤ô  ¯¤ôã¯±ôö¯_ô_ 12 2 2016 ¯»¯_¯¡ô_¯± ¯¤ôãôô_¯øô_ôö ôâ¯¤¯_ô_ ¯Â¯ø¯¤ôÜ ¯Â3,2016-02-12 12:11:13+00:00,34.8223907,36.6935635,HOMS : Al-Ghantu,RU_1242,Alleged civilian casualties from Russian attacks20QlVvnsYqc,The destruction in Kafer Khasher village in the northern countryside of Aleppo following bombing by Russian aircraft,baladi- news,¯¢¯Ç¯¤¯± ¯¤ôã¯øôÉ¯¤¯± ôô_ ôâ¯±ô_¯© ôÄô¯± ¯¨¯¤¯«¯± ¯¬¯±ô_ô ¯_ôã¯¬ ¯¤ôã¯«ôÉ¯¤ôãô_ ¯¬¯_¯ø ôâ¯µôôà¯¤ ôÉô  ôâ¯¬ôã ¯áô_¯±¯¤ô  ¯¤ôã¯¤¯_¯»ôã¯¤ôã ¯¤ôã¯±ôö¯_ô_,2016-02-12 09:51:19+00:00,36å¡32'51.44,37å¡ 3'46.23,ALEPPO : Kafer Khasher,RU_1243,Alleged civilian casualties from Russian attacksO6vbohY4kGs,Al-Ghantu Homs civilians wounded by the strikes of the aviation Russian occupation to revive town,motasem homs,¯¤ôã¯¼ô ¯áôö ¯_ôÉ¯µ ¯Â¯±¯_ôä ¯¤ôãôÉ¯øô ô_ô  ¯Â¯±¯¤¯Á ¯¤ôã¯¼¯¤¯±¯¤¯» ôÉô  ¯¤ôã¯áô_¯±¯¤ô  ¯¤ôã¯¤¯_¯»ôã¯¤ôã ¯¤ôã¯±ôö¯_ô_ ¯_ôãôä ¯¤¯_ô_¯¤¯Á ¯¤ôã¯¬ôã¯ø¯©12/2/2016,2016-02-12 07:41:23+00:00,34.8223907,36.6935635,HOMS : Al-Ghantu,RU_1244,Alleged civilian casualties from Russian attacksJvBgMBPTGSY,Al-Ghantu Homs important moment steric rocket blast by the Russian occupation aircrafts in the revival of the town 12/2,motasem homs,¯¤ôã¯¼ô ¯áôö¯_ôÉ¯µ ôà¯¤¯¤¯¤ôÉ ôã¯_¯ü¯© ¯¤ô ô¯Â¯¤¯± ¯¤ôã¯µôö¯¤¯±ô_¯¨ ¯¤ôãô¯±¯¤¯¼ô_¯© ôÉô  ¯áô_¯±¯¤ô  ¯¤ôã¯¤¯_¯»ôã¯¤ôã ¯¤ôã¯±ôö¯_ô_ ôô_ ¯¤¯_ô_¯¤¯Á ¯¤ôã¯¬ôã¯ø¯©12/2,2016-02-12 07:19:19+00:00,34.8223907,36.6935635,HOMS : Al-Ghantu,RU_1245,Alleged civilian casualties from Russian attacksDKZwEijGIP4,Transporting wounded after Russian warplanes targeted Ghantoo village.,¯«¯¬ôÄ¯© ¯»ôã¯¬ô_¯_¯© ôÉ¯¬¯¤¯«¯±-Talbisah network,ô ôâôã ¯Â¯±¯_ôä ô ¯»ô_¯Â¯© ¯¤¯_¯»ôà¯ø¯¤ô ¯¤ôã¯_¯±¯¬ô_ ¯¤ôã¯±ôö¯_ô_ ôãôâ¯±ô_¯© ¯¤ôã¯¼ô ¯áôö,2016-02-12 06:21:15+00:00,34.8223907,36.6935635,HO